550554194,"12 oz savannah cafe latte - sea foam green","",,,,,"Impress any colleague or client with a gift they can use at any coffee or tea break! This 12 oz. Savannah Cafe Latte Mug in sea foam green features an ear-shaped handle and a tapered bottom that sets it apart in the crowd. This updated take on the classic mug shape will feature a silkscreen imprint of your advertising information for branded promotional power that you can count on. Whether you're setting up your tradeshow table or preparing for an incentive program, this is the right product to get your started.",,"http://media.asicdn.com/images/jpgb/22330000/22333809.jpg",,"Mugs & Steins-Ceramic",,"Green,Medium Green,Multi color","Ceramic,Stoneware","Volume/Weight","12:oz","",,,"CHINA",,,,,,,"Silkscreen, Unimprinted",,"","Gold, Other Colors, Platinum","Y","Y","","",,,"Y",,"","","",,"","","","",,"","N","",,,,,,"Ceramic 12 oz. latte mug with ear shape handle",,,"144","288","576","1008","2016","5000",,,,,"2.97","2.89","2.81","2.77","2.74","2.71",,,,,"R","R","R","R","R","R",,,,,,"1 color imprint only.",,"USD",,"List","Silkscreen, Unimprinted","IMMD:Silkscreen, Unimprinted",,"Set-up Charge","Per Order","Required","1",,,,,,,,,,"50.00",,,,,,,,,,"Z",,,,,,,,,,"",,,,,,,,,,,,,,"N",,,,,,"Promotional","N",,,"Y","None",,,,
4868633,"Neon Buy  Write pencil","",,,,,"Customized neon pencils pull all eyes to your logo for one low price! Available in bright colors, these unsharpened pencils feature a black ferrule, Number 2 Graphite insert and a rubber eraser. Add an extra dimension by including your company logo, message or slogan on this wooden pencil. The coordinating eraser and barrel create a unique color combo that will help set your branding apart from the competition.",,"http://media.asicdn.com/images/jpgb/6030000/6032060.jpg",,"Pencils-Standard",,"Green,Orange,Pink,Yellow","Basswood","","","",,,"CHINA",,,,,,,"Spot Color Imprint, Unimprinted",,"Art Proof (Art proof)","Black, Brown, Burgundy, dark green, Emerald Green, Gray, Green, Maroon, Metallic Gold, Metallic Silver, Navy, Orange, Pink, Process Blue, Purple, Red, Reflex Blue, Royal Blue, Teal, White, Yellow Gold","Y","","13/16"" x 4 1/4""","",,,"Y",,"5,7","Y","1:	",,"","","","",,"Varies by order quantity, see website for details.","N","",,,,,,"Neon Buy  Write pencil",,,"1000",,,,,,,,,,"0.17",,,,,,,,,,"R",,,,,,,,,,,"One color print",,"USD",,"List","Spot Color Imprint, Unimprinted","IMMD:Spot Color Imprint, Unimprinted",,"Imprint Method Charge","Per Order","Required","1",,,,,,,,,,"50.00",,,,,,,,,,"Z",,,,,,,,,,"per color, per locationYou may order less than the minimum quantity",,,,,,,,,,,,,,"N",,,,,,"Promotional","N",,,"Y","None",,,,
4868633,,,,,,,,,,,,,,,,,,,,,,,,,,,,,,,,,,,,,,,,,,,,,,,,,,,,,,,,,,,,,,,,,,,,,,,,,,,,,,,,,,,,,,,,,,,,,,,"Product Sample","SMPL:Product Sample",,"Sample Charge","Other","Optional","1",,,,,,,,,,"50.00",,,,,,,,,,"Z",,,,,,,,,,"",,,,,,,,,,,,,,,,,,,,,,,,,,,,,
4868633,,,,,,,,,,,,,,,,,,,,,,,,,,,,,,,,,,,,,,,,,,,,,,,,,,,,,,,,,,,,,,,,,,,,,,,,,,,,,,,,,,,,,,,,,,,,,,,"Art Proof (Art proof)","ARTW:Art Proof (Art proof)",,"Artwork Charge","Other","Optional","1",,,,,,,,,,"15.00",,,,,,,,,,"Z",,,,,,,,,,"",,,,,,,,,,,,,,,,,,,,,,,,,,,,,
550591794,"11 Oz Hilo C-Handle Ð White","",,,,,"Stock up on the promotional basics when it's time for your next advertising effort with this 11 oz. Hilo C-Handle D Mug! This practical and promotional ceramic mug features a matte black exterior and a white interior with a color glazed accent that adds a bold touch that will set your brand apart in the crowd. This tried-and-true promotional classic will feature your organization's name and logo in bold silkscreen imprinting. Create yours and get started on your promotional effort today!",,"http://media.asicdn.com/images/jpgb/22390000/22395956.jpg",,"Mugs & Steins-Ceramic",,"Black,Multi color","Ceramic,Stoneware","Volume/Weight","11:oz","",,,"CHINA",,,,,,,"Silkscreen, Unimprinted",,"","","Y","Y","","",,,"Y",,"","","",,"","","","",,"","N","",,,,,,"Ceramic 11 oz C-Handle Mug",,,"144","288","576","1008","2016","5000",,,,,"2.47","2.39","2.31","2.27","2.24","2.21",,,,,"R","R","R","R","R","R",,,,,,"1 color imprint only.",,"USD",,"List","Silkscreen, Unimprinted","IMMD:Silkscreen, Unimprinted",,"Set-up Charge","Per Order","Required","1",,,,,,,,,,"50.00",,,,,,,,,,"Z",,,,,,,,,,"",,,,,,,,,,,,,,"N",,,,,,"Promotional","N",,,"Y","None",,,,
7321186,"Monticello (TM) Gift Set","",,,,,"You'll always ""set"" your message apart with the Monticello(TM) gift set! This appealing gift set includes a medium 1.0 millimeter retractable ballpoint pen with black ink only, plus a 0.7 millimeter mechanical pencil, HB core only. Available in multiple colors, both come in a clear case and feature a translucent color barrel and comfortable matching grip. It's great for any event. Have your imprint pad printed or silkscreened when you order now!",,"http://media.asicdn.com/images/jpgb/20080000/20085018.jpg",,"PEN & PENCIL SETS",,"","","","","",,,"CHINA",,,,,,,"Pad Print, Silkscreen, Unimprinted",,"","Black, Brown, dark green, Fire Red, Gold, Gray, Green, light green, Maroon, Metallic Silver, Orange, Pink, Purple, Red, Reflex Blue, Rhodamine Red, Teal, Ultra Blue, Violet, White, Yellow","Y","","1/2"" x 1 1/2""","",,,"Y",,"5","","",,"","","","147:lbs",,". per 1,000 sets.","N","",,,,,,"Monticello (TM) Gift Set",,,"50","75","100","150","200",,,,,,"4.75","4.55","4.35","4.20","4.10",,,,,,"R","R","R","R","R",,,,,,,"1 color imprint",,"USD",,"List","Silkscreen, Pad Print, Unimprinted (Sold Unimprinted)","IMMD:Silkscreen, Pad Print, Unimprinted (Sold Unimprinted)",,"Imprint Method Charge","Per Order","Required","1",,,,,,,,,,"30.00",,,,,,,,,,"Z",,,,,,,,,,"",,,,,,,,,,,,,,"N",,,,,,"Promotional","N",,,"Y","None",,,,
550554215,"16 oz cafe latte gloss - white","",,,,,"From Saturday morning coffee to weekday afternoon pick-me-ups, making your brand a part of their everyday routine is easy with this white 16 oz. Cafe Latte Gloss Mug. The new, large capacity mug comes in a trendy and inspiring style that's sure to set your brand apart from the competition at any event or occasion. Add a silkscreen imprint of your logo and advertising message and put your brand directly in the hands of those who matter most with something they can put to use at any coffee or tea break.",,"http://media.asicdn.com/images/jpgb/22330000/22333638.jpg",,"Mugs & Steins-Ceramic",,"White","Ceramic,Stoneware","Volume/Weight","16:oz","",,,"CHINA",,,,,,,"Silkscreen, Unimprinted",,"","Gold, Other Colors, Platinum","Y","Y","","",,,"Y",,"","","",,"","","","",,"","N","",,,,,,"White",,,"144","288","576","1008","2016","5000",,,,,"2.39","2.31","2.23","2.19","2.16","2.13",,,,,"R","R","R","R","R","R",,,,,,"1 color imprint only.",,"USD",,"List","Silkscreen, Unimprinted","IMMD:Silkscreen, Unimprinted",,"Set-up Charge","Per Order","Required","1",,,,,,,,,,"50.00",,,,,,,,,,"Z",,,,,,,,,,"",,,,,,,,,,,,,,"N",,,,,,"Promotional","N",,,"Y","None",,,,
550531509,"Custom Reflective Lanyards","",,,,,"They have reflective printing on a polyester lanyard. The contrasting colors makes them stand apart and are ideal for outdoor laborers or where visibility is a top priority. With high quality reflective ink imprinted the logo will be silk screened onto the reflective area.  Black color logo is recommended since it produces the best result.",,"http://media.asicdn.com/images/jpgb/22180000/22181601.jpg",,"Badge Holders-General,LANYARDS",,"PMS s","Polyester","Dimension","Length:5/8:in","Ribbon",,,"CHINA",,,,,,,"Printed, Silkscreen",,"","","","","","",,,"Y",,"10","","",,"","","","",,"","N","",,,,,,"Custom Reflective 5/8""",,,"500","1000","3000","5000","10000","20000",,,,,"1.76","1.66","1.56","1.46","1.36","1.26",,,,,"R","R","R","R","R","R",,,,,,"1 Color, 1 Side Printing and 1 Set Up.",,"USD",,"List",,,,,,,,,,,,,,,,,,,,,,,,,,,,,,,,,,,,,,,,,,,,,,,,,,,"N",,,,,,"Promotional","N",,,"Y","None",,,,
550592092,"15 oz savannah spokane - slate blue","",,,,,"Create a promotional foundation that you can rely on with the look of this 15 oz. Savannah Spokane Mug in slate blue. This new, larger style mug comes in a trendy and inspiring fashion that sets it apart from other mugs. Complete the promotional look with an available silkscreen imprint of your organization's name, logo and advertising message and take this winner to your next tradeshow appearance, fundraising effort and more!",,"http://media.asicdn.com/images/jpgb/22390000/22395701.jpg",,"Mugs & Steins-Ceramic",,"Blue,Light Blue,Medium Blue,Multi color","Ceramic,Stoneware","Volume/Weight","15:oz","",,,"CHINA",,,,,,,"Silkscreen, Unimprinted",,"","","Y","Y","","",,,"Y",,"","","",,"","","","",,"","N","",,,,,,"15 oz. ceramic mug",,,"12","24","36","72",,,,,,,"8.27","6.60","5.76","4.76",,,,,,,"R","R","R","R",,,,,,,,"1 color imprint only.",,"USD",,"List","Silkscreen, Unimprinted","IMMD:Silkscreen, Unimprinted",,"Set-up Charge","Per Order","Required","1",,,,,,,,,,"50.00",,,,,,,,,,"Z",,,,,,,,,,"",,,,,,,,,,,,,,"N",,,,,,"Promotional","N",,,"Y","None",,,,
550554202,"13 oz santa fe endeavor - charcoal gray","",,,,,"Give java enthusiasts a new way to enjoy their favorite beverage while showing off your brand! This 13 oz. Santa Fe Endeavor Mug in charcoal gray is perfectly sized to appeal to all coffee drinkers and features an updated shape that sets it apart in the crowd. Your organization's name, logo and advertising message will stand out in available silkscreen imprinting. Get noticed with something that recipients can put to use at every coffee break!",,"http://media.asicdn.com/images/jpgb/22330000/22333835.jpg",,"Mugs & Steins-Ceramic",,"Black,Grey,Gray,Multi color","Ceramic,Stoneware","Volume/Weight","13:oz","",,,"CHINA",,,,,,,"Silkscreen, Unimprinted",,"","Gold, Other Colors, Platinum","Y","Y","","",,,"Y",,"","","",,"","","","",,"","N","",,,,,,"Ceramic 13 oz. mug with matching ""C"" handle",,,"144","288","576","1008","2016","5000",,,,,"3.12","3.04","2.96","2.92","2.89","2.86",,,,,"R","R","R","R","R","R",,,,,,"1 color imprint only.",,"USD",,"List","Silkscreen, Unimprinted","IMMD:Silkscreen, Unimprinted",,"Set-up Charge","Per Order","Required","1",,,,,,,,,,"50.00",,,,,,,,,,"Z",,,,,,,,,,"",,,,,,,,,,,,,,"N",,,,,,"Promotional","N",,,"Y","None",,,,
550554118,"15 oz halo el grande - cobalt handle","",,,,,"Put your brand in the hands of clients, colleagues, executives and beyond with a foundational promotional product that you can count on for results. The 15 oz. Halo El Grande mug is an exciting variation on the bestselling C-handle ceramic coffee mug. It features a cobalt blue handle and matching color stripe halo accent that add a touch of eye-catching color that will set your brand apart from the competition in an array of settings.",,"http://media.asicdn.com/images/jpgb/22330000/22333597.jpg",,"Mugs & Steins-Ceramic",,"Blue,Cobalt Blue,Dark Blue,White,Multi color","Ceramic,Stoneware","Volume/Weight","15:oz","",,,"CHINA",,,,,,,"Silkscreen, Unimprinted",,"","Gold, Other Colors, Platinum","Y","Y","","",,,"Y",,"","","",,"","","","",,"","N","",,,,,,"White ceramic 15 oz. mug with cobalt blue rim/handle",,,"144","288","576","1008","2016","5000",,,,,"2.75","2.67","2.59","2.55","2.52","2.49",,,,,"R","R","R","R","R","R",,,,,,"1 color imprint only.",,"USD",,"List","Silkscreen, Unimprinted","IMMD:Silkscreen, Unimprinted",,"Set-up Charge","Per Order","Required","1",,,,,,,,,,"50.00",,,,,,,,,,"Z",,,,,,,,,,"",,,,,,,,,,,,,,"N",,,,,,"Promotional","N",,,"Y","None",,,,
550591828,"12 Oz Effect Black Out - Ocean Blue In","",,,,,"Add a touch of color to your advertising efforts and give recipients something they can use at any tea or coffee break with this 12 oz. Effect Mug. It features a black exterior and an ocean blue colored interior with a trendy design that will truly set your promotional apart. Line your tradeshow table or welcome new hires with a promotional tool that's perfect for a variety of industries, recipients, events and occasions as well as everyday use.",,"http://media.asicdn.com/images/jpgb/22390000/22395904.jpg",,"Mugs & Steins-Ceramic",,"Black,Blue,Medium Blue,Cobalt Blue,Multi color","Ceramic,Stoneware","Volume/Weight","12:oz","",,,"CHINA",,,,,,,"Silkscreen, Unimprinted",,"","","Y","Y","","",,,"Y",,"","","",,"","","","",,"","N","",,,,,,"Mug",,,"144","288","576","1008","2016","5000",,,,,"2.61","2.53","2.45","2.41","2.38","2.35",,,,,"R","R","R","R","R","R",,,,,,"1 color imprint only.",,"USD",,"List","Silkscreen, Unimprinted","IMMD:Silkscreen, Unimprinted",,"Set-up Charge","Per Order","Required","1",,,,,,,,,,"50.00",,,,,,,,,,"Z",,,,,,,,,,"",,,,,,,,,,,,,,"N",,,,,,"Promotional","N",,,"Y","None",,,,
551012652,"Hybrid 2-In-1 Cooler","",,,,,"Special Pricing. Sale price in effect through 12/31/2016. Two fully insulated compartments with heat-sealed liner that zip apart in to two separate coolers.  Holds 24 cans in large compartment. Holds 6 cans or two wine bottles with inside divider in smaller compartment.   Two side pockets. Zippered front pocket and mesh front pocket. Adjustable non-slip shoulder strap that will also clip on to the smaller compartment when it is unzipped from the larger compartment.",,"http://media.asicdn.com/images/jpgb/23850000/23855164.jpg",,"COOLERS",,"Black","Polyester","Dimension","Length:15:in;Width:8.5:in;Height:13.5:in","",,,"CHINA",,,,,,,"Embroidered, Heat Transfer, Silkscreen",,"","","","Y","4"" Diameter, 4""L x 6""H, 6""L x 6""H","Front Pocket - Embroidered, Front Pocket - Heat Transfer, Front Pocket - Silkscreen, Top (Large Section), Side Pocket (Small Section",,,"Y",,"4","Y","",,"","20:per Box","17:in;16:in;20:in","20:lbs",,"","N","",,,,,,"Hybrid 2-In-1 Cooler",,,"10","100","250","500","1000",,,,,,"30.89","29.99","26.47","23.56","22.65",,,,,,"R","R","R","R","R",,,,,,,"1 color imprint",,"USD",,"List","Silkscreen, Heat Transfer, Embroidered","IMMD:Silkscreen, Heat Transfer, Embroidered",,"Set-up Charge","Other","Required","1",,,,,,,,,,"62.50",,,,,,,,,,"Z",,,,,,,,,,"Per 1,000 stitches",,,,,,,,,,,,,,"N",,,,,,"Promotional","N",,,"Y","None",,,,
550554193,"12 oz savannah cafe latte - chocolate","",,,,,"Create the perfect mug for your upcoming advertising effort with an updated take on a promotional classic. With a rich chocolate brown color, this 12 oz. Savannah Cafe Latte Mug features an ear-shaped handle and a tapered bottom that sets it apart in the crowd. This updated take on the classic mug shape will feature a silkscreen imprint of your advertising information for branded promotional power that you can count on. Whether you're setting up your tradeshow table or preparing for an incentive program, this is the right product to get your started.",,"http://media.asicdn.com/images/jpgb/22330000/22333798.jpg",,"Mugs & Steins-Ceramic",,"Brown,Chocolate Brown,Light Brown,Multi color","Ceramic,Stoneware","Volume/Weight","12:oz","",,,"CHINA",,,,,,,"Silkscreen, Unimprinted",,"","Gold, Other Colors, Platinum","Y","Y","","",,,"Y",,"","","",,"","","","",,"","N","",,,,,,"Ceramic 12 oz. latte mug with ear shape handle",,,"144","288","576","1008","2016","5000",,,,,"2.97","2.89","2.81","2.77","2.74","2.71",,,,,"R","R","R","R","R","R",,,,,,"1 color imprint only.",,"USD",,"List","Silkscreen, Unimprinted","IMMD:Silkscreen, Unimprinted",,"Set-up Charge","Per Order","Required","1",,,,,,,,,,"50.00",,,,,,,,,,"Z",,,,,,,,,,"",,,,,,,,,,,,,,"N",,,,,,"Promotional","N",,,"Y","None",,,,
550224893,"Reusable Water Bottle, 24 oz. Tritan (TM) BPA Free","",,,,,"Reusable water bottle, 24 oz. Tritan (TM), BPA free. Looks like a disposable bottle. Bottled water bottle that is reusable. Screw apart top, made for easy cleaning. Screw on colored cap. Made from durable Eastman Tritan (TM) Copolyester. Impatc resistant plastic, shatter free. Odor resistant, stain resistant. Eco friendly. 24 oz. size. Exceptional dishwasher durability. Encourages proper sanitation for greater plastic container safety. Not microwave or dishwasher safe. Hand was only. Inserted free into a polybag. Overall size: 9 1/4"" H x 2 3/4"" D.",,"http://media.asicdn.com/images/jpgb/20880000/20889016.jpg",,"Bottles-Sport Type,ENVIRONMENTALLY FRIENDLY PRODUCTS",,"Blue,Red,Black","Tritan (TM)","Volume/Weight","24:oz","",,,"CHINA",,,,,,,"Printed",,"","","","","2 1/4"" H x 2 1/4"" W","",,,"Y",,"5","Y","",,"","48:per case","19:in;19.5:in;13:in","19:lbs",,"","N","",,,,,,"Reusable Water Bottle, 24 oz. Tritan (TM) BPA Free",,,"50","100","250","500","1000",,,,,,"5.50","5.40","5.20","5.00","4.90",,,,,,"R","R","R","R","R",,,,,,,"one color, one location imprint",,"USD",,"List","Printed","IMMD:Printed",,"Set-up Charge","Other","Required","1",,,,,,,,,,"45.00",,,,,,,,,,"Z",,,,,,,,,,"per color / per location",,,,,,,,,,,,,,"N",,,,,,"Promotional","N",,,"Y","None",,,,
5643787,"Magnetic cube puzzle with base","",,,,,"Put the pieces of success together with this magnetic cube puzzle! This cube shaped puzzle holds together magnetically and is bound to be a conversation started. Sitting on a cube base, this is the ideal product for any desk or shelf. Good for a multi-location imprint, this item can be customized to your specifications for a promotion that will stand apart from the rest. This item is great for social and corporate promotions alike.",,"http://media.asicdn.com/images/jpgb/21620000/21628708.jpg",,"Magnets-Industrial/Toy,Puzzles & Tricks-General",,"","","","","",,,"CHINA",,,,,,,"Printed",,"","","","","1 1/4"" x  1 1/4""","",,,"Y",,"10","Y","",,"Cardboard Box","","","",,"","N","",,,,,,"Magnetic cube puzzle with base",,,"25","50","100","250","500",,,,,,"27.35","24.85","23.30","22.20","21.75",,,,,,"R","R","R","R","R",,,,,,,"one location laser engraving",,"USD",,"List","Printed","IMMD:Printed",,"Set-up Charge","Per Order","Required","1",,,,,,,,,,"45.00",,,,,,,,,,"Z",,,,,,,,,,"Imprint charge",,,,,,,,,,,,,,"N",,,,,,"Promotional","N",,,"Y","None",,,,
6776228,"20 Oz Terra Vacuum Tumbler","",,,,,"Made of FDA compliant materials, this tumbler has a dual wall construction with 18-8 Stainless Steel, copper lined vacuum insulation that will hold your beverage at the ideal drinking temperature at least 8X longer. Featuring our patented designed lid that features lipand finger grooves that allow you to position the drinking spout without even looking. The tumbler also includes a leak proof screw on lid with a visual open/close push button locking closure and can come apart for easy cleaning. Also features a Silicone non-slip band. Overall Size: 9 1/4"" x 3 1/8"" x 3 1/8"" (H x W x D). Drinkware: ""Handwash Only"".",,"http://media.asicdn.com/images/jpgb/7190000/7193495.jpg",,"TRAVEL MUGS/CUPS",,"Stainless Steel,Green,Red,Brown,Blue","Stainless Steel","","","",,,"CHINA",,,,,,,"Laser Engraving, Pad Print, Unimprinted",,"","Blaze Orange, Gray","Y","Y","1"" H x 1 3/4"" W, 1"" H x 2"" W","Laser Engraving (H x W), Pad Print (H x W)",,,"Y",,"5","Y","3:	",,"Drawstring pouch","","","",,"","N","",,,,,,"20 Oz Terra Vacuum Tumbler",,,"24","48","96","244",,,,,,,"14.29","14.29","14.29","14.29",,,,,,,"R","R","R","R",,,,,,,,"one standard color or laser engraving on one location.",,"USD",,"List","Pad Print, Laser Engraving, Unimprinted","IMMD:Pad Print, Laser Engraving, Unimprinted",,"Set-up Charge","Per Order","Required","1",,,,,,,,,,"55.00",,,,,,,,,,"Z",,,,,,,,,,"Per set of initials or names. Maximum of 21 characters including spacesYou may order less than the minimum quantity                                                                            Imprint Color : Gray, Blaze Orange                                                                                                                                                                                                                                Imprint Size : 1"" H x 1 3/4"" W (H x W), 1"" H x 2"" W (H x W)                                                                                                                                                                                                            Imprint Method : Unimprinted                                                                                                                                Imprint Color : Gray                                                                                                                                                                                                                                Imprint Size : 1"" H x 1 3/4"" W (H x W), 1"" H x 2"" W (H x W)",,,,,,,,,,,,,,"N",,,,,,"Promotional","N",,,"Y","None",,,,
4858455,"Transparent Travel Toothbrush with Sleeve","",,,,,"You'll spread word of ""mouth"" without having to roll up your ""sleeves"" once you include this transparent travel toothbrush with a sleeve in your promotions! This two-piece toothbrush has a transparent casing, breaks apart and is self-contained. At 4"", this functional favor is perfect for any project, business, conference, convention or event. Have your logo imprinted so when you ""brush"" up success, your campaign message is abundantly ""clear!""",,"http://media.asicdn.com/images/jpgb/20080000/20085951.jpg",,"TOOTHBRUSHES,TRAVEL AMENITIES",,"White-Clear,Red-Clear,Blue-Clear,Yellow-Clear,Green-Clear","","Dimension","Length:4:in","",,,"CHINA",,,,,,,"Printed, Unimprinted",,"","","Y","Y","2 1/4"" x 7/16""","",,,"Y",,"5","Y","1:,4:	",,"","","","34:lbs",,"per 1000 pcs.","N","",,,,,,"Transparent Travel Toothbrush with Sleeve",,,"250","500","1000","2500","5000",,,,,,"1.00","0.90","0.75","0.70","0.65",,,,,,"R","R","R","R","R",,,,,,,"one color/one location imprint.",,"USD",,"List","Printed, Unimprinted (Sold Unimprinted)","IMMD:Printed, Unimprinted (Sold Unimprinted)",,"Set-up Charge","Per Order","Required","1",,,,,,,,,,"50.00",,,,,,,,,,"Z",,,,,,,,,,"",,,,,,,,,,,,,,"N",,,,,,"Promotional","N",,,"Y","None",,,,
4858455,,,,,,,,,,,,,,,,,,,,,,,,,,,,,,,,,,,,,,,,,,,,,,,,,,,,,,,,,,,,,,,,,,,,,,,,,,,,,,,,,,,,,,,,,,,,,,,"1 business days,4 business days","RUSH:1,4",,"Rush Service Charge","Other","Required","1",,,,,,,,,,"50.00",,,,,,,,,,"Z",,,,,,,,,,"",,,,,,,,,,,,,,,,,,,,,,,,,,,,,
550225970,"Metalix (TM ) Stand","",,,,,"If you're looking to stand up to the competition during your next promotional campaign, hand out the Metalix (TM) stand! Made of brushed premium stainless steel and measuring 4"" x 2 7/8"", this useful item features a sleek, high-end design with deburred edges to prevent cuts and scratches. It has a dock hole for charging cord management and works with most phones. Ships flat in an embossed gift sleeve. Customize with an imprint of your brand logo to stand apart from the crowd. Patent pending.",,"http://media.asicdn.com/images/jpgb/21440000/21440524.jpg",,"Mobile Accessories-General,PHONE ACCESSORIES,Stands-General",,"Silver","Steel","Dimension","Length:4:in;Width:2 7/8:in","",,,"CHINA",,,,,,,"Screen-printed, Unimprinted",,"","Black, blue 2747c, blue 3015c, green c, orange 165c, purple 2593c, Reflex Blue C, Rhodamine Red C, Rubine Red C, Warm Red C, White, yellow 102c","Y","Y","1 3/4"" x 1 3/8""","",,,"Y",,"6","","",,"","200:per Other (other)","8:in;8:in;3:in","14:lbs",,"","N","",,,,,,"Metalix Stand",,,"100","250","500","1000",,,,,,,"5.74","5.49","5.24","4.99",,,,,,,"R","R","R","R",,,,,,,,"N/A",,"USD",,"List","Unimprinted, Screen-printed","IMMD:Unimprinted, Screen-printed",,"Set-up Charge","Other","Required","1",,,,,,,,,,"12.00",,,,,,,,,,"Z",,,,,,,,,,"per color",,,,,,,,,,,,,,"N",,,,,,"Promotional","N",,,"Y","None",,,,
5362818,"Greg IV Cap-Off Rollerball Brass Pen","",,,,,"A solid brass constructed barrel with a chrome spring pocket clip makes this cap off pen stand apart from the rest. Customized to your specifications, order this pen with standard black ink or upgrade to gel or blue ink for an additional cost. This roller ball pen is the perfect promotional item for academic and professional events and is useful to virtually anyone. Pens make a convenient and practical promotional item in any scenario.",,"http://media.asicdn.com/images/jpgb/5990000/5991140.jpg",,"Pens-Ballpoint-Roller Ball",,"Satin Chrome,Glisten Blue,Glisten Black","Brass","","","",,,"CHINA",,,,,,,"Laser Engraving, Silkscreen",,"","","","","3/4"" x 1 3/16"", 5/16"" x 1 1/2"", 5/16"" x 1 3/16""","",,,"Y",,"10","","",,"Polybag","","","500 pieces / 39:lbs",,"","N","",,,,,,"Greg IV Cap-Off Rollerball Brass Pen",,,"100","250","500","1000","2500",,,,,,"4.80","4.50","4.20","4.00","3.80",,,,,,"R","R","R","R","R",,,,,,,"one color one position laser engrave in gold, or screen print.",,"USD",,"List","Silkscreen, Laser Engraving","IMMD:Silkscreen, Laser Engraving",,"Set-up Charge","Other","Required","1",,,,,,,,,,"45.00",,,,,,,,,,"Z",,,,,,,,,,"Imprint charge                                                                            Imprint Option(Oxidation black or laser chorme) : Oxidation                                                                                                                                                                                                                                Imprint Size : 5/16"" x 1 3/16"" (on cap), 5/16"" x 1 1/2"" (on barrel)",,,,,,,,,,,,,,"N",,,,,,"Promotional","N",,,"Y","None",,,,
