5268988,"Hunter Green Short Bib Apron","",,,,,"Tie this handy accessory into your company's workwear! Our hunter green standard short bib apron is 23"" x 27"" and made of a 65/35 polyester/cotton twill. With rounded bottom corners and extra-long ties, these aprons can be worn in the kitchen, during demonstations, at school and more! Take advantage of one of the available imprint methods to customize the 6"" x 8"" imprint area with your company name. An excellent opportunity to set your staff apart! Quantity discounts available starting at 12 pieces.",,"http://media.asicdn.com/images/jpgb/7080000/7086112.jpg",,"Aprons-Bib Style",,"Hunter Green","Polyester/Cotton Twill","Dimension","Length:23:in;Width:27:in","",,,"CHINA",,,,,,,"Embroidery, Heat Transfer, Laser Etching, Pad Print, Screen Print, Unimprinted",,"","","Y","","8"" x 8""","Single spot",,,"Y",,"12","Y","",,"Cellophane bag, Poly Bag","","","",,"","N","",,,,,,"Apron - Hunter Green Short Bib Apron",,,"12","144","432",,,,,,,,"5.83","5.50","5.25",,,,,,,,"R","R","R",,,,,,,,,"N/A",,"USD",,"List",,,,,,,,,,,,,,,,,,,,,,,,,,,,,,,,,,,,,,,,,,,,,,,,,,,"N",,,,,,"Promotional","N",,,"Y","None",,,,
550592086,"12 oz savannah cafe latte - slate blue","",,,,,"From a morning cup of coffee to an afternoon pause for tea, this classic choice in promotional products is here for you and your brand. This 12 oz. Savannah Cafe Latte Mug comes in beautiful slate blue and features a trendy, cool shape that's sure to set your brand apart at any promotional event. Line your tradeshow table or hand these out to clients and colleagues - no matter how you put it to use, it's sure to get your brand in their hands and on the move.",,"http://media.asicdn.com/images/jpgb/22390000/22395759.jpg",,"Mugs & Steins-Ceramic",,"Blue,Light Blue,Medium Blue,Multi color","Ceramic,Stoneware","Volume/Weight","12:oz","",,,"CHINA",,,,,,,"Silkscreen, Unimprinted",,"","","Y","Y","","",,,"Y",,"","","",,"","","","",,"","N","",,,,,,"Mug",,,"12","24","36","72",,,,,,,"7.15","5.48","4.64","3.64",,,,,,,"R","R","R","R",,,,,,,,"1 color imprint only.",,"USD",,"List","Silkscreen, Unimprinted","IMMD:Silkscreen, Unimprinted",,"Set-up Charge","Per Order","Required","1",,,,,,,,,,"50.00",,,,,,,,,,"Z",,,,,,,,,,"",,,,,,,,,,,,,,"N",,,,,,"Promotional","N",,,"Y","None",,,,
550602004,"15 oz El Grande Two Tone ceramic mug - maroon interior","",,,,,"Go with everyday practicality and put your brand on a foundational promotional product with this 15 oz. El Grande Two Tone Ceramic Mug. It features a traditional white exterior that provides the perfect space for an optional imprint of your organization's name, logo and advertising message. A maroon interior adds an attractive color accent that will set this mug apart in the crowd. Whether you're gearing up for a tradeshow appearance or want to impress new hires with a branded gift, this mug is here for you.",,"http://media.asicdn.com/images/jpgb/22410000/22414004.jpg",,"Mugs & Steins-Ceramic",,"White,Maroon,Multi color","Ceramic,Stoneware","Volume/Weight","15:oz","",,,"CHINA",,,,,,,"Silkscreen, Unimprinted",,"","","Y","Y","","",,,"Y",,"","","",,"","","","",,"","N","",,,,,,"15 oz El Grande Two Tone ceramic mug - maroon interior",,,"12","24","36","72","144","288","576","1008","2016","5000","7.31","5.64","4.81","3.80","3.14","3.05","2.97","2.94","2.90","2.87","R","R","R","R","R","R","R","R","R","R",,"1 color imprint only.",,"USD",,"List","Silkscreen, Unimprinted","IMMD:Silkscreen, Unimprinted",,"Set-up Charge","Per Order","Required","1",,,,,,,,,,"50.00",,,,,,,,,,"Z",,,,,,,,,,"",,,,,,,,,,,,,,"N",,,,,,"Promotional","N",,,"Y","None",,,,
5916405,"Steel Wire Twist Metal Ballpoint Pen","",,,,,"Complete your noteworthy campaign with this steel wire twist metal ballpoint pen! This pen features a steel wire on the lower barrel and offers a durable, distinct look that sets it apart from a standard ballpoint pen. Perfect for tradeshows, workshops, new hire welcome kits and much more, this pen will provide your business with daily advertising! Customize this writing instrument to make a memorable impression on your customers.",,"http://media.asicdn.com/images/jpgb/6970000/6974142.jpg",,"Pens-Ballpoint-Twist Action",,"","","Dimension","Length:5 3/8:in;Width:5/8:in","",,,"CHINA",,,,,,,"Printed",,"","","","Y","1 5/8"" x 3/8""","",,,"Y",,"","","",,"","","","38:lbs",,". per case of 500","N","",,,,,,"Steel Wire Twist Metal Ballpoint Pen",,,"250","500","1000","2500","5000",,,,,,"4.90","4.86","4.83","4.79","4.71",,,,,,"R","R","R","R","R",,,,,,,"N/A",,"USD",,"List","Printed","IMMD:Printed",,"Set-up Charge","Other","Required","1",,,,,,,,,,"40.00",,,,,,,,,,"Z",,,,,,,,,,"Imprint charge",,,,,,,,,,,,,,"N",,,,,,"Promotional","N",,,"Y","None",,,,
550591879,"12 Oz Effect Black Out - Pink In","",,,,,"For a classic promotional handout with a trendy design to set your brand apart, look no further than this 12 oz. cafe mug with a stylish matte finish. Featuring an eye-catching two-color design - black on the outside with a pink interior - this handy item can be customized to your liking. Include a silkscreened imprint of you company name and logo, event title and more to create a desirable corporate handout that will make a lasting impression.",,"http://media.asicdn.com/images/jpgb/22390000/22398874.jpg",,"Mugs & Steins-Ceramic",,"Black,Pink,Multi color","Ceramic,Stoneware","Volume/Weight","12:oz","",,,"CHINA",,,,,,,"Silkscreen, Unimprinted",,"","","Y","Y","","",,,"Y",,"","","",,"","","","",,"","N","",,,,,,"Glossy Pink interior",,,"12","24","36","72",,,,,,,"6.78","5.11","4.27","3.27",,,,,,,"R","R","R","R",,,,,,,,"1 color imprint only.",,"USD",,"List","Silkscreen, Unimprinted","IMMD:Silkscreen, Unimprinted",,"Set-up Charge","Per Order","Required","1",,,,,,,,,,"50.00",,,,,,,,,,"Z",,,,,,,,,,"",,,,,,,,,,,,,,"N",,,,,,"Promotional","N",,,"Y","None",,,,
550554210,"13 oz santa fe endeavor - slate blue","",,,,,"Create the perfect space for your brand and put your advertising message on the move! This 13 oz. Santa Fe Endeavor Mug in slate blue is perfectly sized to appeal to all coffee drinkers and features an updated shape that sets it apart in the crowd. Your organization's name, logo and advertising message will stand out in available silkscreen imprinting. Get noticed with something that recipients can put to use at every coffee break!",,"http://media.asicdn.com/images/jpgb/22330000/22333854.jpg",,"Mugs & Steins-Ceramic",,"Blue,Light Blue,Medium Blue,Multi color","Ceramic,Stoneware","Volume/Weight","13:oz","",,,"CHINA",,,,,,,"Silkscreen, Unimprinted",,"","Gold, Other Colors, Platinum","Y","Y","","",,,"Y",,"","","",,"","","","",,"","N","",,,,,,"Ceramic 13 oz. mug with matching ""C"" handle",,,"144","288","576","1008","2016","5000",,,,,"3.12","3.04","2.96","2.92","2.89","2.86",,,,,"R","R","R","R","R","R",,,,,,"1 color imprint only.",,"USD",,"List","Silkscreen, Unimprinted","IMMD:Silkscreen, Unimprinted",,"Set-up Charge","Per Order","Required","1",,,,,,,,,,"50.00",,,,,,,,,,"Z",,,,,,,,,,"",,,,,,,,,,,,,,"N",,,,,,"Promotional","N",,,"Y","None",,,,
6264037,"Square Glass Coaster Set","",,,,,"You'll ""set"" your valued people apart with the square glass coaster set! This jade glass, square, glass coaster set is a perfect gift for any occasion. Including 4 pieces of coasters and a display walnut base, the set measures 4 3/4"" x 4"" x 3 3/4"". This versatile item makes a wonderful a wedding, anniversary, birthday or Valentine's Day gift. Have your logo, name or message imprinted on yours when you place your order today!",,"http://media.asicdn.com/images/jpgb/7050000/7054501.jpg",,"Coasters-General",,"Jade","Glass","Dimension","Length:4 3/4:in;Width:4:in;Height:3 3/4:in","Rectangle,Square",,,"CHINA",,,,,,,"Laser Engraved, Unimprinted",,"","","Y","Y","1"" x 3 1/2"", 4"" X 4""","",,,"Y",,"3","Y","1:	",,"Gift box included","","","",,"1.5","N","",,,,,,"Square Glass Coaster Set",,,"12","25","50","100",,,,,,,"53.90","52.55","51.21","48.51",,,,,,,"R","R","R","R",,,,,,,,"sandblasting one logo and texts on one location when vector art logo file is provided.",,"USD",,"List",,,,,,,,,,,,,,,,,,,,,,,,,,,,,,,,,,,,,,,,,,,,,,,,,,,"N",,,,,,"Promotional","N",,,"Y","None",,,,
550602008,"15 oz El Grande Two Tone ceramic mug - black interior","",,,,,"The Two Tone El Grande Mug Collection is a brand new twist on an old staple. This 15 oz. ceramic mug features a traditional white exterior that provides the perfect space for an optional imprint of your organization's name, logo and advertising message. A black interior adds an attractive color accent that will set this mug apart in the crowd. Whether you're gearing up for a tradeshow appearance or want to impress new hires with a branded gift, this mug is here for you.",,"http://media.asicdn.com/images/jpgb/22410000/22414002.jpg",,"Mugs & Steins-Ceramic",,"Black,White,Multi color","Ceramic,Stoneware","Volume/Weight","15:oz","",,,"CHINA",,,,,,,"Silkscreen, Unimprinted",,"","","Y","Y","","",,,"Y",,"","","",,"","","","",,"","N","",,,,,,"15 oz El Grande Two Tone ceramic mug - black interior",,,"12","24","36","72","144","288","576","1008","2016","5000","7.40","5.73","4.90","3.89","3.23","3.14","3.06","3.03","2.99","2.96","R","R","R","R","R","R","R","R","R","R",,"1 color imprint only.",,"USD",,"List","Silkscreen, Unimprinted","IMMD:Silkscreen, Unimprinted",,"Set-up Charge","Per Order","Required","1",,,,,,,,,,"50.00",,,,,,,,,,"Z",,,,,,,,,,"",,,,,,,,,,,,,,"N",,,,,,"Promotional","N",,,"Y","None",,,,
3192362,"V-Column Award","",,,,,"Celebrate your structure of support with an elegant v-column award! This optic crystal award is faceted to reflect the light for a radiant display!  For a unique touch that is sure to set this award apart from the rest is a die-struck medal and allowing for a generous imprint area. Packaged in a satin-lined gift box with cotton gloves not only protects the award but allows for stunning presentation at ceremonies, charity events and much more.",,"http://media.asicdn.com/images/jpgb/5770000/5774328.jpg",,"Awards-Crystal",,"","Crystal","Dimension","Length:4:in;Width:10 1/4:in;Height:4:in,Length:3:in;Width:7 3/4:in;Height:3:in,Length:2 1/4:in;Width:5 7/8:in;Height:2 1/4:in","",,,"CHINA",,,,,,,"Etched",,"","","","Y","","",,,"Y",,"","","",,"Gift Box","","","",,"","N","",,,,,,"Large",,,"1","10","25","50","100",,,,,,"192.61","175.62","169.95","166.17","162.40",,,,,,"R","R","R","R","R",,,,,,,"N/A",,"USD",,"List","Etched","IMMD:Etched",,"Set-up Charge","Other","Required","1",,,,,,,,,,"75.00",,,,,,,,,,"Z",,,,,,,,,,"Imprint charge",,,,,,,,,,,,,,"N",,,,,,"Promotional","N",,,"Y","None",,,,
550635795,"16 oz Vineland Funnel Mug - Slate Blue","",,,,,"16 oz. slate blue Vineland Funnel mugs. Very trending color scheme. Each mug is decorated with a Vine design on bottom part of mug. Use these brand new mugs for your next promotion to set you apart from the competition.",,"http://media.asicdn.com/images/jpgb/22510000/22511281.jpg",,"Mugs & Steins-Ceramic",,"Multi color","Ceramic,Stoneware","Volume/Weight","16:oz","",,,"CHINA",,,,,,,"Silkscreen, Unimprinted",,"","","Y","Y","","",,,"Y",,"","","",,"","","","",,"","N","",,,,,,"16 oz Vineland Funnel Mug - Slate Blue",,,"12","24","36","72","144","288","576","1008","2016","5000","8.12","6.45","5.62","4.61","3.95","3.86","3.78","3.75","3.71","3.68","R","R","R","R","R","R","R","R","R","R",,"1 color imprint only.",,"USD",,"List","Silkscreen, Unimprinted","IMMD:Silkscreen, Unimprinted",,"Set-up Charge","Per Order","Required","1",,,,,,,,,,"50.00",,,,,,,,,,"Z",,,,,,,,,,"",,,,,,,,,,,,,,"N",,,,,,"Promotional","N",,,"Y","None",,,,
7379048,"20 oz Tower Vacuum Water Bottle","",,,,,"This Energy-toned water bottles will keep you quenched while on the run. Constructed out of FDA compliant materials, with 18-8 stainless steel vacuum insulation for optimum temperature retention. Features our patent pending leak-proof screw-on lid with a visual open/close push button locking closure, that comes apart for easy cleaning and an adjustable side carry strap for hands free transport. Dimensions: 11 3/8"" x 2 3/4"" x 2 3/4"" (H x W x D).",,"http://media.asicdn.com/images/jpgb/20050000/20051438.jpg",,"Bottles-Insulated,Bottles-Sport Type,ENVIRONMENTALLY FRIENDLY PRODUCTS",,"Blue,Green,Orange,Stainless","Stainless Steel","","","",,,"CHINA",,,,,,,"Laser Engraving, Pad Print, TruColor (TM) Digital, Unimprinted",,"","Black, Blaze Orange, dark green, Gold, Gray, light green, Maroon, Navy blue, Orange, Process Blue, Red, Reflex Blue, Silver, Teal, Violet, White, Yellow","Y","Y","2"" x 1 3/4"", 2"" x 2""","Laser (H x W), Pad Print (H x W)",,,"Y",,"5","Y","3:	",,"Drawstring pouch","","","",,"","N","",,,,,,"20 oz Tower Vacuum Water Bottle",,,"24","48","96","244",,,,,,,"16.39","15.87","15.34","14.29",,,,,,,"R","R","R","R",,,,,,,,"one standard color or laser engraving on one location",,"USD",,"List","Pad Print, Laser Engraving, TruColor (TM) Digital, Unimprinted","IMMD:Pad Print, Laser Engraving, TruColor (TM) Digital, Unimprinted",,"Set-up Charge","Per Order","Required","1",,,,,,,,,,"55.00",,,,,,,,,,"Z",,,,,,,,,,"",,,,,,,,,,,,,,"N",,,,,,"Promotional","N",,,"Y","None",,,,
7378985,"20 oz Persona Stainless Steel Vacuum  Water Bottle","",,,,,"Keep your beverage close at hand with our 20 oz Stainless Steel water bottle. Made of FDA compliant materials, this water bottle has a dual wall 18-8 Stainless Steel construction with  a silicone band accent and vacuum insulation for optimum heat retention. Featuring our patented leak-proof screw-on lid with a visual open/close push button locking closure that comes apart for easy cleaning and a side adjustable Nylon strap for hands-free transport. Available in 13 different colors. Measures 11 3/8"" h x 3"" w x 3"" d.",,"http://media.asicdn.com/images/jpgb/20050000/20051444.jpg",,"Bottles-Insulated,Bottles-Sport Type,ENVIRONMENTALLY FRIENDLY PRODUCTS",,"Stainless","Stainless Steel","","","",,,"CHINA",,,,,,,"Laser Engraving, Pad Print, TruColor (TM) Digital, Unimprinted",,"","Black, Blaze Orange, dark green, Gold, Gray, light green, Maroon, Navy blue, Orange, Process Blue, Red, Reflex Blue, Silver, Teal, Violet, White, Yellow","Y","Y","2"" H x 1 1/2"" W, 2"" h x 1 3/4"" w, 3 sq. in.","Laser (H x W), Pad Print (H x W), TruColor (TM)",,,"Y",,"5","Y","3:	",,"Drawstring pouch","","","",,"","N","",,,,,,"20 oz Persona Stainless Steel Vacuum  Water Bottle",,,"24","48","96","244",,,,,,,"14.59","14.59","14.59","14.59",,,,,,,"R","R","R","R",,,,,,,,"one standard color or laser engraving on one location",,"USD",,"List","Laser Engraving, Pad Print, TruColor (TM) Digital, Unimprinted","IMMD:Laser Engraving, Pad Print, TruColor (TM) Digital, Unimprinted",,"Set-up Charge","Per Order","Required","1",,,,,,,,,,"40.00",,,,,,,,,,"Z",,,,,,,,,,"",,,,,,,,,,,,,,"N",,,,,,"Promotional","N",,,"Y","None",,,,
550554192,"12 oz savannah cafe latte - charcoal gray","",,,,,"Whether you're planning for an in-house incentive program or want to offer clients something to remember your brand with, this promo delivers. The 12 oz. Savannah Cafe Latte Mug in charcoal gray features an ear-shaped handle and a tapered bottom that sets it apart in the crowd. This updated take on the classic mug shape will feature a silkscreen imprint of your advertising information for branded promotional power that you can count on. Whether you're setting up your tradeshow table or preparing for an incentive program, this is the right product to get your started.",,"http://media.asicdn.com/images/jpgb/22330000/22333800.jpg",,"Mugs & Steins-Ceramic",,"Black,Grey,Gray,Multi color","Ceramic,Stoneware","Volume/Weight","12:oz","",,,"CHINA",,,,,,,"Silkscreen, Unimprinted",,"","Gold, Other Colors, Platinum","Y","Y","","",,,"Y",,"","","",,"","","","",,"","N","",,,,,,"Ceramic 12 oz. latte mug with ear shape handle",,,"144","288","576","1008","2016","5000",,,,,"2.97","2.89","2.81","2.77","2.74","2.71",,,,,"R","R","R","R","R","R",,,,,,"1 color imprint only.",,"USD",,"List","Silkscreen, Unimprinted","IMMD:Silkscreen, Unimprinted",,"Set-up Charge","Per Order","Required","1",,,,,,,,,,"50.00",,,,,,,,,,"Z",,,,,,,,,,"",,,,,,,,,,,,,,"N",,,,,,"Promotional","N",,,"Y","None",,,,
550554100,"12 oz cafe latte gloss - cobalt blue","",,,,,"Stock your breakroom cabinets or send your brand home with valued clients with this cobalt blue 12 oz. Cafe Latte Gloss Mug. This promotional tool is here for you and your brand and features a new, trendy style with a distinctive Cafe latte shape that sets it apart in the promotional crowd. Complete the look with an available silkscreen imprint of your organization's name, logo and advertising message and create something that's great for use at a variety of events and occasions.",,"http://media.asicdn.com/images/jpgb/22330000/22333611.jpg",,"Mugs & Steins-Ceramic",,"Blue,Cobalt Blue,Dark Blue","Ceramic,Stoneware","Volume/Weight","12:oz","",,,"CHINA",,,,,,,"Silkscreen, Unimprinted",,"","Gold, Other Colors, Platinum","Y","Y","","",,,"Y",,"","","",,"","","","",,"","N","",,,,,,"Cobalt",,,"144","288","576","1008","2016","5000",,,,,"2.30","2.22","2.14","2.10","2.07","2.04",,,,,"R","R","R","R","R","R",,,,,,"1 color imprint only.",,"USD",,"List","Silkscreen, Unimprinted","IMMD:Silkscreen, Unimprinted",,"Set-up Charge","Per Order","Required","1",,,,,,,,,,"50.00",,,,,,,,,,"Z",,,,,,,,,,"",,,,,,,,,,,,,,"N",,,,,,"Promotional","N",,,"Y","None",,,,
550602007,"15 oz El Grande Two Tone ceramic mug - yellow interior","",,,,,"Whether you're preparing for a tradeshow appearance or want to stock breakroom cupboards, the El Dorado Two Tone Mug is here for you. This 15 oz. ceramic mug features a traditional white exterior that provides the perfect space for an optional imprint of your organization's name, logo and advertising message. A yellow interior adds an attractive color accent that will set this mug apart in the crowd. Whether you're gearing up for a tradeshow appearance or want to impress new hires with a branded gift, this mug is here for you.",,"http://media.asicdn.com/images/jpgb/22490000/22497518.jpg",,"Mugs & Steins-Ceramic",,"White,Multi color","Ceramic,Stoneware","Volume/Weight","15:oz","",,,"CHINA",,,,,,,"Silkscreen, Unimprinted",,"","","Y","Y","","",,,"Y",,"","","",,"","","","",,"","N","",,,,,,"15 oz El Grande Two Tone ceramic mug - yellow interior",,,"12","24","36","72","144","288","576","1008","2016","5000","7.31","5.64","4.81","3.80","3.14","3.05","2.97","2.94","2.90","2.87","R","R","R","R","R","R","R","R","R","R",,"1 color imprint only.",,"USD",,"List","Silkscreen, Unimprinted","IMMD:Silkscreen, Unimprinted",,"Set-up Charge","Per Order","Required","1",,,,,,,,,,"50.00",,,,,,,,,,"Z",,,,,,,,,,"",,,,,,,,,,,,,,"N",,,,,,"Promotional","N",,,"Y","None",,,,
550308386,"25 oz Persona (TM) Vacuum Water Bottle","",,,,,"25 oz Persona (TM) Vacuum Water Bottle. Made of FDA compliant materials, this water bottle has 18-8 Stainless Steel dual wall construction with silicone band accent, black matte finish and vacuum insulation for optimum heat retention. Features our patented leak-proof screw-on lid with a visual open/close push button locking closure that comes apart for easy cleaning and an adjustable side carry strap for hands free transport. Available in 13 different colors. Product size: 11 1/2"" h x 2 7/8"" w x 2 7/8"" d.",,"http://media.asicdn.com/images/jpgb/21410000/21414132.jpg",,"Bottles-General,TRAVEL MUGS/CUPS",,"Black","Stainless Steel","Volume/Weight","25:oz","",,,"CHINA",,,,,,,"Laser Engraving, Pad Print, TruColor (TM) Digital, Unimprinted",,"Paper Proof (Fax/Emailed paper proofs will be sent within 24-48 hours following receipt of usable artwork.), Virtual Proof (Virtual Spec (E-Spec) available for each item. Not available with embroidery and debossing imprint methods)","Black, Blaze Orange, dark green, Gold, Gray, light green, Maroon, Navy blue, Orange, Process Blue, Red, Reflex Blue, Silver, Teal, Violet, White, Yellow","Y","Y","1 1/2"" h x 2"" w (3 sq. in.), 1"" H x 1 3/4"" W, 1"" H x 2"" W","Laser, Pad Print, TruColor (TM)",,,"Y",,"5","Y","3:	",,"Drawstring pouch","","","",,"Orders will be shipped FedEx unless otherwise specified.","N","",,,,,,"25 oz Persona (TM) Vacuum Water Bottle",,,"24","48","96","244",,,,,,,"14.99","14.99","14.99","14.99",,,,,,,"R","R","R","R",,,,,,,,"One Standard Color or Laser Engraving on One Location.",,"USD",,"List","Laser Engraving, TruColor (TM) Digital, Pad Print, Unimprinted","IMMD:Laser Engraving, TruColor (TM) Digital, Pad Print, Unimprinted",,"Set-up Charge","Per Order","Required","1",,,,,,,,,,"55.00",,,,,,,,,,"Z",,,,,,,,,,"",,,,,,,,,,,,,,"N",,,,,,"Promotional","N",,,"Y","None",,,,
550308386,,,,,,,,,,,,,,,,,,,,,,,,,,,,,,,,,,,,,,,,,,,,,,,,,,,,,,,,,,,,,,,,,,,,,,,,,,,,,,,,,,,,,,,,,,,,,,,"Paper Proof (Fax/Emailed paper proofs will be sent within 24-48 hours following receipt of usable artwork.), Virtual Proof (Virtual Spec (E-Spec) available for each item. Not available with embroidery and debossing imprint methods)","ARTW:Paper Proof (Fax/Emailed paper proofs will be sent within 24-48 hours following receipt of usable artwork.), Virtual Proof (Virtual Spec (E-Spec) available for each item. Not available with embroidery and debossing imprint methods)",,"Artwork Charge","Other","Optional","",,,,,,,,,,"QUR",,,,,,,,,,"Z",,,,,,,,,,"",,,,,,,,,,,,,,,,,,,,,,,,,,,,,
7144954,"16 oz Aroma Vacuum Tumbler","",,,,,"16 oz Aroma Vacuum Tumbler. This tumbler features our new patent-pending designed lid, complete with lip and finger grooves that allow you to position the drinking spout without even looking. It also includes a leak-proof screw-on lid with a visual open/close push button locking closure that comes apart for easy cleaning. Made of FDA compliant materials, this tumbler has dual wall construction with 18-8 Stainless Steel, copper lined vacuum insulation. Will hold your beverage at the ideal drinking temperature at least 9X longer. Dimensions: 9 1/4"" x 2 1/2"" x 2 1/2"" (H x W x D). Drinkware is ""Handwash Only"".",,"http://media.asicdn.com/images/jpgb/7720000/7727171.jpg",,"TRAVEL MUGS/CUPS",,"Red,Blue,Brown,Stainless","Stainless Steel","","","",,,"CHINA",,,,,,,"Laser Engraving, Pad Print, TruColor (TM) Digital, Unimprinted",,"","Blaze Orange, Gray","Y","Y","1 1/4"" H x 1 1/2"" W, 1 1/4"" H x 2"" W, 3 sq. in.","Laser Engraving (H x W), Pad Print (H x W), TruColor (TM)",,,"Y",,"5","Y","3:	",,"Drawstring pouch","","","",,"","N","",,,,,,"16 oz Aroma Vacuum Tumbler",,,"24","48","96","244",,,,,,,"14.49","14.04","13.59","12.69",,,,,,,"R","R","R","R",,,,,,,,"one standard color or one laser engraving on one location",,"USD",,"List","Pad Print, Laser Engraving, TruColor (TM) Digital, Unimprinted","IMMD:Pad Print, Laser Engraving, TruColor (TM) Digital, Unimprinted",,"Set-up Charge","Per Order","Required","1",,,,,,,,,,"55.00",,,,,,,,,,"Z",,,,,,,,,,"",,,,,,,,,,,,,,"N",,,,,,"Promotional","N",,,"Y","None",,,,
550307512,"16 oz Persona (TM) Caturra Vacuum Tumbler","",,,,,"Persona (TM) Caturra Vacuum Tumbler. Dual wall, copper lined vacuum-sealed for optimum heat retention. Features FDA compliant materials; 18-8 Black Matte Stainless Steel, Silicone accent band and our patented lid which has a lip groove, which allow you to position the drinking spout without even looking. The leak-poof open/close push button locking closure that comes apart for easy cleaning. Available in 13 different colors. Product size: 9 1/4"" h x 2 3/4"" w x 2 3/4"" d.",,"http://media.asicdn.com/images/jpgb/21140000/21148941.jpg",,"Glasses-Drinking-Tumbler,TRAVEL MUGS/CUPS",,"Black","Stainless Steel","Volume/Weight","16:oz","",,,"CHINA",,,,,,,"Laser Engraving, Silkscreen, TruColor (TM) Digital, Unimprinted",,"Paper Proof (Fax/Emailed paper proofs will be sent within 24-48 hours following receipt of usable artwork.), Virtual Proof (Virtual Spec (E-Spec) available for each item. Not available with embroidery and debossing imprint methods)","Black, Blaze Orange, dark green, Gold, Gray, light green, Maroon, Navy blue, Orange, Process Blue, Red, Reflex Blue, Silver, Teal, Violet, White, Yellow","Y","Y","1 1/2"" h x 2"" w (3 sq. in.), 1 1/4"" H x 1 1/2"" W, 1 1/4"" H x 1 3/4"" W","Laser, Silkscreen, TruColor (TM)",,,"Y",,"5","Y","3:	",,"Drawstring pouch","","","",,"Orders will be shipped FedEx unless otherwise specified.","N","",,,,,,"16 oz Persona (TM) Caturra Vacuum Tumbler",,,"24","48","96","244",,,,,,,"13.89","13.89","13.89","13.89",,,,,,,"R","R","R","R",,,,,,,,"One Standard Color or Laser Engraving on One Location.",,"USD",,"List","Silkscreen, Laser Engraving, TruColor (TM) Digital, Unimprinted","IMMD:Silkscreen, Laser Engraving, TruColor (TM) Digital, Unimprinted",,"Set-up Charge","Per Order","Required","1",,,,,,,,,,"55.00",,,,,,,,,,"Z",,,,,,,,,,"",,,,,,,,,,,,,,"N",,,,,,"Promotional","N",,,"Y","None",,,,
550307512,,,,,,,,,,,,,,,,,,,,,,,,,,,,,,,,,,,,,,,,,,,,,,,,,,,,,,,,,,,,,,,,,,,,,,,,,,,,,,,,,,,,,,,,,,,,,,,"Paper Proof (Fax/Emailed paper proofs will be sent within 24-48 hours following receipt of usable artwork.), Virtual Proof (Virtual Spec (E-Spec) available for each item. Not available with embroidery and debossing imprint methods)","ARTW:Paper Proof (Fax/Emailed paper proofs will be sent within 24-48 hours following receipt of usable artwork.), Virtual Proof (Virtual Spec (E-Spec) available for each item. Not available with embroidery and debossing imprint methods)",,"Artwork Charge","Other","Optional","1",,,,,,,,,,"6.25",,,,,,,,,,"Z",,,,,,,,,,"",,,,,,,,,,,,,,,,,,,,,,,,,,,,,
