7144992,"25 oz Persona (TM) Vacuum  Water Bottle","",,,,,"Our sleek water bottle will keep you hydrated while adding a splash of color with your choice of 13 colors. Made of FDA compliant materials, this water bottle has dual wall 18-8 Stainless Steel construction with silicone band accent and vacuum insulation for optimum temperature retention. It features a patented leak-proof screw-on lid with a visual open/close push button locking closure, that comes apart for easy cleaning and an adjustable side carry strap for hands free transport.  Available in 13 different colors.Measures 11 1/2"" h x 2 7/8"" w x 2 7/8"" d.",,"http://media.asicdn.com/images/jpgb/7720000/7727174.jpg",,"Bottles-Insulated,Bottles-Sport Type,ENVIRONMENTALLY FRIENDLY PRODUCTS",,"Stainless","Silicone,Stainless Steel","","","",,,"CHINA",,,,,,,"Laser Engraving, Pad Print, TruColor (TM) Digital, Unimprinted",,"","Black, Blaze Orange, dark green, Gold, Gray, light green, Maroon, Navy blue, Orange, Process Blue, Red, Reflex Blue, Silver, Teal, Violet, White, Yellow","Y","Y","1"" H x 1 3/4"" W, 1"" H x 2"" W, 3 sq. in.","Laser (H x W), Pad Print (H x W), TruColor (TM)",,,"Y",,"5","Y","3:	",,"Drawstring pouch","","","",,"","N","",,,,,,"25 oz Persona (TM) Vacuum  Water Bottle",,,"24","48","96","244",,,,,,,"14.39","14.39","14.39","14.39",,,,,,,"R","R","R","R",,,,,,,,"one standard color or laser engraving on one location",,"USD",,"List","Pad Print, Laser Engraving, TruColor (TM) Digital, Unimprinted","IMMD:Pad Print, Laser Engraving, TruColor (TM) Digital, Unimprinted",,"Set-up Charge","Per Order","Required","1",,,,,,,,,,"55.00",,,,,,,,,,"Z",,,,,,,,,,"per add'l sqaure inch/unit.You may order less than the minimum quantity",,,,,,,,,,,,,,"N",,,,,,"Promotional","N",,,"Y","None",,,,
550554119,"15 oz halo el grande - red handle","",,,,,"Create a promotional display that comes on a practical everyday product that's perfect for use around the house and the office. The 15 oz. Halo El Grande mug is an exciting variation on the bestselling C-handle ceramic coffee mug. It features a red handle and matching color stripe halo accent that add a touch of eye-catching color that will set your brand apart from the competition in an array of settings.",,"http://media.asicdn.com/images/jpgb/22330000/22333595.jpg",,"Mugs & Steins-Ceramic",,"Red,Medium Red,Stanford Red,White,Multi color","Ceramic,Stoneware","Volume/Weight","15:oz","",,,"CHINA",,,,,,,"Silkscreen, Unimprinted",,"","Gold, Other Colors, Platinum","Y","Y","","",,,"Y",,"","","",,"","","","",,"","N","",,,,,,"White ceramic 15 oz. mug with red rim/handle",,,"144","288","576","1008","2016","5000",,,,,"2.92","2.84","2.76","2.72","2.69","2.66",,,,,"R","R","R","R","R","R",,,,,,"1 color imprint only.",,"USD",,"List","Silkscreen, Unimprinted","IMMD:Silkscreen, Unimprinted",,"Set-up Charge","Per Order","Required","1",,,,,,,,,,"50.00",,,,,,,,,,"Z",,,,,,,,,,"",,,,,,,,,,,,,,"N",,,,,,"Promotional","N",,,"Y","None",,,,
5111121,"Checkbook Cover - Digi Camo","",,,,,"Accentuate your marketing campaign with the stylish new DigiColor Camo Checkbook Cover. Made of high quality neoprene (wetsuit rubber material), this item features clear vinyl pockets for both your checkbook and register. It's also great for coupons, receipts and more! With 10 color patterns in addition to custom color schemes to choose from or create, customize this product to fit your company's theme. A four color process brand and personalization will set your business apart from the rest as a wise investment.",,"http://media.asicdn.com/images/jpgb/5710000/5714686.jpg",,"CHECKBOOK COVERS",,"Red,Pink,Gray,Green,Lime Green,Orange,Blue,Purple","Neoprene","","","",,,"CHINA",,,,,,,"Four Color Process, Full Color Process",,"","","","Y","3.75"" x 1.875""","",,,"Y",,"15","","",,"","","","Case Pack/ Dimensions/ Weight: 250 ct./15"" x 15"" x 10""/20:lbs",,".","N","",,,,,,"Checkbook cover",,,"100","250","500","1000",,,,,,,"2.91","2.64","2.35","2.17",,,,,,,"R","R","R","R",,,,,,,,"a one-color imprint on one side.",,"USD",,"List","Four Color Process, Full Color Process","IMMD:Four Color Process, Full Color Process",,"Set-up Charge","Other","Required","1",,,,,,,,,,"45.00",,,,,,,,,,"Z",,,,,,,,,,"Imprint charge",,,,,,,,,,,,,,"N",,,,,,"Promotional","N",,,"Y","None",,,,
550308032,"16 oz Persona (TM) Tower Vacuum Tumbler","",,,,,"Made of FDA compliant materials; this tumbler has a dual wall 18-8 Stainless Steel construction with silicone band accent and Copper lined vacuum insulation that will keep your beverage hot for hours. Featuring our patented designed lid that is leak proof with a visual open/close push button locking closure and it can come apart for easy cleaning. Includes a lip groove that allows you to position the drinking spout without even looking. Available in 13 color options.Product size: 9 1/4"" h x 2 3/4"" w x 2 3/4"" d.",,"http://media.asicdn.com/images/jpgb/21140000/21149280.jpg",,"Glasses-Drinking-Tumbler,TRAVEL MUGS/CUPS",,"Silver","Stainless Steel","Volume/Weight","16:oz","",,,"CHINA",,,,,,,"Laser Engraving, Silkscreen, TruColor (TM) Digital, Unimprinted",,"Paper Proof (Fax/Emailed paper proofs will be sent within 24-48 hours following receipt of usable artwork.), Virtual Proof (Virtual Spec (E-Spec) available for each item. Not available with embroidery and debossing imprint methods)","Black, Blaze Orange, dark green, Gold, Gray, light green, Maroon, Navy blue, Orange, Process Blue, Red, Reflex Blue, Silver, Teal, Violet, White, Yellow","Y","Y","1 1/2"" h x 2"" w (3 sq. in.), 2"" H x 1 1/2"" W, 2"" h x 1 3/4"" w","Laser, Silkscreen, TruColor (TM)",,,"Y",,"5","Y","3:	",,"Drawstring pouch","","","",,"Orders will be shipped FedEx unless otherwise specified.","N","",,,,,,"16 oz Persona (TM) Tower Vacuum Tumbler",,,"24","48","96","244",,,,,,,"13.49","13.49","13.49","13.49",,,,,,,"R","R","R","R",,,,,,,,"One Standard Color or Laser Engraving on One Location.",,"USD",,"List","Silkscreen, Laser Engraving, TruColor (TM) Digital, Unimprinted","IMMD:Silkscreen, Laser Engraving, TruColor (TM) Digital, Unimprinted",,"Set-up Charge","Per Order","Required","1",,,,,,,,,,"55.00",,,,,,,,,,"Z",,,,,,,,,,"",,,,,,,,,,,,,,"N",,,,,,"Promotional","N",,,"Y","None",,,,
550308032,,,,,,,,,,,,,,,,,,,,,,,,,,,,,,,,,,,,,,,,,,,,,,,,,,,,,,,,,,,,,,,,,,,,,,,,,,,,,,,,,,,,,,,,,,,,,,,"Paper Proof (Fax/Emailed paper proofs will be sent within 24-48 hours following receipt of usable artwork.), Virtual Proof (Virtual Spec (E-Spec) available for each item. Not available with embroidery and debossing imprint methods)","ARTW:Paper Proof (Fax/Emailed paper proofs will be sent within 24-48 hours following receipt of usable artwork.), Virtual Proof (Virtual Spec (E-Spec) available for each item. Not available with embroidery and debossing imprint methods)",,"Artwork Charge","Other","Optional","1",,,,,,,,,,"6.25",,,,,,,,,,"Z",,,,,,,,,,"",,,,,,,,,,,,,,,,,,,,,,,,,,,,,
550592090,"15 oz savannah spokane - chocolate","",,,,,"Whether you're preparing for a tradeshow appearance, an employment fair or a fundraising effort, you can rely on the promotional power of this 15 oz. Savannah Spokane Mug in chocolate brown. This new, larger style mug comes in a trendy and inspiring fashion that sets it apart from other mugs. Complete the promotional look with an available silkscreen imprint of your organization's name, logo and advertising message and take this winner to your next tradeshow appearance, fundraising effort and more!",,"http://media.asicdn.com/images/jpgb/22390000/22395729.jpg",,"Mugs & Steins-Ceramic",,"Brown,Chocolate Brown,Light Brown,Multi color","Ceramic,Stoneware","Volume/Weight","15:oz","",,,"CHINA",,,,,,,"Silkscreen, Unimprinted",,"","","Y","Y","","",,,"Y",,"","","",,"","","","",,"","N","",,,,,,"15 oz. ceramic mug",,,"12","24","36","72",,,,,,,"8.27","6.60","5.76","4.76",,,,,,,"R","R","R","R",,,,,,,,"1 color imprint only.",,"USD",,"List","Silkscreen, Unimprinted","IMMD:Silkscreen, Unimprinted",,"Set-up Charge","Per Order","Required","1",,,,,,,,,,"50.00",,,,,,,,,,"Z",,,,,,,,,,"",,,,,,,,,,,,,,"N",,,,,,"Promotional","N",,,"Y","None",,,,
550591827,"12 Oz Effect Black Out - Yellow In","",,,,,"Pour a hot cup of promotional success and put your brand directly in the hands of those who matter most with this 12 oz. Effect Mug. It features a black exterior and a yellow colored interior with a trendy design that will truly set your promotional apart. Line your tradeshow table or welcome new hires with a promotional tool that's perfect for a variety of industries, recipients, events and occasions as well as everyday use.",,"http://media.asicdn.com/images/jpgb/22390000/22395905.jpg",,"Mugs & Steins-Ceramic",,"Black,Yellow,Bright Yellow,Sun Yellow,Multi color","Ceramic,Stoneware","Volume/Weight","12:oz","",,,"CHINA",,,,,,,"Silkscreen, Unimprinted",,"","","Y","Y","","",,,"Y",,"","","",,"","","","",,"","N","",,,,,,"Mug",,,"144","288","576","1008","2016","5000",,,,,"2.61","2.53","2.45","2.41","2.38","2.35",,,,,"R","R","R","R","R","R",,,,,,"1 color imprint only.",,"USD",,"List","Silkscreen, Unimprinted","IMMD:Silkscreen, Unimprinted",,"Set-up Charge","Per Order","Required","1",,,,,,,,,,"50.00",,,,,,,,,,"Z",,,,,,,,,,"",,,,,,,,,,,,,,"N",,,,,,"Promotional","N",,,"Y","None",,,,
550308319,"20 oz Java Vacuum Tumbler","",,,,,"20 oz Java Vacuum Tumbler. Made with FDA compliant materials and 18-8 Stainless Steel, copper lined Black Matte finish. The tumbler has dual wall vacuum insulation for optimum heat retention. Featuring our patented designed lid that has lip and finger grooves that allow you to position the drinking spout without even looking. The tumbler also includes a leak proof screw on lid with a visual open/close push button locking closure that can come apart for easy cleaning. Also features a Silicone non-slip band. Product size: 9 3/8"" h x 3 1/4"" w x 3 1/4"" d.",,"http://media.asicdn.com/images/jpgb/21290000/21299016.jpg",,"Glasses-Drinking-Tumbler,TRAVEL MUGS/CUPS",,"Black","Stainless Steel,Silicone","Volume/Weight","20:oz","",,,"CHINA",,,,,,,"Laser Engraving, Silkscreen, TruColor (TM) Digital, Unimprinted",,"Paper Proof (Fax/Emailed paper proofs will be sent within 24-48 hours following receipt of usable artwork.), Virtual Proof (Virtual Spec (E-Spec) available for each item. Not available with embroidery and debossing imprint methods)","Black, Blaze Orange, dark green, Gold, Gray, light green, Maroon, Navy blue, Orange, Process Blue, Red, Reflex Blue, Silver, Teal, Violet, White, Yellow","Y","Y","1 1/2"" h x 2"" w (3 sq. in.), 1 1/4"" H x 2 1/4"" W, 1 1/4"" H x 2"" W","Laser, Silkscreen, TruColor (TM)",,,"Y",,"5","Y","3:	",,"Drawstring pouch","","","",,"Orders will be shipped FedEx unless otherwise specified.","N","",,,,,,"20 oz Java Vacuum Tumbler",,,"24","48","96","244",,,,,,,"14.59","14.59","14.59","14.59",,,,,,,"R","R","R","R",,,,,,,,"One Standard Color or Laser Engraving on One Location.",,"USD",,"List","Laser Engraving, TruColor (TM) Digital, Silkscreen, Unimprinted","IMMD:Laser Engraving, TruColor (TM) Digital, Silkscreen, Unimprinted",,"Set-up Charge","Per Order","Required","1",,,,,,,,,,"1.20",,,,,,,,,,"Z",,,,,,,,,,"",,,,,,,,,,,,,,"N",,,,,,"Promotional","N",,,"Y","None",,,,
550308319,,,,,,,,,,,,,,,,,,,,,,,,,,,,,,,,,,,,,,,,,,,,,,,,,,,,,,,,,,,,,,,,,,,,,,,,,,,,,,,,,,,,,,,,,,,,,,,"Paper Proof (Fax/Emailed paper proofs will be sent within 24-48 hours following receipt of usable artwork.), Virtual Proof (Virtual Spec (E-Spec) available for each item. Not available with embroidery and debossing imprint methods)","ARTW:Paper Proof (Fax/Emailed paper proofs will be sent within 24-48 hours following receipt of usable artwork.), Virtual Proof (Virtual Spec (E-Spec) available for each item. Not available with embroidery and debossing imprint methods)",,"Artwork Charge","Other","Optional","1",,,,,,,,,,"6.25",,,,,,,,,,"Z",,,,,,,,,,"",,,,,,,,,,,,,,,,,,,,,,,,,,,,,
4874423,"Letter opener","",,,,,"This translucent letter opener is a practical way to put your name on a promotional item that stands apart from the rest but is sure to be useful to recipients. With an imprint size of 2"" x 5/8"", this letter opener is available in a variety of colors and can be customized to your specifications. With this one of a kind office tool you have the power to create a promotional product that is as sharp looking as it is useful!",,"http://media.asicdn.com/images/jpgb/23380000/23389405.jpg",,"Letter Openers-Razor",,"Green,Black,Red,Blue","","","","",,,"CHINA",,,,,,,"Silkscreen",,"","","","","2"" x 5/8""","",,,"Y",,"10","","",,"","","","",,"","N","",,,,,,"Letter opener",,,"150","250","500","1000","2500",,,,,,"0.95","0.85","0.78","0.72","0.69",,,,,,"R","R","R","R","R",,,,,,,"N/A",,"USD",,"List","Silkscreen","IMMD:Silkscreen",,"Set-up Charge","Other","Required","1",,,,,,,,,,"45.00",,,,,,,,,,"Z",,,,,,,,,,"Imprint charge",,,,,,,,,,,,,,"N",,,,,,"Promotional","N",,,"Y","None",,,,
6510969,"16 oz Sirus Vacuum Tumbler","",,,,,"Made of FDA compliant materials, this tumbler has a dual wall construction with 18-8 Stainless Steel, copper lined vacuum insulation that will hold your beverage at the ideal drinking temperature at least 10X longer. Featuring our patented designed lid that features lip and finger grooves that allow you to position the drinking spout without even looking. The tumbler also includes a leak proof screw on lid with a visual open/close push button locking closure and can come apart for easy cleaning. Tumbler dimensions: 9 1/4"" H x 3"" W x 3"" D. Drinkware is ""Handwash Only"".",,"http://media.asicdn.com/images/jpgb/7050000/7058235.jpg",,"TRAVEL MUGS/CUPS",,"Red,Blue,Green,Stainless","Stainless Steel","","","",,,"CHINA",,,,,,,"Laser Engraving, Pad Print, TruColor (TM) Digital, Unimprinted",,"","Black, Blaze Orange, dark green, Gold, Gray, light green, Maroon, Navy blue, Orange, Process Blue, Red, Reflex Blue, Silver, Teal, Violet, White, Yellow","Y","Y","1 1/4"" H x 1 1/2"" W, 1 1/4"" H x 1 1/4"" W, 3 sq. in.","Laser Engraving (H x W), Pad Print (H x W), TruColor (TM)",,,"Y",,"5","Y","3:	",,"Drawstring pouch","","","",,"","N","",,,,,,"16 oz Sirus Vacuum Tumbler",,,"24","48","96","244",,,,,,,"15.39","14.92","14.44","13.49",,,,,,,"R","R","R","R",,,,,,,,"one standard color or laser engraving on one location.",,"USD",,"List","Pad Print, Laser Engraving, TruColor (TM) Digital, Unimprinted","IMMD:Pad Print, Laser Engraving, TruColor (TM) Digital, Unimprinted",,"Set-up Charge","Per Order","Required","1",,,,,,,,,,"55.00",,,,,,,,,,"Z",,,,,,,,,,"",,,,,,,,,,,,,,"N",,,,,,"Promotional","N",,,"Y","None",,,,
550115435,"16 oz. Kona Vacuum Tumbler","",,,,,"16 oz. Kona Vacuum Tumbler. These patent pending designed Earth toned tumblers bring the colors of nature to life. Featuring our new patented designed lid that features lip and finger grooves that allow you to position the drinking spout without even looking. The tumbler also includes a leak proof screw on lid with a visual open/close push button locking closure and can come apart for easy cleaning. Made of FDA compliant materials, this tumbler has dual wall construction with 18-8 stainless steel, copper lined vacuum insulation that will hold your beverage at the ideal drinking temperature at least 9 times longer. Size: 9 1/4"" h x 2 3/4"" w x 2 3/4"" d.",,"http://media.asicdn.com/images/jpgb/20550000/20558599.jpg",,"Glasses-Drinking-Tumbler,TRAVEL MUGS/CUPS",,"Stainless,Berry Red,Coffee Brown,Blue","Stainless Steel","","","",,,"CHINA",,,,,,,"Laser Engraved, Pad Print, Unimprinted",,"","Black, Blaze Orange, dark green, Gold, Gray, light green, Maroon, Navy blue, Orange, Process Blue, Red, Reflex Blue, Silver, Teal, Violet, White, Yellow","Y","Y","2"" H x 1 1/2"" W, 2"" H x 1 1/4"" W","Laser Engraving, Pad Printed",,,"Y",,"5","Y","3:	",,"Drawstring pouch","","","",,"","N","",,,,,,"16 oz Kona Vacuum Tumbler",,,"24","48","96","244",,,,,,,"15.59","15.09","14.59","13.59",,,,,,,"R","R","R","R",,,,,,,,"one standard color or one laser engraving on one location",,"USD",,"List","Pad Print, Laser Engraved, Unimprinted","IMMD:Pad Print, Laser Engraved, Unimprinted",,"Set-up Charge","Per Order","Required","1",,,,,,,,,,"55.00",,,,,,,,,,"Z",,,,,,,,,,"per unitYou may order less than the minimum quantity",,,,,,,,,,,,,,"N",,,,,,"Promotional","N",,,"Y","None",,,,
7144962,"16 oz Caturra Vacuum Tumbler","",,,,,"16 oz Caturra Vacuum Tumbler. This tumbler is made with FDA compliant materials and 18-8 Stainless Steel. It is dual wall, copper lined vacuum-sealed for optimum heat retention. It features our patented designed lid that has lip and finger grooves, which allow you to position the drinking spout without even looking. This model comes in seven different colors and includes a leak-proof screw-on lid with a visual open/close push button locking closure. Visual open/close push button locking closure comes apart for easy cleaning. Dimensions: 9 1/4"" x 2 3/4"" x 2 3/4"" (H x W x D). Drinkware is ""Handwash Only"".",,"http://media.asicdn.com/images/jpgb/7720000/7727172.jpg",,"TRAVEL MUGS/CUPS",,"Red,Blue,Purple,Green,Orange,Stainless,Light Blue","Stainless Steel","","","",,,"CHINA",,,,,,,"Laser Engraving, Pad Print, TruColor (TM), Unimprinted",,"","Blaze Orange, Gray","Y","Y","1 1/4"" H x 1 3/4"" W, 1 1/4"" H x 2"" W, 3 sq. in.","Laser Engraving (H x W), Pad Print (H x W), TruColor (TM)",,,"Y",,"5","Y","3:	",,"Drawstring pouch","","","",,"","N","",,,,,,"16 oz Caturra Vacuum Tumbler",,,"24","48","96","244",,,,,,,"12.99","12.99","12.99","12.99",,,,,,,"R","R","R","R",,,,,,,,"one standard color or laser engraving on one location",,"USD",,"List","Pad Print, Laser Engraving, TruColor (TM), Unimprinted","IMMD:Pad Print, Laser Engraving, TruColor (TM), Unimprinted",,"Set-up Charge","Per Order","Required","1",,,,,,,,,,"55.00",,,,,,,,,,"Z",,,,,,,,,,"",,,,,,,,,,,,,,"N",,,,,,"Promotional","N",,,"Y","None",,,,
550602033,"15 oz El Grande Two Tone ceramic mug - purple interior","",,,,,"Add your brand to something that any coffee lover can put to use with the El Grande Two Tone Mug. This 15 oz. ceramic mug features a traditional white exterior that provides the perfect space for an optional imprint of your organization's name, logo and advertising message. A purple interior adds an attractive color accent that will set this mug apart in the crowd. Whether you're gearing up for a tradeshow appearance or want to impress new hires with a branded gift, this mug is here for you.",,"http://media.asicdn.com/images/jpgb/22410000/22414007.jpg",,"Mugs & Steins-Ceramic",,"Purple,White,Multi color","Ceramic,Stoneware","Volume/Weight","15:oz","",,,"CHINA",,,,,,,"Silkscreen, Unimprinted",,"","","Y","Y","","",,,"Y",,"","","",,"","","","",,"","N","",,,,,,"15 oz El Grande Two Tone ceramic mug - purple interior",,,"12","24","36","72","144","288","576","1008","2016","5000","7.31","5.64","4.81","3.80","3.14","3.05","2.97","2.94","2.90","2.87","R","R","R","R","R","R","R","R","R","R",,"1 color imprint only.",,"USD",,"List","Silkscreen, Unimprinted","IMMD:Silkscreen, Unimprinted",,"Set-up Charge","Per Order","Required","1",,,,,,,,,,"50.00",,,,,,,,,,"Z",,,,,,,,,,"",,,,,,,,,,,,,,"N",,,,,,"Promotional","N",,,"Y","None",,,,
550502101,"Limited Series Waiter's Corkscrew Wine Bottle Opener","",,,,,"Waiter's corkscrew with double hinged corkscrew and a gorgeous limited edition finish. Choose from a few limited edition special series to set your corkscrew apart from the rest! A customer favorite. Use it to open bottles professionally with incredible ease. Features ergonomic grip, stainless steel serrated foil cutter blade, spiral corkscrew, metal handle, and bottle opener. Please inquire for laser engraving.",,"http://media.asicdn.com/images/jpgb/22040000/22042267.jpg",,"BAR ACCESSORIES,CORKSCREWS,WINE ACCESSORIES",,"Black,Gold","Stainless Steel","Dimension","Length:4 3/4:in;Width:1/2:in","",,,"CHINA",,,,,,,"Laser Engraving, Printed, Unimprinted",,"","","Y","Y","1/4"" x 1 5/8""","",,,"Y",,"5","Y","",,"","200:per Case","","31:lbs",,"","N","",,,,,,"Waiter's Corkscrew Wine Bottle Opener",,,"50","100","250","500","1000",,,,,,"3.90","3.70","3.60","3.50","3.40",,,,,,"R","R","R","R","R",,,,,,,"1 Color 1 location imprint.",,"USD",,"List","Laser Engraving, Printed, Unimprinted (Sold Unimprinted)","IMMD:Laser Engraving, Printed, Unimprinted (Sold Unimprinted)",,"Set-up Charge","Other","Required","1",,,,,,,,,,"50.00",,,,,,,,,,"Z",,,,,,,,,,"",,,,,,,,,,,,,,"N",,,,,,"Promotional","N",,,"Y","None",,,,
5365540,"Tant Twist Brass Ballpoint Pen","",,,,,"This twist action slim ballpoint pen has a metallic color barrel for a sleek look bound to make it stand apart from the rest. Featuring chrome and gold trim, black ink comes standard with this pen. Customized to your specifications, this one of a kind item completes any gift bag it is a great item to place at table settings at any conference or presentation. Upgrade to gel or blue ink for an additional cost.",,"http://media.asicdn.com/images/jpgb/21630000/21630087.jpg",,"Pens-Ballpoint-Twist Action",,"Chrome,Translucent Blue,Translucent Burgundy","Brass","","","",,,"CHINA",,,,,,,"Laser Engraving, Silkscreen",,"","","","","1/4"" x 1 3/4"", 1/4"" x 2"", 13/16"" x 2"", 5/8"" x 1 3/4""","",,,"Y",,"10","","",,"Polybag","","","1000 pieces / 37:lbs",,"","N","",,,,,,"Tant Twist Brass Ballpoint Pen",,,"100","250","500","1000","2500",,,,,,"2.30","2.00","1.80","1.70","1.60",,,,,,"R","R","R","R","R",,,,,,,"one color one position laser engraving in gold or silk screen.",,"USD",,"List","Silkscreen, Laser Engraving","IMMD:Silkscreen, Laser Engraving",,"Set-up Charge","Other","Required","1",,,,,,,,,,"45.00",,,,,,,,,,"Z",,,,,,,,,,"Imprint charge                                                                            Imprint Option(Oxidation black or laser chorme) : Oxidation                                                                                                                                                                                                                                Imprint Size : 1/4"" x 1 3/4"" (on cap), 1/4"" x 2"" (on barrel)",,,,,,,,,,,,,,"N",,,,,,"Promotional","N",,,"Y","None",,,,
550591880,"12 Oz Effect Black Out - Green In","",,,,,"Set your promotion apart from the pack with this 12 oz. cafe mug with a stylish matte finish. Featuring an eye-catching two-color design - black on the outside with a green interior - this handy item can be customized to your liking. Include a silkscreened imprint of you company name and logo, event title and more to create a corporate handout that will make a lasting impression. Perfect for cafes and kitchens, this product will have your brand sipping to success!",,"http://media.asicdn.com/images/jpgb/22390000/22398868.jpg",,"Mugs & Steins-Ceramic",,"Black,Green,Medium Green,Lime Green,Multi color","Ceramic,Stoneware","Volume/Weight","12:oz","",,,"CHINA",,,,,,,"Silkscreen, Unimprinted",,"","","Y","Y","","",,,"Y",,"","","",,"","","","",,"","N","",,,,,,"Glossy Green interior",,,"12","24","36","72",,,,,,,"6.78","5.11","4.27","3.27",,,,,,,"R","R","R","R",,,,,,,,"1 color imprint only.",,"USD",,"List","Silkscreen, Unimprinted","IMMD:Silkscreen, Unimprinted",,"Set-up Charge","Per Order","Required","1",,,,,,,,,,"50.00",,,,,,,,,,"Z",,,,,,,,,,"",,,,,,,,,,,,,,"N",,,,,,"Promotional","N",,,"Y","None",,,,
3192361,"Pentagon column Award","",,,,,"Reward quality performance with a fascinating award of crystal artistry! The pentagon column award features optic crystal columns that refracts light and colors for a stunning display. For a unique touch that is sure to set this award apart from the rest is a die-struck medal and allowing for a generous imprint area. Packaged in a satin-lined gift box with cotton gloves not only protects the award but allows for stunning presentation at ceremonies, charity events and much more.",,"http://media.asicdn.com/images/jpgb/5770000/5774323.jpg",,"Awards-Crystal",,"","Crystal","Dimension","Length:3 1/2:in;Width:11:in;Height:2 3/4:in,Length:3 1/2:in;Width:8:in;Height:2 3/4:in,Length:3 1/2:in;Width:5 3/4:in;Height:2 3/4:in","",,,"CHINA",,,,,,,"Etched",,"","","","Y","","",,,"Y",,"","","",,"Gift Box","","","",,"","N","",,,,,,"Large",,,"1","10","25","50","100",,,,,,"220.94","203.94","198.28","192.61","188.83",,,,,,"R","R","R","R","R",,,,,,,"N/A",,"USD",,"List","Etched","IMMD:Etched",,"Set-up Charge","Other","Required","1",,,,,,,,,,"75.00",,,,,,,,,,"Z",,,,,,,,,,"Imprint charge",,,,,,,,,,,,,,"N",,,,,,"Promotional","N",,,"Y","None",,,,
6801601,"District Briefcase","",,,,,"Carry your business farther! Our District briefcase is 16"" x 12.5"" x 8"" of 1680 ballistic nylon. Features include double needle stitching, reinforced zippers and ergonomic pulls, three inside front pockets, large outside pocket for embroidery space, internal zip and stretch pockets, 2 large main compartment storage areas, zip-apart laptop holder for travel ease, and comfort grip handles. Price includes one color, one location logo imprint.",,"http://media.asicdn.com/images/jpgb/7280000/7285818.jpg",,"BRIEFCASES,LAPTOP SLEEVES/CASES",,"Black","Nylon","Dimension","Length:16:in;Width:12.5:in;Height:8:in","",,,"CHINA",,,,,,,"Printed",,"","","","","5.5"" x 3""","",,,"Y",,"","","",,"","","","",,"","N","",,,,,,"District Briefcase",,,"50","100","250","500","1000",,,,,,"110.95","109.75","108.25","106.50","104.75",,,,,,"R","R","R","R","R",,,,,,,"One color, one location Imprint.",,"USD",,"List","Printed","IMMD:Printed",,"Set-up Charge","Other","Required","1",,,,,,,,,,"45.00",,,,,,,,,,"Z",,,,,,,,,,"Imprint charge",,,,,,,,,,,,,,"N",,,,,,"Promotional","N",,,"Y","None",,,,
