XID,Product_Name,Product_Number,Product_SKU,Product_Inventory_Link,Product_Inventory_Status,Product_Inventory_Quantity,Description,Summary,Prod_Image,Catalog_Information,Category,Keywords,Product_Color,Material,Size_Group,Size_Values,Shape,Theme,Tradename,Origin,Option_Type,Option_Name,Option_Values,Can_order_only_one,Req_for_order,Option_Additional_Info,Imprint_Method,Linename,Artwork,Imprint_Color,Sold_Unimprinted,Personalization,Imprint_Size,Imprint_Location,Additional_Color,Additional_Location,Product_Sample,Spec_Sample,Production_Time,Rush_Service,Rush_Time,Same_Day_Service,Packaging,Shipping_Items,Shipping_Dimensions,Shipping_Weight,Shipper_Bills_By,Shipping_Info,Ship_Plain_Box,Comp_Cert,Product_Data_Sheet,Safety_Warnings,Additional_Info,Distibutor_Only,Disclaimer,Base_Price_Name,Base_Price_Criteria_1,Base_Price_Criteria_2,Q1,Q2,Q3,Q4,Q5,Q6,Q7,Q8,Q9,Q10,P1,P2,P3,P4,P5,P6,P7,P8,P9,P10,D1,D2,D3,D4,D5,D6,D7,D8,D9,D10,Product_Number_Price,Price_Includes,QUR_Flag,Currency,Less_Than_Min,Price_Type,Upcharge_Name,Upcharge_Criteria_1,Upcharge_Criteria_2,Upcharge_Type,Upcharge_Level,Service_Charge,UQ1,UQ2,UQ3,UQ4,UQ5,UQ6,UQ7,UQ8,UQ9,UQ10,UP1,UP2,UP3,UP4,UP5,UP6,UP7,UP8,UP9,UP10,UD1,UD2,UD3,UD4,UD5,UD6,UD7,UD8,UD9,UD10,Upcharge_Details,U_QUR_Flag,Confirmed_Thru_Date,Product_Number_Criteria_1,Product_Number_Criteria_2,Product_Number_Other,SKU_Criteria_1,SKU_Criteria_2,SKU_Criteria_3,SKU_Criteria_4,SKU,Inventory_Link,Inventory_Status,Inventory_Quantity,Distributor_View_Only,Operation,Carrier_Information,Item_Weight,Warranty,Battery,Industry_Segment,SEO_FLG,UPC_Code,Additional_Imprint_Information,Item_Assembled,Delivery_Option,Do_Not_Use,Product_Status,Workflow_Status,Last_Updated_Date
550842316,"Poppin Peepers Chicken","",,,,,"Poppin Peepers ChickenHand Held fun creatures for all.  Guanranteed to make you giggleChickenEye Popping Fun",,,,"Toys-General",,"","","","","",,,"CHINA",,,,,,,"Unimprinted",,"","","Y","","","",,,"Y",,"","","",,"","","","",,"We provide free shipping to all ASI members with in the 48 contiguous states with no minimum purchase required.","N","",,,,,,"",,,"24",,,,,,,,,,"4.527",,,,,,,,,,"R",,,,,,,,,,,"N/A",,"USD",,"List",,,,,,,,,,,,,,,,,,,,,,,,,,,,,,,,,,,,,,,,,,,,,,,,,,,"N",,,,,,"Promotional","N",,,"Y","None",,,,
551077477,"Chicken of the Sea Tuna Salad Cups","",,,,,"2 - 2.8 oz tuna salad in sealed plastic cup. 80 calories per cup. Ready to eat. Wild caught. Dolphin safe. Ingredients light tuna water sugar cucumber pickle salt modified food starch onion lemon powder mustard paste salt black pepper mustard flour egg white powder titanium dioxide food color garlic powder onion powder xanthan gum.",,,,"Food Gifts-Meat",,"","","","","",,,"CHINA",,,,,,,"Unimprinted",,"","","Y","","","",,,"Y",,"","","",,"","","","",,"We provide free shipping to all ASI members with in the 48 contiguous states with no minimum purchase required.","N","",,,,,,"",,,"16",,,,,,,,,,"8.873",,,,,,,,,,"R",,,,,,,,,,,"N/A",,"USD",,"List",,,,,,,,,,,,,,,,,,,,,,,,,,,,,,,,,,,,,,,,,,,,,,,,,,,"N",,,,,,"Promotional","N",,,"Y","None",,,,
7404928,"Custom LED Sign - Fried Chicken - 23"" x 14""","",,,,,"Custom LED sign. Steady and flashing modes. High quality long-lasting LEDs. 3mm thick acrylic face that won't yellow over time. CE and UL approved power supply. This is an example of a custom sign. All signs are manufactured according to your specifications. Image and pricing are for reference only and will vary depending on your individual requirements.",,,,"ENVIRONMENTALLY FRIENDLY PRODUCTS,GLOW PRODUCTS,LED PRODUCTS,Lights-Flashing,Signs & Displays-Electric",,"","","Dimension","Length:23:in;Width:14:in","",,,"CHINA",,,,,,,"Pad Print",,"","","","Y","","",,,"Y",,"50","","",,"","","","",,"","N","",,,,,,"Custom LED Sign - Fried Chicken - 23"" x 14""",,,"100","250","500",,,,,,,,"52.81","52.18","51.53",,,,,,,,"R","R","R",,,,,,,,,"N/A",,"USD",,"List",,,,,,,,,,,,,,,,,,,,,,,,,,,,,,,,,,,,,,,,,,,,,,,,,,,"N",,,,,,"Promotional","N",,,"Y","None",,,,
551179793,"Chicken/Rooster(Zodiac)Keychain","",,,,,"This metal rooster keychain is perfect giveaways to show your company image on the trade show.",,,,"Key Holders-With Animal Novelty",,"Yellow,Black","Alloy","Dimension","Length:2:in;Width:1 1/2:in","Chicken",,,"CHINA",,,,,,,"Laser Engraved",,"Virtual Proof, Pre-production Proof","","","","Customized","",,,"Y",,"30","","",,"Poly Bag","1000:per Carton","","60:lbs",,"","N","",,,,,,"",,,"2000","5000","8000","10000","15000",,,,,,"1.35","1.19","1.13","1.10","1.05",,,,,,"R","R","R","R","R",,,,,,,"1 color and 1location",,"USD",,"List",,,,,,,,,,,,,,,,,,,,,,,,,,,,,,,,,,,,,,,,,,,,,,,,,,,"N",,,,,,"Promotional","N",,,"Y","None",,,,
550248274,"Chicken shaped USB heater","",,,,,"Keep hot drinks warm. Small and light weight, easy to take away. Keep temp between 60 and 70 degree. USB port, easy to use.",,,,"HEATERS,HEATING PADS,PROMOTIONS,USB/FLASH DRIVES,WARMERS",,"Assorted","Iron-ABS","","","",,,"CHINA",,,,,,,"Silkscreen",,"","","","Y","3x1 CM","",,,"Y",,"25","Y","",,"","120:per Carton","59.5 cm:in;43.5 cm:in;45 cm:in","19.5:kg",,"All products ship from China, but pricing is based on shipping from any 1 Port anywhere in the USA (ie: FOB L.A. or FOB: Miami)","N","",,,,,,"Chicken shaped USB heater",,,"500","1000","1500","2000","2500",,,,,,"5.595","5.118","4.395","3.89","3.53",,,,,,"R","R","R","R","R",,,,,,,"No imprint",,"USD",,"List",,,,,,,,,,,,,,,,,,,,,,,,,,,,,,,,,,,,,,,,,,,,,,,,,,,"N",,,,,,"Promotional","N",,,"Y","None",,,,
200214913,"Custom JumboPlush Chicken","",,,,,"Custom plush jumbo stuffed toys. Promote in a BIG way! These gentle giants are perfect for your store displays, fund raising, employee incentives, raffles and more. Sizes available from 24"" to 5'. Minimum of 50 pieces. We specialize in creating your exact character or mascot. ASTM, CPSIA & Prop 65 compliant.",,,,"CUSTOM PRODUCTS-GENERAL,STUFFED ANIMALS & TOYS",,"White-Yellow,Custom s","","","","Chicken,Custom",,,"CHINA",,,,,,,"",,"Art Services","","","","","",,,"Y",,"45,60","Y","",,"","","","",,"","N","",,,,,,"Custom JumboPlush Chicken",,,"",,,,,,,,,,"QUR",,,,,,,,,,"R",,,,,,,,,,,"N/A",,"USD",,"List","Product Sample","SMPL:Product Sample",,"Sample Charge","Other","Optional","1",,,,,,,,,,"129.00",,,,,,,,,,"Z",,,,,,,,,,"",,,,,,,,,,,,,,"N",,,,,,"Promotional","N",,,"Y","None",,,,
7415438,"Custom LED Sign - Fried Chicken - 23"" x 14""","",,,,,"Custom LED sign. Steady and flashing modes. High quality long-lasting LEDs. 3mm thick acrylic face that won't yellow over time. CE and UL approved power supply. This is an example of a custom sign. All signs are manufactured according to your specifications. Image and pricing are for reference only and will vary depending on your individual requirements.",,,,"ENVIRONMENTALLY FRIENDLY PRODUCTS,GLOW PRODUCTS,LED PRODUCTS,Lights-Flashing,Signs & Displays-Electric",,"","","Dimension","Length:23:in;Width:14:in","",,,"CHINA",,,,,,,"Pad Print",,"","","","Y","","",,,"Y",,"50","","",,"","","","",,"","N","",,,,,,"Custom LED Sign - Fried Chicken - 23"" x 14""",,,"100","250","500",,,,,,,,"52.81","52.18","51.53",,,,,,,,"R","R","R",,,,,,,,,"N/A",,"USD",,"List",,,,,,,,,,,,,,,,,,,,,,,,,,,,,,,,,,,,,,,,,,,,,,,,,,,"N",,,,,,"Promotional","N",,,"Y","None",,,,
550133191,"Rhinestone, Sequin or Spangle Transfer","",,,,,"Rhinestone, Sequin or Spangle transfer, Chicken 3 x 4.5 inches. This is a stock design to reflect our capabilities, but most orders are custom, and we can match nearly any supplied artwork.  Lowest minimums in the marketplace, with most custom designs as low as 6-piece minimum.  Because each item is custom priced, please call for quote.  Pricing varies based on size, number of rhinestones, etc.",,,,"HEAT TRANSFERS",,"","Rhinestone","","","",,,"CHINA",,,,,,,"transfer",,"","","","","","",,,"Y",,"3","","",,"","","","",,"","N","",,,,,,"Rhinestone, Sequin or Spangle Transfer",,,"",,,,,,,,,,"QUR",,,,,,,,,,"R",,,,,,,,,,,"N/A",,"USD",,"List",,,,,,,,,,,,,,,,,,,,,,,,,,,,,,,,,,,,,,,,,,,,,,,,,,,"N",,,,,,"Promotional","N",,,"Y","None",,,,
4152951,"Chef Award","",,,,,"Chicken chef serving covered meal atop a black base with wood post fence.These awards are sure to make you peck for more while acknowledging a top seller or loyal client! These chicken chef shaped awards with serving tray & fence are sure to get the attention that you and your recipient are looking for. Each acrylic, custom chicken  can be personalized to include your recipient's name and message in digitally printed full color process or silkscreen imprinting on the surface for a true reflection of both your brand and their achievements! Order now!",,,,"Awards-Acrylic,Awards-Corporate,Awards-Recognition Plaques,Awards-Sculptures & Figurines,Custom Awards",,"Clear,Red,Brown,Black","Acrylic","","","Chef",,,"CHINA",,,,,,,"Digitally Printed, Full Color Process, Unimprinted",,"","","Y","Y","","",,,"Y",,"7","Y","",,"White box with silk paper","1:per Box","","",,"","N","",,,,,,"Chef Award",,,"",,,,,,,,,,"QUR",,,,,,,,,,"R",,,,,,,,,,,"N/A",,"USD",,"List",,,,,,,,,,,,,,,,,,,,,,,,,,,,,,,,,,,,,,,,,,,,,,,,,,,"N",,,,,,"Promotional","N",,,"Y","None",,,,
550580422,"Compressed T-shirt","",,,,,"Chicken tray package shap compressed t-shirt. Pricing based on a White Gildan G5000 shirt custom printed 1c, Compressed  and packaged with one full color process insert card.  Fashion/ Concert Style tees such as Bella/Canvas, Next Level, 50/50 Dry Blend T-shirt also available for compression.  Please call for Fashion T-shirt pricing.",,,,"Shirts-General,T-Shirts-Unisex",,"White,Assorted","Blend: Polyester/Cotton (50/50),Cotton","","","",,,"CHINA",,,,,,,"Spot Color",,"","","","","","",,,"Y",,"15","Y","1:	",,"","40:per Case","12:in;12:in;12:in","25:lbs",,"","N","",,,,,,"T-Shirt Compressed",,,"144","288","500","1000","3000",,,,,,"10.50","9.50","7.65","6.08","5.65",,,,,,"R","R","R","R","R",,,,,,,"White Gildan G5000 with 1c imprint, compressed with 1 top insert card & Meat tray",,"USD",,"List","Spot Color","IMMD:Spot Color",,"Set-up Charge","Other","Required","1",,,,,,,,,,"50.00",,,,,,,,,,"Z",,,,,,,,,,"",,,,,,,,,,,,,,"N",,,,,,"Promotional","N",,,"Y","None",,,,
550170431,"Reusable Turkey Poultry Timer","",,,,,"Ideal for turkey, chicken and other poultry. Press legs down to the horizontal position. Insert timer in the thickest part of poultry meat.",,,,"TIMERS",,"","","","","",,,"CHINA",,,,,,,"",,"","","","","","",,,"Y",,"","","",,"","","","",,"","N","",,,,,,"Reusable Turkey Poultry Timer",,,"72",,,,,,,,,,"15.35",,,,,,,,,,"R",,,,,,,,,,,"Blank Price - Call for imprint options",,"USD",,"List",,,,,,,,,,,,,,,,,,,,,,,,,,,,,,,,,,,,,,,,,,,,,,,,,,,"N",,,,,,"Promotional","N",,,"Y","None",,,,
550170429,"Reusable Turkey Timer","",,,,,"This timer springs up to lets you know when your chicken or turkey is perfectly roasted. Simply stick into the thickest part of the breast.",,,,"Thermometers-General,TIMERS",,"","","","","",,,"CHINA",,,,,,,"",,"","","","","","",,,"Y",,"","","",,"","","","",,"","N","",,,,,,"Reusable Turkey Timer",,,"240",,,,,,,,,,"3.60",,,,,,,,,,"R",,,,,,,,,,,"Blank Price - Call for imprint options",,"USD",,"List",,,,,,,,,,,,,,,,,,,,,,,,,,,,,,,,,,,,,,,,,,,,,,,,,,,"N",,,,,,"Promotional","N",,,"Y","None",,,,
5409028,"Chefmaster (TM) 13pc Barbeque Set","",,,,,"Grill up a great time with this valuable thirteen piece barbeque set. Fry up perfect hamburgers or BBQ chicken with the included fork, spatula, tongs and basting brush, eight skewers, and storage case! The eight incorporated skewers are ideal for delicious meat or grilled vegetable kabobs , and can easily be cleaned to use again and again! Each utensil in this set features a stainless steel tube handle. Organize and store products easily with the included red zipper pouch. Pouch measures 19-1/4"" x 6-1/2"" x 2"". Limited lifetime warranty. Gift boxed.",,,,"BARBECUE ACCESSORIES",,"","Stainless Steel","","","",,,"CHINA",,,,,,,"Silkscreen, Unimprinted",,"Paper Proof (Additional paper proof.), Pre-production Proof (For an actual printed sample to approve, if there is an actual order in house.), Art Services (Non-suitable artwork.), Random Samples: Billed at EQP. Shipped within 48 hours.","","Y","","5"" x 3 1/4""","Case",,,"Y",,"10","Y","1:,5:	",,"Gift Boxes","12:per Carton","","42:lbs",,"","N","",,,,,,"Chefmaster (TM) 13pc Barbeque Set",,,"48","96","288","672","1536",,,,,,"22.33","21.12","20.33","19.55","18.78",,,,,,"R","R","R","R","R",,,,,,,"1 color and 1 location imprint.",,"USD",,"List",,,,,,,,,,,,,,,,,,,,,,,,,,,,,,,,,,,,,,,,,,,,,,,,,,,"N",,,,,,"Promotional","N",,,"Y","None",,,,
4605568,"Slow cooker","",,,,,"Dishwasher safe stoneware and lid. 4 quart capacity. Keep warm setting . Removable stoneware. Perfect size for a 4 lb. chicken or a 3 lb. roast. 4 star consumer rated",,,,"Tools-Kitchen-Appliances",,"Black-Chrome","Plastic","Dimension","Length:9:in;Width:12.5:in;Height:12.5:in","Oval",,,"CHINA",,,,,,,"Pad Print, Unimprinted",,"","","Y","","1.75"" x 1""","",,,"Y",,"10","Y","",,"","2:per Other","18:in;12.5:in;12.5:in","17.25:lbs",,"","N","",,,,,,"Slow cooker",,,"",,,,,,,,,,"QUR",,,,,,,,,,"R",,,,,,,,,,,"one color, one location imprint.",,"USD",,"List","Pad Print, Unimprinted","IMMD:Pad Print, Unimprinted",,"Set-up Charge","Other","Required","1",,,,,,,,,,"75.00",,,,,,,,,,"Z",,,,,,,,,,"",,,,,,,,,,,,,,"N",,,,,,"Promotional","N",,,"Y","None",,,,
200177023,"Hamilton Beach-HB LARGE CAP ROTISS OVEN","",,,,,"Maximum versatility - including rotisserie. Extra-large capacity - fits two 12"" pizzas, two 9"" x 13"" casseroles, or two cake pans. Revolving rotisserie - meat self-bastes as it turns - fits a 5 lb. chicken. Convection setting bakes faster and more evenly than traditional oven. Bake & broil settings with 2 hour timer. Includes 2 cooking racks, 2 baking pans, broiler rack & rotisserie accessories",,,,"Tools-Kitchen-Toasters",,"","","Dimension","Length:17.75:in;Width:23.13:in;Height:14.63:in","",,,"CHINA",,,,,,,"Pad Print",,"","","","","","",,,"Y",,"10","Y","",,"","1:per Other","23.25:in;17.88:in;14.88:in","27.65:lbs",,"","N","",,,,,,"Hamilton Beach-HB LARGE CAP ROTISS OVEN",,,"",,,,,,,,,,"QUR",,,,,,,,,,"R",,,,,,,,,,,"N/A",,"USD",,"List","Pad Print","IMMD:Pad Print",,"Set-up Charge","Other","Required","1",,,,,,,,,,"75.00",,,,,,,,,,"Z",,,,,,,,,,"",,,,,,,,,,,,,,"N",,,,,,"Promotional","N",,,"Y","None",,,,
200343150,"Hamilton Beach Toastation Toaster Oven","",,,,,"More cooking versatility in less space. Quickly bake and heat your favorite foods. Toasts up to 30% faster*. Extra-wide top toasting slot. Toast shade selector. As an oven- Spacious interior allows for baked potatoes and open-face sandwiches- Perfect for appetizers, pizza, chicken nuggets, french fries and more. As a toaster- Extra-wide toasting slot allows for wide bagels and breads- Toasts faster and more evenly than a toaster oven",,,,"Tools-Kitchen-Toasters",,"Black Silver","Metal","Dimension","Length:9.8:in;Width:17.13:in;Height:9.75:in","",,,"CHINA",,,,,,,"Pad Print",,"","","","","2"" x 1 ""","",,,"Y",,"10","Y","",,"","1:per Other","17.19:in;9.81:in;9.75:in","9:lbs",,"","N","",,,,,,"Hamilton Beach Toastation Toaster Oven",,,"25",,,,,,,,,,"53.17",,,,,,,,,,"R",,,,,,,,,,,"one time set up $75 (V)",,"USD",,"List","Pad Print","IMMD:Pad Print",,"Set-up Charge","Other","Required","1",,,,,,,,,,"75.00",,,,,,,,,,"Z",,,,,,,,,,"",,,,,,,,,,,,,,"N",,,,,,"Promotional","N",,,"Y","None",,,,
200177848,"Hamilton Beach-4 qt Oval Stay or Go - Black","",,,,,"Clip-tight sealed lid for spill resistance. Perfect size for 4 lb. chicken or 2 lb. roast. Clip-tight sealed lid locks onto slow cooker to help prevent messy spills. Bring 4 quarts of hot food to potlucks or parties anytime. Dishwasher safe stoneware & lid. Full-grip handles make carrying easier. 3 settings - low, high & warm. 4 1/2 star consumer rated",,,,"Tools-Kitchen-Appliances",,"Black-Chrome","Plastic","Dimension","Length:9.5:in;Width:13.75:in;Height:14:in","Oval",,,"CHINA",,,,,,,"Pad Print, Unimprinted",,"","","Y","","1.75"" x 1""","",,,"Y",,"10","Y","",,"","1:per Other","14.19:in;9.94:in;14.57:in","10.81:lbs",,"","N","",,,,,,"Hamilton Beach-4 qt Oval Stay or Go - Black",,,"25",,,,,,,,,,"32.68",,,,,,,,,,"R",,,,,,,,,,,"one time set up $75(V)",,"USD",,"List","Pad Print, Unimprinted","IMMD:Pad Print, Unimprinted",,"Set-up Charge","Other","Required","1",,,,,,,,,,"75.00",,,,,,,,,,"Z",,,,,,,,,,"",,,,,,,,,,,,,,"N",,,,,,"Promotional","N",,,"Y","None",,,,
200177026,"Hamilton Beach-SS Rotisserie/Casserole/Pizza Oven","",,,,,"Maximum versatility - including rotisserie. Extra-large capacity - fits two 12"" pizzas, two 9"" x 13"" casseroles, or two cake pans. Revolving rotisserie - meat self-bastes as it turns - fits a 5 lb. chicken. Convection setting bakes faster and more evenly than traditional oven. Bake & broil settings with 2 hour timer. Includes 2 cooking racks, 2 baking pans, broiler rack & rotisserie accessories",,,,"Tools-Kitchen-Toasters",,"","","Dimension","Length:17.63:in;Width:23.25:in;Height:14.25:in","",,,"CHINA",,,,,,,"Pad Print",,"","","","","","",,,"Y",,"10","Y","",,"","1:per Other","23.37:in;17.75:in;14.5:in","26.35:lbs",,"","N","",,,,,,"Hamilton Beach-SS Rotisserie/Casserole/Pizza Oven",,,"",,,,,,,,,,"QUR",,,,,,,,,,"R",,,,,,,,,,,"N/A",,"USD",,"List","Pad Print","IMMD:Pad Print",,"Set-up Charge","Other","Required","1",,,,,,,,,,"75.00",,,,,,,,,,"Z",,,,,,,,,,"",,,,,,,,,,,,,,"N",,,,,,"Promotional","N",,,"Y","None",,,,
200177512,"Hamilton Beach-4-SLICE SS OVEN","",,,,,"Saves time & energy - reheats 28% faster and uses 80% less energy. Fits a 9 inch pizza. 30 minute timer with automatic shutoff and ready bell. Bake, broil and toast settings. Includes bake pan. Adjustable temperature. Nonslip feet. Fits 4 toast slices, 2 open face sandwiches, 2 pork chops or chicken nuggets",,,,"Tools-Kitchen-Toasters",,"","","Dimension","Length:13.19:in;Width:16.38:in;Height:9.75:in","",,,"CHINA",,,,,,,"Pad Print",,"","","","","","",,,"Y",,"10","Y","",,"","1:per Other","16.38:in;13.19:in;9.75:in","8.2:lbs",,"","N","",,,,,,"Hamilton Beach-4-SLICE SS OVEN",,,"",,,,,,,,,,"QUR",,,,,,,,,,"R",,,,,,,,,,,"N/A",,"USD",,"List","Pad Print","IMMD:Pad Print",,"Set-up Charge","Other","Required","1",,,,,,,,,,"75.00",,,,,,,,,,"Z",,,,,,,,,,"",,,,,,,,,,,,,,"N",,,,,,"Promotional","N",,,"Y","None",,,,
5394160,"4 slice toaster oven","",,,,,"Second oven convenience - saves time & energy. Reheats 28% faster and uses 80% less energy than a typical kitchen oven when reheating precooked frozen chicken nuggets. Fits a 9 inch pizza. 30 minute cooking timer with ready bell and automatic shutoff at the end of cooking time. Adjustable temperature. Bake pan included. Nonslip feet",,,,"Tools-Kitchen-Toasters",,"","","Dimension","Length:13.13:in;Width:16.53:in;Height:9.75:in","",,,"CHINA",,,,,,,"Pad Print",,"","","","","","",,,"Y",,"10","Y","",,"","1:per Other","16.57:in;13.13:in;9.75:in","8.46:lbs",,"","N","",,,,,,"4 slice toaster oven",,,"25","50","100","250","500",,,,,,"39.00","37.76","37.51","37.26","37.01",,,,,,"R","R","R","R","R",,,,,,,"N/A",,"USD",,"List","Pad Print","IMMD:Pad Print",,"Set-up Charge","Other","Required","1",,,,,,,,,,"75.00",,,,,,,,,,"Z",,,,,,,,,,"",,,,,,,,,,,,,,"N",,,,,,"Promotional","N",,,"Y","None",,,,
200343229,"HAMILTON BEACH Countertop Oven with Convection & Rotisserie","",,,,,"Maximum versatility - including rotisserie. Extra-large capacity - fits two 12"" pizzas, two 9"" x 13"" casseroles, or two cake pans. Revolving rotisserie - meat self-bastes as it turns - fits a 5 lb. chicken. Convection setting bakes faster and more evenly than traditional oven. Bake & broil settings with 2 hour timer. Includes 2 cooking racks, 2 baking pans, broiler rack & rotisserie accessories",,,,"Tools-Kitchen-Toasters",,"Black","","Dimension","Length:17.88:in;Width:23.38:in;Height:14.75:in","",,,"CHINA",,,,,,,"Pad Print",,"","","","","2"" x 1 ""","",,,"Y",,"10","Y","",,"","1:per Other","23.5:in;18:in;15:in","27.2:lbs",,"","N","",,,,,,"HAMILTON BEACH Countertop Oven with Convection & Rotisserie",,,"25",,,,,,,,,,"112.65",,,,,,,,,,"R",,,,,,,,,,,"one time set up $75(V)",,"USD",,"List","Pad Print","IMMD:Pad Print",,"Set-up Charge","Other","Required","1",,,,,,,,,,"75.00",,,,,,,,,,"Z",,,,,,,,,,"",,,,,,,,,,,,,,"N",,,,,,"Promotional","N",,,"Y","None",,,,
200177892,"Hamilton Beach-HB 5 qt Black SC w/Lid Latch","",,,,,"Reduce messy spills with Lid Latch(TM) strap. Lid Latch(TM) strap anchors onto base to reduce messy spills. Bring 5 quarts of hot food to potlucks or parties anytime. Keep warm setting maintains the ideal serving temperature. Dishwasher safe stoneware and glass lid . 5 quart capacity . Keep warm setting . Perfect size for a 5 lb. chicken or 3 lb. roast",,,,"Tools-Kitchen-Appliances",,"","","Dimension","Length:9.51:in;Width:13.63:in;Height:13.75:in","",,,"CHINA",,,,,,,"Pad Print, Unimprinted",,"","","Y","","1.75"" x 1""","",,,"Y",,"10","Y","",,"","1:per Other","14:in;10:in;14.38:in","12.1:lbs",,"","N","",,,,,,"Hamilton Beach-HB 5 qt Black SC w/Lid Latch",,,"25",,,,,,,,,,"31.77",,,,,,,,,,"R",,,,,,,,,,,"one time set up fee $75(V)",,"USD",,"List","Pad Print, Unimprinted","IMMD:Pad Print, Unimprinted",,"Set-up Charge","Other","Required","1",,,,,,,,,,"75.00",,,,,,,,,,"Z",,,,,,,,,,"",,,,,,,,,,,,,,"N",,,,,,"Promotional","N",,,"Y","None",,,,
551179820,"Stuffed ChickenRooster Toy","",,,,,"With lovely chicken design,14'' stuffed toy is made of short plush. Good playmate to children.",,,,"STUFFED ANIMALS & TOYS",,"Purple,Red,Pink,Green","Short plush","Dimension","Length:14:in","Chicken",,,"CHINA",,,,,,,"Embroidered, Unimprinted",,"Virtual Proof, Pre-production Proof","","Y","","Customized","",,,"Y",,"30","","",,"Poly Bag","50:per Carton","25:in;20:in;23:in","33:lbs",,"","N","",,,,,,"",,,"500","1000","3000","5000","8000",,,,,,"10.05","6.50","5.90","5.39","4.99",,,,,,"R","R","R","R","R",,,,,,,"Cost and freight",,"USD",,"List",,,,,,,,,,,,,,,,,,,,,,,,,,,,,,,,,,,,,,,,,,,,,,,,,,,"N",,,,,,"Promotional","N",,,"Y","None",,,,
5847178,"Coloring Book: Barnyard Animals","",,,,,"Your company will want to ""mooo-ve"" on promoting the Coloring Book: Barnyard Animals! A visit to the farm to learn about cows, chickens and other barnyard animals. The product is CPSIA compliant and has 16 pages of a complete story line. These creative characters teach valuable lessons. Don't forget to imprint a message or logo to the cover. A fun handout that can attract new customers to your brand!",,,,"COLORING BOOKS",,"White","Paper","Dimension","Length:8:in;Width:10 1/2:in","",,,"CHINA",,,,,,,"Offset",,"Email/Fax Proof, Product Proof","Athletic Gold, Black, Brown, Burgundy, Charcoal Gray, Cream, Dark Teal, Forest Green, Green, Lemon, Magenta, Maroon, Metallic Copper, Metallic Gold, Metallic Silver, Navy blue, Orange, Pink, Process Blue, Purple, Red, Reflex Blue, Royal Blue, Teal, White","","","5"" x 1 1/2""","",,,"Y",,"7","","",,"Books shipped Bulk; Optional crayon packs ship bulk, seperate","350:per Carton","","25:lbs",,". per 350 pieces.; 25 lbs","N","",,,,,,"Coloring Book: Barnyard Animals",,,"500","1000","2500","5000",,,,,,,"0.98","0.91","0.79","0.67",,,,,,,"R","R","R","R",,,,,,,,"2 color imprint, 1 location.",,"USD",,"List","Offset","IMMD:Offset",,"Set-up Charge","Per Order","Required","1",,,,,,,,,,"50.00",,,,,,,,,,"Z",,,,,,,,,,"Imprint chargeYou may order less than the minimum quantity",,,,,,,,,,,,,,"N",,,,,,"Promotional","N",,,"Y","None",,,,
4888010,"BBQ Set","",,,,,"Gear up for summertime with help from this BBQ set! Packaged in a 17"" x 5"" x 3"" black case with an adjustable shoulder strap and handle, this extensive set comes complete with two skewers, one fork, one spatula, one pair of tongs, one brush and four corn holders to prepare you for cookouts, tailgates and more! It meets FDA requirements and can be customized with a silkscreened imprint of your company name and logo to make a grillmaster out of your customers today!",,,,"BARBECUE ACCESSORIES,Tools-Kitchen-Corn Holders",,"Black","","Standard & Numbered","PRODUCTCOLOR","",,,"CHINA",,,,,,,"Silkscreen, Unimprinted",,"Art Services (Art Charges will be assessed according to time, difficulty and amount of materials used. NOTE: All artwork received will be maxed out to our imprint area unless otherwise specified on your artwork and P.O.), Paper Proof (Paper Proofs will be Faxed unless otherwise noted on purchase order. Production begins after receipt of written proof approval. NO CREDIT WILL BE ISSUED FOR ANY ART ERRORS AFTER APPROVAL.), Product Proof, Virtual Proof, Electronic Proofs will be Emailed unless otherwise noted on purchase order. Production begins after receipt of written proof approval. NO CREDIT WILL BE ISSUED FOR ANY ART ERRORS AFTER APPROVAL.","Athletic Gold, Black, Brown, Burgundy, Forest Green, Gray, Kelly Green, light blue, Maroon, Navy blue, Orange, Pink, Process Blue, Purple, Red, Royal Blue, Tan, Teal, White, Yellow","Y","Y","4"" x 3""","",,,"Y",,"3,10","Y","",,"Bulk, Special  - When special packaging is specified, an additional charge will be levied.  Please identify your customs brokers.","15:per Box","25.00:in;17.00:in;13.00:in","27:lbs",,"","N","",,,,,,"Silk-Screen",,,"24","48","96","144","288",,,,,,"21.86","19.01","16.53","14.38","12.50",,,,,,"R","R","R","R","R",,,,,,,"N/A",,"USD",,"List","Silkscreen, Unimprinted","IMMD:Silkscreen, Unimprinted",,"Set-up Charge","Per Order","Required","1",,,,,,,,,,"25.00",,,,,,,,,,"Z",,,,,,,,,,"Per Color(if applies), Per LocationYou may order less than the minimum quantity",,,,,,,,,,,,,,"N",,,,,,"Promotional","N",,,"Y","None",,,,
