550039807,"Cheers - Flashdrive with bottle opener","",,,,,"2 items we should never be without.  A bottle opener, and a data storage device!  Mix some fun and practicality in with your next promotional campaign with the Cheers bottle opener flash drive.  Great promotional gift for restaurants, clubs, and where a cold one is served!",,"http://media.asicdn.com/images/jpgb/20300000/20308899.jpg",,"COMPUTER ACCESSORIES,Openers-Bottle,USB/FLASH DRIVES",,"Chrome","Metal","","","Can opener,Bottle Opener",,,"CHINA",,,,,,,"Laser Engraving, Silkscreen, Unimprinted",,"","","Y","","1/4"" x 1 1/2""","",,,"Y",,"8","","",,"white box, TUCK BOX","","","",,"","N","",,,,,,"1GB",,,"100","250","500","1000",,,,,,,"8.40","8.20","8.00","7.80",,,,,,,"R","R","R","R",,,,,,,,"1st Location/1st Color",,"USD",,"List","Silkscreen, Laser Engraving, Unimprinted (Sold Unimprinted)","IMMD:Silkscreen, Laser Engraving, Unimprinted (Sold Unimprinted)",,"Set-up Charge","Other","Required","1",,,,,,,,,,"50.00",,,,,,,,,,"Z",,,,,,,,,,"1st color / 1st location, Imprint charge",,,,,,,,,,,,,,"N",,,,,,"Promotional","N",,,"Y","None",,,,
200178887,"Metal Cap-Less USB Flash Drive","",,,,,"Your customers will store your brand in their memory with this silver USB flash drive! Featuring a built in keyring hook, this full metal construction, cap-less flash drive measures 2 1/8"" x 1/2"" and comes individually gift boxed for your convenience. An ideal promotional giveaway for the tech savvy, this handy device is available in six data sizes. Invest in this rectangular flash drive today and drive your business forward!",,"http://media.asicdn.com/images/jpgb/21270000/21272870.jpg",,"COMPUTER ACCESSORIES,USB/FLASH DRIVES",,"Silver","Aluminum","","","",,,"CHINA",,,,,,,"Laser Engraving, Silkscreen",,"","","","","1"" x 3/8""","",,,"Y",,"14","","",,"white box","","","",,"","N","",,,,,,"1GB",,,"100","250","500","1000",,,,,,,"9.51","9.33","9.14","8.89",,,,,,,"R","R","R","R",,,,,,,,"1st Color/ 1st Location",,"USD",,"List",,,,,,,,,,,,,,,,,,,,,,,,,,,,,,,,,,,,,,,,,,,,,,,,,,,"N",,,,,,"Promotional","N",,,"Y","None",,,,
200178911,"Bristol","",,,,,"Play your cards right when you invest in this credit card shaped USB flash drive! This white, plastic construction flash drive is available in five data sizes with optional full color printing. Measuring 3 1/4"" x 2"", this thin, handy device is an ideal giveaway item for the tech savvy. Plug your brand into your customers' memory when you give away this USB flash drive at your next promotional or technology themed event!",,"http://media.asicdn.com/images/jpgb/20260000/20267631.jpg",,"COMPUTER ACCESSORIES,USB/FLASH DRIVES",,"White","Plastic","","","Credit Card,Rectangle,Card",,,"CHINA",,,,,,,"Full Color Process, Silkscreen, Unimprinted",,"","","Y","Y","1 1/2"" x 1 1/2""","",,,"Y",,"12","Y","3:	",,"Bulk","","","",,"","N","",,,,,,"1GB",,,"100","250","500","1000",,,,,,,"8.40","8.20","8.00","7.80",,,,,,,"R","R","R","R",,,,,,,,"1st Location/1st Color",,"USD",,"List","Silkscreen, Full Color Process, Unimprinted (Sold Unimprinted)","IMMD:Silkscreen, Full Color Process, Unimprinted (Sold Unimprinted)",,"Set-up Charge","Other","Required","1",,,,,,,,,,"0.30",,,,,,,,,,"Z",,,,,,,,,,"running for full color logo, Imprint charge",,,,,,,,,,,,,,"N",,,,,,"Promotional","N",,,"Y","None",,,,
200286711,"T-Drive - Shirt themed Flash Drive","",,,,,"Here batter batter batter! Hit a home run with this adorable t-shirt baseball themed plastic flash drive. Customizable to showcase your organization logo or favorite sports team, this one of a kind product is perfect for players, coaches and fans alike. A great way to promote any event, this one of a kind flash drive is ideal for college recruiting events, high school fundraisers and general team spirit!",,"http://media.asicdn.com/images/jpgb/7910000/7912497.jpg",,"COMPUTER ACCESSORIES,USB/FLASH DRIVES",,"Red,White,Black,Blue","Plastic","","","Shirt,Baseball Shirt,Baseball Jersey,T-Shirt",,,"CHINA",,,,,,,"Full Color Process, Silkscreen, Unimprinted",,"","","Y","","1/2"" x 3/4""","",,,"Y",,"8","","",,"white box","","","",,"","N","",,,,,,"1GB",,,"100","250","500","1000",,,,,,,"7.60","7.40","7.30","7.00",,,,,,,"R","R","R","R",,,,,,,,"1st Location/1st Color",,"USD",,"List","Silkscreen, Full Color Process, Unimprinted (Sold Unimprinted)","IMMD:Silkscreen, Full Color Process, Unimprinted (Sold Unimprinted)",,"Set-up Charge","Other","Required","1",,,,,,,,,,"50.00",,,,,,,,,,"Z",,,,,,,,,,"",,,,,,,,,,,,,,"N",,,,,,"Promotional","N",,,"Y","None",,,,
200223969,"Silicon USB Flash Drive Keyholder","",,,,,"This Silicon USB Flash Drive Keyholder is the ""key"" to success! Featuring a modern design and one year warranty, this item is available in a variety of colors and memory options. Protected by a shock, moisture and electromagnetic proof casing, each drive comes with a snap shut keyring. Measuring 2"" x 7/8"" x 1/2"", this USB 2.0 gen chip has a write/delete protect switch, hot plug and play, and a fast access rate read/write speed of 12Mbp/s & 8Mbp/s.",,"http://media.asicdn.com/images/jpgb/6990000/6994026.jpg",,"COMPUTER ACCESSORIES,USB/FLASH DRIVES",,"Orange,Yellow,Green,White,Blue,Purple","Silicon","Standard & Numbered","512MB,1GB,2GB,4GB,8GB,16GB","",,,"CHINA",,,,,,,"Silkscreen, Unimprinted",,"","","Y","","1 1/8"" x 1/2""","",,,"Y",,"21","","",,"Gift Box","","","400 pcs / 20:lbs",,"","N","",,,,,,"512MB",,,"100","250","500","1000",,,,,,,"8.58","8.41","8.25","8.03",,,,,,,"R","R","R","R",,,,,,,,"N/A",,"USD",,"List","Silkscreen, Unimprinted (Sold Unimprinted)","IMMD:Silkscreen, Unimprinted (Sold Unimprinted)",,"Set-up Charge","Other","Required","1",,,,,,,,,,"50.00",,,,,,,,,,"Z",,,,,,,,,,"1st color / 1st location, Imprint charge",,,,,,,,,,,,,,"N",,,,,,"Promotional","N",,,"Y","None",,,,
200178883,"Genesis - Classic Swivel USB Drive","",,,,,"The classic flash drive that started it all!  Brighten up your marketing campaign with this colorful USB flash drive! This plastic, cap-less construction flash drive measures 1 1/4"" x 1/2"" and features colorful details with brush aluminum casing. An ideal giveaway item for tradeshows, conventions, schools and technology themed events!",,"http://media.asicdn.com/images/jpgb/21270000/21272871.jpg",,"COMPUTER ACCESSORIES,USB/FLASH DRIVES",,"Green,Blue,Red,Yellow,Orange,Black,White,Light Blue","Plastic-Aluminum","","","Rectangle",,,"CHINA",,,,,,,"Full Color Process, Laser Engraving, Silkscreen",,"","","","","1"" x 1/2""","",,,"Y",,"8","","",,"white box","","","",,"","N","",,,,,,"1GB",,,"100","250","500","1000",,,,,,,"7.60","7.40","7.30","7.00",,,,,,,"R","R","R","R",,,,,,,,"1st color/1st location",,"USD",,"List","Silkscreen, Laser Engraving, Full Color Process","IMMD:Silkscreen, Laser Engraving, Full Color Process",,"Set-up Charge","Other","Required","1",,,,,,,,,,"0.30",,,,,,,,,,"Z",,,,,,,,,,"",,,,,,,,,,,,,,"N",,,,,,"Promotional","N",,,"Y","None",,,,
200223972,"Silicon Whistle Shaped USB Flash Drive","",,,,,"Flash your sound for a successful campaign! This Silicon Whistle Shaped USB Flash Drive can be customized to your specifications in a variety of colors. Measuring 1 7/8"" x 3/4"", this item is protected by shock, moisture and electromagnetic proof casing. Other features of this USB 2.0 gen chip are a write/delete protect switch, hot plug and play and a fast access rate read/write speed of 12Mbp/s & 8Mbp/s. A one year warranty is included.",,"http://media.asicdn.com/images/jpgb/6990000/6994028.jpg",,"COMPUTER ACCESSORIES,USB/FLASH DRIVES",,"Blue,Yellow,White,Green,Red","Silicon","Standard & Numbered","512MB,1GB,2GB,4GB,8GB,16GB","",,,"CHINA",,,,,,,"Silkscreen, Unimprinted",,"","","Y","","1/2"" x 1""","",,,"Y",,"21","","",,"Gift Box","","","400 pcs / 21:lbs",,"","N","",,,,,,"512MB",,,"100","250","500","1000",,,,,,,"8.58","8.41","8.25","8.03",,,,,,,"R","R","R","R",,,,,,,,"N/A",,"USD",,"List","Silkscreen, Unimprinted (Sold Unimprinted)","IMMD:Silkscreen, Unimprinted (Sold Unimprinted)",,"Set-up Charge","Other","Required","1",,,,,,,,,,"50.00",,,,,,,,,,"Z",,,,,,,,,,"1st color / 1st location, Imprint charge",,,,,,,,,,,,,,"N",,,,,,"Promotional","N",,,"Y","None",,,,
200178910,"Access - Key Themed USB Flash Drive","",,,,,"Your brand is bound to ""flash"" into their minds every time they use this USB flash drive! Featuring a cap-less design with a metal color finish, each device is individually gift boxed for your convenience. Measuring 2 1/4"" x 1"", this handy flash drive is available in five data sizes and comes in your choice of black, blue, chrome, green, red or silver. Invest in the key to success with this one of a kind item!",,"http://media.asicdn.com/images/jpgb/20260000/20267651.jpg",,"COMPUTER ACCESSORIES,USB/FLASH DRIVES",,"Black,Red,Chrome,Blue,Green,Pink,Orange,Yellow","Aluminum","","","",,,"CHINA",,,,,,,"Laser Engraving, Silkscreen",,"","","","","1 1/4"" x 1/4""","",,,"Y",,"14","Y","3:	",,"white box","","","",,"","N","",,,,,,"1GB",,,"100","250","500","1000",,,,,,,"7.60","7.40","7.30","7.00",,,,,,,"R","R","R","R",,,,,,,,"1st Location/ 1st Color",,"USD",,"List",,,,,,,,,,,,,,,,,,,,,,,,,,,,,,,,,,,,,,,,,,,,,,,,,,,"N",,,,,,"Promotional","N",,,"Y","None",,,,
550082956,"Range - Rifle ammo themed USB flash drive","",,,,,"This rifle bullet themed USB flash drive is sure to help your company message stand out and leave a lasting impression!  Perfect for clubs, expos, and shooting ranges.  Available in silver or copper finish, style varies slightly with each color.",,"http://media.asicdn.com/images/jpgb/20750000/20758799.jpg",,"COMPUTER ACCESSORIES,USB/FLASH DRIVES",,"Copper,Silver","Metal","","","Bullet",,,"CHINA",,,,,,,"Laser Engraving, Silkscreen, Unimprinted",,"","","Y","","3/8"" x 1""","",,,"Y",,"8","","",,"white box, TUCK BOX","","","",,"","N","",,,,,,"1GB",,,"100","250","500","1000",,,,,,,"9.10","8.90","8.70","8.50",,,,,,,"R","R","R","R",,,,,,,,"1st Location/1st Color",,"USD",,"List","Silkscreen, Laser Engraving, Unimprinted (Sold Unimprinted)","IMMD:Silkscreen, Laser Engraving, Unimprinted (Sold Unimprinted)",,"Set-up Charge","Other","Required","1",,,,,,,,,,"50.00",,,,,,,,,,"Z",,,,,,,,,,"1st color / 1st location, Imprint charge",,,,,,,,,,,,,,"N",,,,,,"Promotional","N",,,"Y","None",,,,
200343577,"Cobra","",,,,,"Black fuax leather USB drive with magnetic buckle closure, accented by eye catching red color stitching.  Metal body for extra protection and carrying slot for carrying convenience.",,"http://media.asicdn.com/images/jpgb/22040000/22045577.jpg",,"COMPUTER ACCESSORIES,USB/FLASH DRIVES",,"Black","LEATHER","","","",,,"CHINA",,,,,,,"Deboss, Silkscreen",,"","","","","1/2"" x 1 1/4""","",,,"Y",,"14","","",,"white box","","","",,"","N","",,,,,,"4GB",,,"100","250","500","1000",,,,,,,"8.80","8.60","8.40","8.10",,,,,,,"R","R","R","R",,,,,,,,"1st color/1st location",,"USD",,"List","Silkscreen, Deboss","IMMD:Silkscreen, Deboss",,"Set-up Charge","Other","Required","100",,,,,,,,,,"1.25",,,,,,,,,,"Z",,,,,,,,,,"Setup per logo, Imprint charge",,,,,,,,,,,,,,"N",,,,,,"Promotional","N",,,"Y","None",,,,
200178922,"USB Flash drive, freight truck theme","",,,,,"Drive home a successful promotional campaign with a freight truck theme USB flash drive. Customized to your specifications, this cap-off item is made to look like a freight truck making it a wonderful giveaway for trucking, moving and hauling companies alike. Each item is individually gift boxed for convenience and comes in four data sizes to choose from. Measuring 2 7/8"" x 5/8"" x 3/8"", this is a tool bound to please.",,"http://media.asicdn.com/images/jpgb/21400000/21404907.jpg",,"COMPUTER ACCESSORIES,USB/FLASH DRIVES",,"Black,Blue,Black BLACK","Plastic","","","Truck",,,"CHINA",,,,,,,"Full Color, Silkscreen",,"","","","","1 1/4"" x 1/2""","",,,"Y",,"14","Y","3:	",,"white box","","","",,"","N","",,,,,,"1GB",,,"100","250","500","1000",,,,,,,"7.60","7.40","7.30","7.00",,,,,,,"R","R","R","R",,,,,,,,"1st Location/ 1st Color",,"USD",,"List",,,,,,,,,,,,,,,,,,,,,,,,,,,,,,,,,,,,,,,,,,,,,,,,,,,"N",,,,,,"Promotional","N",,,"Y","None",,,,
200297081,"Golden Nugget","",,,,,"The Golden Nugget Flash drive is the perfect promotional gift for finance, banking and money market sectors alike! Customized to your specifications, this one of a kind drive is the perfect way to welcome new clients to the investment or stock-trading world, or, makes a great new hire gift for new bankers and analysts. Business students and professionals alike are bound to get a kick out this handy yet unique computer accessory.",,"http://media.asicdn.com/images/jpgb/7630000/7635930.jpg",,"COMPUTER ACCESSORIES,USB/FLASH DRIVES",,"Gold","Metal","","","Gold Bar,Rectangle",,,"CHINA",,,,,,,"Laser Engraving, Silkscreen, Unimprinted",,"","","Y","","1/4"" x 1 1/2""","",,,"Y",,"8,12","","",,"white box","","","",,"","N","",,,,,,"1GB",,,"100","250","500","1000",,,,,,,"7.60","7.40","7.30","7.00",,,,,,,"R","R","R","R",,,,,,,,"1st Location/1st Color",,"USD",,"List","Silkscreen, Laser Engraving, Unimprinted (Sold Unimprinted)","IMMD:Silkscreen, Laser Engraving, Unimprinted (Sold Unimprinted)",,"Set-up Charge","Other","Required","1",,,,,,,,,,"50.00",,,,,,,,,,"Z",,,,,,,,,,"1st color / 1st location, Imprint charge",,,,,,,,,,,,,,"N",,,,,,"Promotional","N",,,"Y","None",,,,
200290396,"Speedster USB Drive","",,,,,"Get your company message out in the fast lane with the Speedster USB Drive! Featuring a silver body finish plus a retractable chip controlled at bottom of car, this one of a kind drive is a great promotional item for car dealerships and mechanic shops alike. Sports car enthusiasts are bound to appreciate an item that stores important documents and files while expressing a passion for the auto world!",,"http://media.asicdn.com/images/jpgb/7910000/7912222.jpg",,"COMPUTER ACCESSORIES,USB/FLASH DRIVES",,"Silver","Metal","","","Car,Race Car",,,"CHINA",,,,,,,"Laser Engraving, Silkscreen, Unimprinted",,"","","Y","","1/2"" x 3/8""","",,,"Y",,"8","","",,"white box","","","",,"","N","",,,,,,"1GB",,,"100","250","500","1000",,,,,,,"9.10","8.90","8.70","8.50",,,,,,,"R","R","R","R",,,,,,,,"1st Location/1st Color",,"USD",,"List","Silkscreen, Laser Engraving, Unimprinted (Sold Unimprinted)","IMMD:Silkscreen, Laser Engraving, Unimprinted (Sold Unimprinted)",,"Imprint Method Charge","Other","Required","1",,,,,,,,,,"50.00",,,,,,,,,,"Z",,,,,,,,,,"Setup per location laser",,,,,,,,,,,,,,"N",,,,,,"Promotional","N",,,"Y","None",,,,
200297086,"Veturra","",,,,,"Creative and adorable, the Venturra Flash Drive is sure to take get your marketing in the fast track! Available in five colors, these miniature USB racers are bond to be the talk of your next promotional event. The ideal accessory for students and professionals like, this is the perfect giveaway for taxi companies, car dealerships and travel agencies alike. Customized to your specifications, get your campaign off the gound in style!",,"http://media.asicdn.com/images/jpgb/21270000/21277096.jpg",,"COMPUTER ACCESSORIES,USB/FLASH DRIVES",,"Red,Yellow,White,Blue,Black","Plastic","","","Car,Beetle,Race Car",,,"CHINA",,,,,,,"Full Color Process, Silkscreen, Unimprinted",,"","","Y","","1/2"" X 1/2"", 3/8"" x 5/8""","Hood (Hood of car), Top",,,"Y",,"8","","",,"white box","","","",,"","N","",,,,,,"1GB",,,"100","250","500","1000",,,,,,,"9.10","8.90","8.70","8.50",,,,,,,"R","R","R","R",,,,,,,,"1st Location/1st Color",,"USD",,"List","Silkscreen, Full Color Process, Unimprinted (Sold Unimprinted)","IMMD:Silkscreen, Full Color Process, Unimprinted (Sold Unimprinted)",,"Set-up Charge","Other","Required","1",,,,,,,,,,"0.30",,,,,,,,,,"Z",,,,,,,,,,"",,,,,,,,,,,,,,"N",,,,,,"Promotional","N",,,"Y","None",,,,
200223439,"Leather USB Wristband w/ LED Indicator","",,,,,"This fashionably designed USB flash drive has a genuine leather casing, button snap open/closure, and a keyring hook. Featuring a LED indicator, and protected by a shock proof, moisture proof, and electromagnetic proof casing, this USB 2.0 gen chip has a write/delete protect switch, hot plug and play. Measuring 3 3/8"" x 1 1/4"" x 5/8"", this item has a fast access rate read/write speed of 12Mbp/s & 8Mbp/s, respectively.",,"http://media.asicdn.com/images/jpgb/6980000/6989714.jpg",,"COMPUTER ACCESSORIES,USB/FLASH DRIVES",,"Brown,Black,Blue","LEATHER","","","",,,"CHINA",,,,,,,"Hot Stamping, Silkscreen, Unimprinted",,"","","Y","","5/8"" x 1 1/2""","",,,"Y",,"21","","",,"White tuck box","","","200 pcs / 16:lbs",,"","N","",,,,,,"1GB",,,"100","250","500","1000",,,,,,,"8.40","8.20","8.00","7.80",,,,,,,"R","R","R","R",,,,,,,,"1st color/1st location",,"USD",,"List","Silkscreen, Hot Stamping, Unimprinted (Sold Unimprinted)","IMMD:Silkscreen, Hot Stamping, Unimprinted (Sold Unimprinted)",,"Set-up Charge","Other","Required","1",,,,,,,,,,"50.00",,,,,,,,,,"Z",,,,,,,,,,"1st color / 1st location, Imprint charge",,,,,,,,,,,,,,"N",,,,,,"Promotional","N",,,"Y","None",,,,
550090546,"Oregon - Laptop Briefcase","",,,,,"The Oregon laptop briefcase is made of heavy duty 1680D Twill Nylon with reinforced PVC backing to accompany you through your travels.  Features multiple zippered compartments, interior organizer, and adjustable/detachable padded shoulder strap.",,"http://media.asicdn.com/images/jpgb/20490000/20493495.jpg",,"LAPTOP SLEEVES/CASES",,"Black","Polyester","Dimension","Length:12.5:in;Width:16.5:in;Height:4:in","",,,"CHINA",,,,,,,"Silkscreen, Unimprinted",,"","","Y","","9"" x 8""","",,,"Y",,"5","Y","",,"12 pcs / ctn, Bulk","12:per Case","","35:lbs",,"","N","",,,,,,"Screen Imprint",,,"48","250","500","1000",,,,,,,"36.00","35.40","34.80","33.70",,,,,,,"R","R","R","R",,,,,,,,"first color/location imprint",,"USD",,"List","Silkscreen, Unimprinted (Sold Unimprinted)","IMMD:Silkscreen, Unimprinted (Sold Unimprinted)",,"Set-up Charge","Other","Required","1",,,,,,,,,,"60.00",,,,,,,,,,"Z",,,,,,,,,,"Imprint charge",,,,,,,,,,,,,,"N",,,,,,"Promotional","N",,,"Y","None",,,,
200178914,"COLT USB Drive","",,,,,"Featuring leather construction with heavy brush metal casing, this handy USB flash drive is an ideal giveaway item for the tech savvy! Measuring 3 3/8"" x 1"", this device is available in 6 data sizes and comes in your choice of black or brown. Each item is individually gift boxed for your convenience. Plug your brand into your customers' memory when you give away this USB flash drive at your next promotional event!",,"http://media.asicdn.com/images/jpgb/6530000/6530912.jpg",,"COMPUTER ACCESSORIES,USB/FLASH DRIVES",,"Black,Brown","LEATHER","","","",,,"CHINA",,,,,,,"Laser Engraving, Silkscreen",,"","","","","1"" x 1/2""","",,,"Y",,"14","","",,"white box","","","",,"","N","",,,,,,"1GB",,,"100","250","500","1000",,,,,,,"8.40","8.20","8.00","7.80",,,,,,,"R","R","R","R",,,,,,,,"1st Location/1st Color",,"USD",,"List",,,,,,,,,,,,,,,,,,,,,,,,,,,,,,,,,,,,,,,,,,,,,,,,,,,"N",,,,,,"Promotional","N",,,"Y","None",,,,
200286984,"Bright Idea Flashdrive","",,,,,"Have a brilliant idea and want to get your company message across? The Bright Idea Flash Drive is the answer! This light bulb themed USB drive is the ideal promotional item for tech junkies, entrepreneurs and inventors alike. Featuring a twist off cap, keyring attachment and light up feature when plugged in, this one of a kind flash drive is bound to be a conversation starter and reminder of your special event.  Available in 3 light up colors when plugged in.",,"http://media.asicdn.com/images/jpgb/7580000/7587338.jpg",,"COMPUTER ACCESSORIES,USB/FLASH DRIVES",,"Red,Blue,White","Plastic","","","Light Bulb,Bulb",,,"CHINA",,,,,,,"Silkscreen, Unimprinted",,"","","Y","","3/8"" x 5/8""","",,,"Y",,"8","","",,"white box","","","",,"","N","",,,,,,"1GB",,,"100","250","500","1000",,,,,,,"9.10","8.90","8.70","8.50",,,,,,,"R","R","R","R",,,,,,,,"1st Location/1st Color",,"USD",,"List","Silkscreen, Unimprinted (Sold Unimprinted)","IMMD:Silkscreen, Unimprinted (Sold Unimprinted)",,"Set-up Charge","Other","Required","1",,,,,,,,,,"50.00",,,,,,,,,,"Z",,,,,,,,,,"1st color / 1st location, Imprint charge",,,,,,,,,,,,,,"N",,,,,,"Promotional","N",,,"Y","None",,,,
200286698,"Heart Themed Flash Drive","",,,,,"Show your most valued guests and clients come love with this Heart Themed Flash Drive! Customized to your specifications, the plastic case construction with an LED light indicator plus a lanyard or keyring hook add convenience to this one of a kind, handy item. This is the perfect promotional item for hospitals, schools and non-profit groups alike! Wear your heart on your sleeve and distribute an item bound to see plenty of use!",,"http://media.asicdn.com/images/jpgb/22130000/22133810.jpg",,"COMPUTER ACCESSORIES,USB/FLASH DRIVES",,"Red","Plastic","","","Heart",,,"CHINA",,,,,,,"Silkscreen, Unimprinted",,"","","Y","","3/8"" x 1""","",,,"Y",,"14","","",,"white box","","","",,"","N","",,,,,,"1GB",,,"100","250","500","1000",,,,,,,"7.60","7.40","7.30","7.00",,,,,,,"R","R","R","R",,,,,,,,"1st Location/1st Color",,"USD",,"List","Silkscreen, Unimprinted (Sold Unimprinted)","IMMD:Silkscreen, Unimprinted (Sold Unimprinted)",,"Set-up Charge","Other","Required","1",,,,,,,,,,"50.00",,,,,,,,,,"Z",,,,,,,,,,"1st color / 1st location, Imprint charge",,,,,,,,,,,,,,"N",,,,,,"Promotional","N",,,"Y","None",,,,
550035828,"Memoire","",,,,,"The Memoire is a unique swivel mechanism USB flash drive with a brush metal plating on one side, and a memo window on the other - allowing you to label your drives or market additional info.  Built in hook allows for lanyard carry on the go.  Available in 4 color finishes.",,"http://media.asicdn.com/images/jpgb/20270000/20272249.jpg",,"USB/FLASH DRIVES",,"Red,Black,Royal Blue,Lime Green","Plastic","","","",,,"CHINA",,,,,,,"Laser Engraved, Silkscreen",,"","","","","1 1/2"" x 1/2""","",,,"Y",,"14","","",,"white box","","","",,"","N","",,,,,,"1GB",,,"100","250","500","1000",,,,,,,"9.51","9.33","9.14","8.89",,,,,,,"R","R","R","R",,,,,,,,"1st Color/ 1st Location",,"USD",,"List","Silkscreen, Laser Engraved","IMMD:Silkscreen, Laser Engraved",,"Imprint Method Charge","Per Order","Required","1",,,,,,,,,,"50.00",,,,,,,,,,"Z",,,,,,,,,,"Setup for 1st location 1st logo laser",,,,,,,,,,,,,,"N",,,,,,"Promotional","N",,,"Y","None",,,,
550039791,"9mm - Ammo themed USB flash drive","",,,,,"Miniature bullet theme USB flashdrive.  Twist off mechanism and lasers to silver tone finish.  A unique and fun promotional tool for shooting ranges, training facilities, and clubs.",,"http://media.asicdn.com/images/jpgb/20750000/20758782.jpg",,"COMPUTER ACCESSORIES,USB/FLASH DRIVES",,"Brass,Silver","Metal","","","Bullet",,,"CHINA",,,,,,,"Laser Engraving, Silkscreen, Unimprinted",,"","","Y","","1/4"" x 1 1/2""","",,,"Y",,"8","","",,"white box, TUCK BOX","","","",,"","N","",,,,,,"1GB",,,"100","250","500","1000",,,,,,,"9.10","8.90","8.70","8.50",,,,,,,"R","R","R","R",,,,,,,,"1st Location/1st Color",,"USD",,"List","Silkscreen, Laser Engraving, Unimprinted (Sold Unimprinted)","IMMD:Silkscreen, Laser Engraving, Unimprinted (Sold Unimprinted)",,"Set-up Charge","Other","Required","1",,,,,,,,,,"50.00",,,,,,,,,,"Z",,,,,,,,,,"1st color / 1st location, Imprint charge",,,,,,,,,,,,,,"N",,,,,,"Promotional","N",,,"Y","None",,,,
200286960,"Delight","",,,,,"This unique ice cream bar USB drive is a fun and delicious way to get your message across!  Show off your sweet message with this memorable themed drive at any promotional or fundraising event; or, sweeten up your booth at any convention or tradeshow! Customized to your specifications, an imprint is available on the body and stick so you can create a product sure to suit your specific needs and impress recipients.",,"http://media.asicdn.com/images/jpgb/7910000/7912342.jpg",,"COMPUTER ACCESSORIES,USB/FLASH DRIVES",,"Brown","Plastic","","","Ice Cream,Ice Cream Bar",,,"CHINA",,,,,,,"Custom, Silkscreen, Unimprinted",,"","","Y","","3/4"" x 3/4""","",,,"Y",,"8","","",,"white box","","","",,"","N","",,,,,,"1GB",,,"100","250","500","1000",,,,,,,"9.10","8.90","8.70","8.50",,,,,,,"R","R","R","R",,,,,,,,"1st Location/1st Color",,"USD",,"List","Silkscreen, Custom, Unimprinted (Sold Unimprinted)","IMMD:Silkscreen, Custom, Unimprinted (Sold Unimprinted)",,"Set-up Charge","Other","Required","1",,,,,,,,,,"50.00",,,,,,,,,,"Z",,,,,,,,,,"1st color / 1st location, Imprint charge",,,,,,,,,,,,,,"N",,,,,,"Promotional","N",,,"Y","None",,,,
200178913,"Charmlet","",,,,,"Wrap your brand around their brains when you wrap this USB flash drive around their wrists! Featuring a flexible silicon wrist band design, this colorful flash drive is available in 6 data sizes and comes in a variety of colors to choose from. Measuring 3/4"" x 1/2"", this handy device is an ideal giveaway for schools, tradeshows, conventions and technology themed events alike. Drive your business forward and invest in this flash drive today!",,"http://media.asicdn.com/images/jpgb/7910000/7912331.jpg",,"COMPUTER ACCESSORIES,USB/FLASH DRIVES",,"Black,Red,Yellow,Green,White,Pink,Navy","Silicone Rubber","","","",,,"CHINA",,,,,,,"Silkscreen, Unimprinted",,"","","Y","","3/4"" X 1/2"", 5"" x 1/2""","Band (ON BAND), Clip Area (ON DRIVE)",,,"Y",,"8","","",,"White cardboard box","","","",,"","N","",,,,,,"1GB",,,"100","250","500","1000",,,,,,,"7.60","7.40","7.30","7.00",,,,,,,"R","R","R","R",,,,,,,,"1st Location/1st Color",,"USD",,"List","Silkscreen, Unimprinted (Sold Unimprinted)","IMMD:Silkscreen, Unimprinted (Sold Unimprinted)",,"Set-up Charge","Other","Required","1",,,,,,,,,,"50.00",,,,,,,,,,"Z",,,,,,,,,,"",,,,,,,,,,,,,,"N",,,,,,"Promotional","N",,,"Y","None",,,,
