XID,Product_Name,Product_Number,Product_SKU,Product_Inventory_Link,Product_Inventory_Status,Product_Inventory_Quantity,Description,Summary,Prod_Image,Catalog_Information,Category,Keywords,Product_Color,Material,Size_Group,Size_Values,Shape,Theme,Tradename,Origin,Option_Type,Option_Name,Option_Values,Can_order_only_one,Req_for_order,Option_Additional_Info,Imprint_Method,Linename,Artwork,Imprint_Color,Sold_Unimprinted,Personalization,Imprint_Size,Imprint_Location,Additional_Color,Additional_Location,Product_Sample,Spec_Sample,Production_Time,Rush_Service,Rush_Time,Same_Day_Service,Packaging,Shipping_Items,Shipping_Dimensions,Shipping_Weight,Shipper_Bills_By,Shipping_Info,Ship_Plain_Box,Comp_Cert,Product_Data_Sheet,Safety_Warnings,Additional_Info,Distibutor_Only,Disclaimer,Base_Price_Name,Base_Price_Criteria_1,Base_Price_Criteria_2,Q1,Q2,Q3,Q4,Q5,Q6,Q7,Q8,Q9,Q10,P1,P2,P3,P4,P5,P6,P7,P8,P9,P10,D1,D2,D3,D4,D5,D6,D7,D8,D9,D10,Product_Number_Price,Price_Includes,QUR_Flag,Currency,Less_Than_Min,Price_Type,Upcharge_Name,Upcharge_Criteria_1,Upcharge_Criteria_2,Upcharge_Type,Upcharge_Level,Service_Charge,UQ1,UQ2,UQ3,UQ4,UQ5,UQ6,UQ7,UQ8,UQ9,UQ10,UP1,UP2,UP3,UP4,UP5,UP6,UP7,UP8,UP9,UP10,UD1,UD2,UD3,UD4,UD5,UD6,UD7,UD8,UD9,UD10,Upcharge_Details,U_QUR_Flag,Confirmed_Thru_Date,Product_Number_Criteria_1,Product_Number_Criteria_2,Product_Number_Other,SKU_Criteria_1,SKU_Criteria_2,SKU_Criteria_3,SKU_Criteria_4,SKU,Inventory_Link,Inventory_Status,Inventory_Quantity,Distributor_View_Only,Operation,Carrier_Information,Item_Weight,Warranty,Battery,Industry_Segment,SEO_FLG,UPC_Code,Additional_Imprint_Information,Item_Assembled,Delivery_Option,Do_Not_Use,Product_Status,Workflow_Status,Last_Updated_Date
550764566,"Blinking Viking Helmet with Braided Hair - Blank","",,,,,"Lady Viking Helmet with Blinky Horns makes for a lovely day in Valhalla! Perfect for Viking-themed company promotions, football and sports promos, as well as collegiate or high school promos for rallies or resale. Trade Shows? Go crazy! Festivals? Do it. To activate Viking Helmets with Flashing Horns, flip switch on the inside of both horns - flashing function only. One size fits most - from ladies to dudes with more petite heads who want to spruce up their Viking outfit.",,"http://media.asicdn.com/images/jpgb/23010000/23019260.jpg",,"Caps & Hats-Novelty,LED PRODUCTS,Light Up Novelties-Apparel",,"Red,Blue","","","","",,,"CHINA",,,,,,,"",,"","","","Y","","",,,"Y",,"","","",,"Bulk, Case","48:per Case","19:in;17:in;19:in","29:lbs",,"","N","",,,,,,"Blinking Viking Helmet with Braided Hair - Blank",,,"12","48","96","240",,,,,,,"7.98","7.82","7.48","7.07",,,,,,,"R","R","R","R",,,,,,,,"Blank, Stock Product.",,"USD",,"List",,,,,,,,,,,,,,,,,,,,,,,,,,,,,,,,,,,,,,,,,,,,,,,,,,,"N",,,,,,"Promotional","N",,,"Y","None",,,,
550777532,"Blinking Viking Helmet with Braided Hair - 5 Day","",,,,,"Lady Viking Helmet with Blinky Horns makes for a lovely day in Valhalla! Perfect for Viking-themed company promotions, football and sports promos, as well as collegiate or high school promos for rallies or resale. Trade Shows? Go crazy! Festivals? Do it. To activate Viking Helmets with Flashing Horns, flip switch on the inside of both horns - flashing function only. One size fits most - from ladies to dudes with more petite heads who want to spruce up their Viking outfit.",,"http://media.asicdn.com/images/jpgb/23050000/23057723.jpg",,"Caps & Hats-Novelty,LED PRODUCTS,Light Up Novelties-Apparel",,"Red,Blue","","","","",,,"CHINA",,,,,,,"Pad Print",,"","","","Y","0.8"" x 0.8""","Horn",,,"Y",,"5","","",,"Bulk, Case","48:per Case","19:in;17:in;19:in","29:lbs",,"","N","",,,,,,"Blinking Viking Helmet with Braided Hair - Blank",,,"240","480","960","2400",,,,,,,"7.07","6.65","6.23","5.98",,,,,,,"R","R","R","R",,,,,,,,"1 color, 1 location imprint.",,"USD",,"List","Pad Print","IMMD:Pad Print",,"Set-up Charge","Per Order","Required","1",,,,,,,,,,"50.00",,,,,,,,,,"Z",,,,,,,,,,"Per Color Per Order (REQUIRED)",,,,,,,,,,,,,,"N",,,,,,"Promotional","N",,,"Y","None",,,,
4920597,"Camo Knit Cap","",,,,,"Have your logo stand out with our knitted acrylic camouflage cap! A Custom Imprinted Promotional product that offers your organization the opportunity to get your name out there! Cotton twill with knitted acrylic interior. Display your logo while skiing or during a skateboarding convention. Great for fundraisers, military conferences and hunting expeditions. Show support for our Armed Forces with this imprinted accessory. Reversible.",,"http://media.asicdn.com/images/jpgb/21330000/21330761.jpg",,"Caps & Hats-Beanie,Caps & Hats-Knit",,"","Cotton/Acrylic","","","",,,"CHINA",,,,,,,"Embroidery, Image Lock, Unimprinted, Vivid Expressions (TM)",,"Paper Proof, Item Proof-Cost of one item at order price plus run charges and freight.","Athletic Gold, Beige-Brown, Black, Brown, Cardinal Red, Charcoal, Chili Red, Fluorescent Blue, Fluorescent Green, Fluorescent Orange, Fluorescent Pink, Fluorescent Yellow, Forest Green, Gray, Jade Green, Kelly Green, light blue, Maroon, Melon, Metallic Gold, Metallic Silver, Navy blue, Olive Drab Green, Orange, Process Blue, Purple, Red, Reflex Blue, Royal Blue, Rubine Red, Tan-Brown, Teal Green, Warm Red, White, Yellow","Y","Y","4"" W x 2.5"" H, 4.5"" w x 2.5"" h, Up to 2"" W x .75"" H, Up to 2.5"" W x 1.5"" H, Up to 3"" W x 1.25"" H, Up to 3"" W x 1.5"" H","Across back seam, Embroidery, Across back seam, Image Lock, Back panel, Embroidery, Embroidery (W x H), Image Lock (W x H), Side panel, Embroidery",,,"Y",,"","Y","1:,3:	",,"","144:per Case","","50:lbs",,"","N","",,,,,,"Image Lock",,,"48","96","144","576","1008",,,,,,"9.28","8.88","8.48","8.28","8.08",,,,,,"R","R","R","R","R",,,,,,,"N/A",,"USD",,"List","Embroidery, Vivid Expressions (TM), Image Lock, Unimprinted","IMMD:Embroidery, Vivid Expressions (TM), Image Lock, Unimprinted",,"Set-up Charge","Per Order","Required","1",,,,,,,,,,"25.00",,,,,,,,,,"Z",,,,,,,,,,"",,,,,,,,,,,,,,"N",,,,,,"Promotional","N",,,"Y","None",,,,
4920597,,,,,,,,,,,,,,,,,,,,,,,,,,,,,,,,,,,,,,,,,,,,,,,,,,,,,,,,,,,,,,,,,,,,,,,,,,,,,,,,,,,,,,,,,,,,,,,"Paper Proof, Item Proof-Cost of one item at order price plus run charges and freight.","ARTW:Paper Proof, Item Proof-Cost of one item at order price plus run charges and freight.",,"Artwork Charge","Other","Optional","1",,,,,,,,,,"12.00",,,,,,,,,,"Z",,,,,,,,,,"",,,,,,,,,,,,,,,,,,,,,,,,,,,,,
550693332,"Knitted Beanie-Bomber Style (No PomPom)","",,,,,"The bomber beanie is extra warm and stylish. Made of 100% acrylic yarn, many yarn stock colors to pick from. Select 1-6 stock yarn colors.",,"http://media.asicdn.com/images/jpgb/22750000/22756908.jpg",,"Caps & Hats-Beanie",,"Stock Yarn s","100% Acrylic","Standard & Numbered","Standard","",,,"CHINA",,,,,,,"Knitted",,"","","","Y","","",,,"Y",,"45","","",,"","200:per Carton","55:in;47:in;47:in","38:lbs",,"","N","",,,,,,"",,,"250","500","1000","2500","5000","10000",,,,,"6.19","4.95","4.67","4.20","3.86","2.13",,,,,"R","R","R","R","R","R",,,,,,"N/A",,"USD",,"List",,,,,,,,,,,,,,,,,,,,,,,,,,,,,,,,,,,,,,,,,,,,,,,,,,,"N",,,,,,"Promotional","N",,,"Y","None",,,,
550692026,"Beanie w/PomPom Top- HD","",,,,,"Old-School Cuffed Beanies w/ PomPom Top are the newest trending items in sports merchandising and apparel. Worn by numerous professional players, coaches, and fans, this is the hottest item in the gift shops for 2014. With your logo or text and color stripes knitted-in to the beanie along the top as well as the cuff (with embroidery as an added option) there are plenty of ways to customize the look and design of the product to fit your client's brand.",,"http://media.asicdn.com/images/jpgb/22740000/22745541.jpg",,"Caps & Hats-Beanie",,"Stock Yarn s","Acrylic","Standard & Numbered","Standard","",,,"CHINA",,,,,,,"Knitted",,"","Stock Yarn Colors","","Y","2.5"" X 2.5""","",,,"Y",,"20","","",,"","200:per Carton","55:in;47:in;47:in","38:lbs",,"","N","",,,,,,"Beanie w/PomPom Top- HD",,,"100","300","500","1000","2500","5000","10000",,,,"11.46","8.52","7.24","6.47","5.47","5.00","4.67",,,,"R","R","R","R","R","R","R",,,,,"Setup Included within parameters",,"USD",,"List",,,,,,,,,,,,,,,,,,,,,,,,,,,,,,,,,,,,,,,,,,,,,,,,,,,"N",,,,,,"Promotional","N",,,"Y","None",,,,
550692219,"Beanie w/ PomPom Top - HD","",,,,,"Old-School Cuffed Beanies w/ PomPom Top are the newest trending items in sports merchandising and apparel. Worn by numerous professional players, coaches, and fans, this is the hottest item in the gift shops for 2014. With your logo or text and color stripes knitted-in to the beanie along the top as well as the cuff (with embroidery as an added option) there are plenty of ways to customize the look and design of the product to fit your client's brand.",,"http://media.asicdn.com/images/jpgb/22750000/22750757.jpg",,"Caps & Hats-Beanie",,"Assorted-Assorted","100% Acrylic","Standard & Numbered","Standard","",,,"CHINA",,,,,,,"Knitted; select 1-6 stock yarn colors",,"","","","Y","2.5"" X 2.5""","On Cuff and/or Middle Section of Beanie",,,"Y",,"45","","",,"","200:per Carton","55:in;47:in;47:in","38:lbs",,"","N","",,,,,,"Beanie w/ PomPom Top - HD",,,"100","300","500","1000","2500","5000","10000",,,,"7.94","5.71","5.06","4.47","3.92","3.71","3.42",,,,"R","R","R","R","R","R","R",,,,,"setup Included wi/in parameters",,"USD",,"List","Knitted; select 1-6 stock yarn colors","IMMD:Knitted; select 1-6 stock yarn colors",,"Imprint Method Charge","Other","Required","1",,,,,,,,,,"0.67",,,,,,,,,,"Z",,,,,,,,,,"Embroidered  Patch  MOQ 500 units; request quote. Embroidered Logo (8K Stitches)",,,,,,,,,,,,,,"N",,,,,,"Promotional","N",,,"Y","None",,,,
550527071,"Knitted Beanie-Bomber Style (No PomPom)","",,,,,"The bomber beanie is extra warm and stylish. Made of 100% acrylic yarn, many yarn stock colors to pick from.",,"http://media.asicdn.com/images/jpgb/22110000/22116086.jpg",,"Caps & Hats-Beanie,Caps & Hats-Knit",,"Army Green 5767C,Beige 756C,Black,Coffee 439C,Dark Gray 11C,Green 356C,Light Gray 877C,Navy Blue 276C,Orange 1575C,Purple 2685C,Red 186C,Reflex BlueC,White,Yellow 109C","Acrylic","","","",,,"CHINA",,,,,,,"Knitted",,"","","","Y","","",,,"Y",,"45,52","","",,"","","","",,"","N","",,,,,,"Knitted Beanie-Bomber Style (No PomPom)",,,"250","500","1000","2500","5000","10000",,,,,"6.19","5.09","4.67","4.20","3.86","3.55",,,,,"R","R","R","R","R","R",,,,,,"1-6 stock yarn colors",,"USD",,"List",,,,,,,,,,,,,,,,,,,,,,,,,,,,,,,,,,,,,,,,,,,,,,,,,,,"N",,,,,,"Promotional","N",,,"Y","None",,,,
550527046,"Knitted Beanie-Bomber Style (No PomPom)","",,,,,"The bomber beanie is extra warm and stylish. Made of 100% acrylic yarn, many yarn stock colors to pick from.",,"http://media.asicdn.com/images/jpgb/22110000/22116086.jpg",,"Caps & Hats-Beanie",,"Army Green 5767C,Beige 756C,Black,Coffee 439C,Dark Gray 11C,Green 356C,Light Gray 877C,Navy Blue 276C,Orange 1575C,Purple 2685C,Red 186C,Reflex BlueC,White,Yellow 109C","Acrylic","","","",,,"CHINA",,,,,,,"Knitted",,"","","","Y","","",,,"Y",,"20,27","","",,"","","","",,"","N","",,,,,,"Knitted Beanie-Bomber Style (No PomPom)",,,"250","500","1000","2500","5000","10000",,,,,"9.10","7.43","6.78","5.71","5.13","4.76",,,,,"R","R","R","R","R","R",,,,,,"1-6 stock yarn colors",,"USD",,"List",,,,,,,,,,,,,,,,,,,,,,,,,,,,,,,,,,,,,,,,,,,,,,,,,,,"N",,,,,,"Promotional","N",,,"Y","None",,,,
550692477,"Knitted Beanie-Bomber Style (No PomPom)","",,,,,"The bomber beanie is extra warm and stylish. Made of 100% acrylic yarn, many yarn stock colors to pick from.",,"http://media.asicdn.com/images/jpgb/22750000/22755816.jpg",,"Caps & Hats-Beanie",,"Stock Yarn s","Acrylic","Standard & Numbered","Standard","",,,"CHINA",,,,,,,"Knitted",,"","","","Y","Request template","",,,"Y",,"20","","",,"","200:per Carton","55:in;47:in;47:in","38:lbs",,"","N","",,,,,,"Knitted Beanie-Bomber Style (No PomPom)",,,"250","500","1000","2500","5000","10000",,,,,"9.10","7.43","6.78","5.71","5.13","4.76",,,,,"R","R","R","R","R","R",,,,,,"Setup included within parameters",,"USD",,"List",,,,,,,,,,,,,,,,,,,,,,,,,,,,,,,,,,,,,,,,,,,,,,,,,,,"N",,,,,,"Promotional","N",,,"Y","None",,,,
4694097,"Port Authority Camouflage Fleece Beanie.","",,,,,"Port Authority Camouflage Fleece Beanie. This beanie has an anti-pill finish for lasting wear and it's perfect for times you want warmth without bulk or weight. Great for early morning outings or layered under a helmet or hat. Fabric: 100% polyester fleece",,"http://media.asicdn.com/images/jpgb/20750000/20756542.jpg",,"Caps & Hats-Beanie",,"Mossy Oak/ New Break-Up,Oilfield Camo,Realtree Xtra","Polyester Fleece","","","",,,"CHINA",,,,,,,"Unimprinted",,"","","Y","","","",,,"Y",,"","","",,"","","","",,"","N","",,,,,,"OSFA,Oilfield Camo,Realtree Xtra,Mossy Oak/ New Break-Up",,,"1","12","144",,,,,,,,"9.98","8.98","7.98",,,,,,,,"R","R","R",,,,,,,,,"Blank product only",,"USD",,"List",,,,,,,,,,,,,,,,,,,,,,,,,,,,,,,,,,,,,,,,,,,,,,,,,,,"N",,,,,,"Promotional","N",,,"Y","None",,,,
4694701,"Port Authority R-Tek Stretch Fleece Beanie.","",,,,,"Port Authority R-Tek Stretch Fleece Beanie. This plush hat is the perfect warm accessory for chilly days. An anti-pill finish gives lasting wear, while a 2.5-inch double-needle area is embroidery friendly. Fabric: 95/5 poly/spandex R-Tek stretch fleece for warmth and shape retention",,"http://media.asicdn.com/images/jpgb/20750000/20757365.jpg",,"Caps & Hats-Beanie",,"Athletic Gold,Midnight Heather,Black,Dark Green,Maroon,Navy,Orange,Purple,Red,Royal","Blend: Polyester/Spandex Fleece (95/5)","","","",,,"CHINA",,,,,,,"Unimprinted",,"","","Y","","","",,,"Y",,"","","",,"","","","",,"","N","",,,,,,"OSFA,Midnight Heather,Black,Dark Green,Maroon,Navy,Orange,Purple,Red,Royal,Athletic Gold",,,"1","12","144",,,,,,,,"5.98","4.98","3.98",,,,,,,,"R","R","R",,,,,,,,,"Blank product only",,"USD",,"List",,,,,,,,,,,,,,,,,,,,,,,,,,,,,,,,,,,,,,,,,,,,,,,,,,,"N",,,,,,"Promotional","N",,,"Y","None",,,,
6222668,"Warrior viking helmet with light-up horns","",,,,,"Have a light up Viking adventure when you wear a Warrior Viking Helmet with Light Up Horns! These lit horn hats are perfect for any occasion that you might want to roam or raid. Wearing a Warrior Viking Helmet with Light Up Horns will cause a stir at any event. LED colors: blue and red. One size fits most. CPSIA compliant. This product is not suitable for children under 5 years of age.",,"http://media.asicdn.com/images/jpgb/24210000/24211047.jpg",,"Caps & Hats-Novelty,COSTUMES & ACCESSORIES,GLOW PRODUCTS,LED PRODUCTS,Lights-Flashing",,"Red,Blue","","","","Viking Hat",,,"CHINA",,,,,,,"Unimprinted",,"","","Y","Y","","",,,"Y",,"1","","",,"","","","",,"","N","",,,,,,"Warrior viking helmet with light-up horns",,,"12","60","120","240",,,,,,,"6.73","6.43","6.13","5.83",,,,,,,"R","R","R","R",,,,,,,,"blank product only.",,"USD",,"List",,,,,,,,,,,,,,,,,,,,,,,,,,,,,,,,,,,,,,,,,,,,,,,,,,,"N",,,,,,"Promotional","N",,,"Y","None",,,,
6584742,"Port Authority Heathered Knit Beanie.","",,,,,"Port Authority Heathered Knit Beanie. Made from soft sweater fleece, this comfortable beanie will help keep chills at bay. Fabric 100% polyester sweater fleece",,"http://media.asicdn.com/images/jpgb/20750000/20757692.jpg",,"Caps & Hats-Beanie,Caps & Hats-Knit",,"Black Heather/Charcoal,Grey Heather/Black,Chocolate Heather/Black,Olive Heather/Black,Lagoon Blue Heather/Black,Oatmeal Heather/Brown","Polyester Fleece","","","",,,"CHINA",,,,,,,"Unimprinted",,"","","Y","","","",,,"Y",,"","","",,"","","","",,"","N","",,,,,,"OSFA,Grey Heather/Black,Chocolate Heather/Black,Olive Heather/Black,Lagoon Blue Heather/Black,Oat...",,,"1","12","144",,,,,,,,"6.98","5.98","4.98",,,,,,,,"R","R","R",,,,,,,,,"Blank product only",,"USD",,"List",,,,,,,,,,,,,,,,,,,,,,,,,,,,,,,,,,,,,,,,,,,,,,,,,,,"N",,,,,,"Promotional","N",,,"Y","None",,,,
4693640,"Port & Company - Beanie Cap.","",,,,,"Port & Company - Beanie Cap. A warm must-have accessory, this beanie is available in a variety of solid colors or with a contrasting trim. Fabric: 100% acrylic",,"http://media.asicdn.com/images/jpgb/6750000/6756505.jpg",,"Caps & Hats-Beanie,Caps & Hats-Knit",,"Athletic  Oxford/Black,Black/Natural,Navy/Natural,Athletic  Oxford,Black,Navy,Light Pink/White,Camel,Neon Blue,Neon Green,Neon Pink Glo,Neon Orange,Neon Yellow,Athletic Red,Athletic Royal","Acrylic","","","",,,"CHINA",,,,,,,"Unimprinted",,"","","Y","","","",,,"Y",,"","","",,"","","","",,"","N","",,,,,,"OSFA,Black/Natural,Navy/Natural,Athletic  Oxford,Black,Navy,Light Pink/White,Camel,Neon Blue,Neon...",,,"1","12","144",,,,,,,,"5.58","4.58","3.58",,,,,,,,"R","R","R",,,,,,,,,"Blank product only",,"USD",,"List",,,,,,,,,,,,,,,,,,,,,,,,,,,,,,,,,,,,,,,,,,,,,,,,,,,"N",,,,,,"Promotional","N",,,"Y","None",,,,
550526602,"Port & Company Fleece-Lined Knit Cap.","",,,,,"Port & Company Fleece-Lined Knit Cap. We took our popular knit cap style and fully lined it with fleece for additional warmth and comfort. Fabric 100% acrylic with 100% polyester fleece lining",,"http://media.asicdn.com/images/jpgb/22110000/22115203.jpg",,"Caps & Hats-Beanie,Caps & Hats-Knit",,"Athletic Green,Athletic Orange,Athletic Oxford,Athletic Red,Athletic Royal,Black,Maroon,Navy,Neon Pink Glo,Neon Yellow,White","Acrylic","","","",,,"CHINA",,,,,,,"Unimprinted",,"","","Y","","","",,,"Y",,"","","",,"","","","",,"","N","",,,,,,"OSFA,Athletic Orange,Athletic Oxford,Athletic Red,Athletic Royal,Black,Maroon,Navy,Neon Pink Glo,...",,,"1","12","144",,,,,,,,"6.98","5.98","4.98",,,,,,,,"R","R","R",,,,,,,,,"Blank product only",,"USD",,"List",,,,,,,,,,,,,,,,,,,,,,,,,,,,,,,,,,,,,,,,,,,,,,,,,,,"N",,,,,,"Promotional","N",,,"Y","None",,,,
7163425,"Sport-Tek Spectator Beanie.","",,,,,"Sport-Tek Spectator Beanie. Available in several team colors with a raised double stripe, this beanie is perfect for any fan. Coordinates with our Spectator Scarf (STA02, sold separately) and Spectator Gloves (STA01, sold separately). Fabric: 100% acrylic",,"http://media.asicdn.com/images/jpgb/20750000/20757059.jpg",,"Caps & Hats-Beanie",,"Black/ Iron Grey,Carolina Blue/ White,Deep Orange/ Black,Forest Green/ White,Gold/ Black,Maroon/ White,Purple/ White,Texas Orange/ White,True Navy/ White,True Red/ Black,True Royal/ White,Pink Raspberry/White","Acrylic","","","",,,"CHINA",,,,,,,"Unimprinted",,"","","Y","","","",,,"Y",,"","","",,"","","","",,"","N","",,,,,,"OSFA,Carolina Blue/ White,Deep Orange/ Black,Forest Green/ White,Gold/ Black,Maroon/ White,Purple...",,,"1","12","144",,,,,,,,"6.98","5.98","4.98",,,,,,,,"R","R","R",,,,,,,,,"Blank product only",,"USD",,"List",,,,,,,,,,,,,,,,,,,,,,,,,,,,,,,,,,,,,,,,,,,,,,,,,,,"N",,,,,,"Promotional","N",,,"Y","None",,,,
551079621,"Sport-Tek Striped Beanie with Solid Band.","",,,,,"Sport-Tek Striped Beanie with Solid Band. This fully lined beanie keeps the chill at bay and coordinates with our Striped Arm Socks (STA03) sold separately. 100% acrylic 89/9/2 acrylic/poly/metallic (Sport Blue/Silver, Team Navy/Silver) 100% polyester fleece lining",,"http://media.asicdn.com/images/jpgb/24040000/24047037.jpg",,"Caps & Hats-Beanie",,"Black/ Iron Grey,True Navy/ White,True Royal/ White,Black/ True Red,Maroon/ White,Forest Green/ White,Purple/ White,Black/ Gold,Deep Orange/ White,Black/ White,Team Navy/ Flash Green,Sport Blue/ Silver,Team Navy/ Silver,Sport Blue/ True Red,Forest Green/ Gold","Acrylic","","","",,,"CHINA",,,,,,,"Unimprinted",,"","","Y","","","",,,"Y",,"","","",,"","","","",,"","N","",,,,,,"OSFA,True Navy/ White,True Royal/ White,Black/ True Red,Maroon/ White,Forest Green/ White,Purple/...",,,"1","12","144",,,,,,,,"7.98","6.98","5.98",,,,,,,,"R","R","R",,,,,,,,,"Blank product only",,"USD",,"List",,,,,,,,,,,,,,,,,,,,,,,,,,,,,,,,,,,,,,,,,,,,,,,,,,,"N",,,,,,"Promotional","N",,,"Y","None",,,,
7152357,"District - Trapper.","",,,,,"District - Trapper. Trap nothing but style in this faux fur-lined favorite. 100% polyester 70/30 acrylic/poly faux fur lining Self-fabric chin straps with buckle Sizes: S/M, L/XL",,"http://media.asicdn.com/images/jpgb/20750000/20756983.jpg",,"Caps & Hats-With Ear Protection",,"Black","Polyester","Standard & Numbered","S/M,L/XL","",,,"CHINA",,,,,,,"Unimprinted",,"","","Y","","","",,,"Y",,"","","",,"","","","",,"","N","",,,,,,"S/M,L/XL,Black",,,"1","12","48",,,,,,,,"23.98","21.98","19.98",,,,,,,,"R","R","R",,,,,,,,,"Blank product only",,"USD",,"List",,,,,,,,,,,,,,,,,,,,,,,,,,,,,,,,,,,,,,,,,,,,,,,,,,,"N",,,,,,"Promotional","N",,,"Y","None",,,,
6584753,"Port Authority Fleece Beanie.","",,,,,"Port Authority Fleece Beanie. Top off your look with this warm fleece beanie--available as a single color or two-tone with a black band. Fabric 100% polyester fleece",,"http://media.asicdn.com/images/jpgb/20750000/20757634.jpg",,"Caps & Hats-Beanie",,"Black,Charcoal,Lagoon Blue,Mineral Green,Cafe Brown,Caldera Red,Lagoon Blue/Black,Mineral Green/Black,Caldera Red/Black,Charcoal/Black","Polyester Fleece","","","",,,"CHINA",,,,,,,"Unimprinted",,"","","Y","","","",,,"Y",,"","","",,"","","","",,"","N","",,,,,,"OSFA,Charcoal,Lagoon Blue,Mineral Green,Cafe Brown,Caldera Red,Lagoon Blue/Black,Mineral Green/Bl...",,,"1","12","144",,,,,,,,"8.58","7.58","6.58",,,,,,,,"R","R","R",,,,,,,,,"Blank product only",,"USD",,"List",,,,,,,,,,,,,,,,,,,,,,,,,,,,,,,,,,,,,,,,,,,,,,,,,,,"N",,,,,,"Promotional","N",,,"Y","None",,,,
6775180,"Nike Golf Dri-FIT Swoosh Front Cap.","",,,,,"Nike Golf Dri-FIT Swoosh Front Cap. The contrast Swoosh design trademark takes front and center on this unstructured, moisture-wicking cap A low profile, contrast underbill and hook and loop closure complete this sporty design Made of 100% Dri-FIT polyester.",,"http://media.asicdn.com/images/jpgb/24120000/24129690.jpg",,"Baseball Caps-General,Caps & Hats-Golf-General,PERFORMANCE APPAREL",,"Anthracite/ Black,Black/ White,Game Royal/ White,Lucky Green/ White,White/ Black","Polyester","","","",,,"CHINA",,,,,,,"Unimprinted",,"","","Y","","","",,,"Y",,"","","",,"","","","",,"","N","",,,,,,"OSFA,Black/ White,Game Royal/ White,Lucky Green/ White,White/ Black,Anthracite/ Black",,,"1","12","72",,,,,,,,"23.98","21.98","19.98",,,,,,,,"R","R","R",,,,,,,,,"Blank product only",,"USD",,"List",,,,,,,,,,,,,,,,,,,,,,,,,,,,,,,,,,,,,,,,,,,,,,,,,,,"N",,,,,,"Promotional","N",,,"Y","None",,,,
7152275,"District - Vintage Striped Beanie with Removable Pom.","",,,,,"District - Vintage Striped Beanie with Removable Pom. With its hand-knit, removable pom, you've got two old-school looks nailed in one beanie. 100% acrylic",,"http://media.asicdn.com/images/jpgb/20750000/20756974.jpg",,"Caps & Hats-Beanie,Caps & Hats-Knit",,"Black Multi,Red Multi,Turquoise Multi,Navy Multi","Acrylic","","","",,,"CHINA",,,,,,,"Unimprinted",,"","","Y","","","",,,"Y",,"","","",,"","","","",,"","N","",,,,,,"OSFA,Red Multi,Turquoise Multi,Navy Multi,Black Multi",,,"1","12","144",,,,,,,,"8.98","7.98","6.98",,,,,,,,"R","R","R",,,,,,,,,"Blank product only",,"USD",,"List",,,,,,,,,,,,,,,,,,,,,,,,,,,,,,,,,,,,,,,,,,,,,,,,,,,"N",,,,,,"Promotional","N",,,"Y","None",,,,
550526961,"Port & Company Fleece-Lined Beanie Cap.","",,,,,"Port & Company Fleece-Lined Beanie Cap. A soft fleece lining adds warmth to this versatile beanie. Fabric 100% acrylic with 100% polyester fleece lining",,"http://media.asicdn.com/images/jpgb/22110000/22115657.jpg",,"Caps & Hats-Beanie",,"Athletic Oxford,Athletic Red,Athletic Royal,Black,Navy,Neon Green,Neon Pink Glo,White","Acrylic","","","",,,"CHINA",,,,,,,"Unimprinted",,"","","Y","","","",,,"Y",,"","","",,"","","","",,"","N","",,,,,,"OSFA,Athletic Red,Athletic Royal,Black,Navy,Neon Green,Neon Pink Glo,White,Athletic Oxford",,,"1","12","144",,,,,,,,"7.58","6.58","5.58",,,,,,,,"R","R","R",,,,,,,,,"Blank product only",,"USD",,"List",,,,,,,,,,,,,,,,,,,,,,,,,,,,,,,,,,,,,,,,,,,,,,,,,,,"N",,,,,,"Promotional","N",,,"Y","None",,,,
4694031,"CornerStone - Enhanced Visibility Beanie with Reflective ...","",,,,,"CornerStone - Enhanced Visibility Beanie with Reflective Stripe. This non-ANSI certified beanie features 3M reflective yarn for superior reflective capability. Fabric: 100% acrylic",,"http://media.asicdn.com/images/jpgb/20740000/20743020.jpg",,"Caps & Hats-Beanie",,"Safety Orange/ Reflective,Safety Yellow/ Reflective","Acrylic","","","",,,"CHINA",,,,,,,"Unimprinted",,"","","Y","","","",,,"Y",,"","","",,"","","","",,"","N","",,,,,,"OSFA,Safety Yellow/ Reflective,Safety Orange/ Reflective",,,"1","12","144",,,,,,,,"14.98","12.98","10.98",,,,,,,,"R","R","R",,,,,,,,,"Blank product only",,"USD",,"List",,,,,,,,,,,,,,,,,,,,,,,,,,,,,,,,,,,,,,,,,,,,,,,,,,,"N",,,,,,"Promotional","N",,,"Y","None",,,,
550180642,"Port Authority Watch Cap.","",,,,,"Port Authority Watch Cap. This heavyweight, chunky rib knit cap has a traditional look and is always cold-weather-ready. Fabric: 100% acrylic",,"http://media.asicdn.com/images/jpgb/20750000/20757247.jpg",,"Caps & Hats-Beanie,Caps & Hats-Knit",,"Black,Navy,Graphite,Army Green","Acrylic","","","",,,"CHINA",,,,,,,"Unimprinted",,"","","Y","","","",,,"Y",,"","","",,"","","","",,"","N","",,,,,,"OSFA,Navy,Graphite,Army Green,Black",,,"1","12","144",,,,,,,,"7.98","6.98","5.98",,,,,,,,"R","R","R",,,,,,,,,"Blank product only",,"USD",,"List",,,,,,,,,,,,,,,,,,,,,,,,,,,,,,,,,,,,,,,,,,,,,,,,,,,"N",,,,,,"Promotional","N",,,"Y","None",,,,
550306902,"OGIO ENDURANCE Fulcrum Beanie.","",,,,,"OGIO ENDURANCE Fulcrum Beanie. Sweat-wicking Lightweight 100% poly double knit Reflective O heat transfer at front Wear alone or under a helmet",,"http://media.asicdn.com/images/jpgb/21150000/21157196.jpg",,"Caps & Hats-Beanie,PERFORMANCE APPAREL",,"Blacktop","Polyester","","","",,,"CHINA",,,,,,,"Unimprinted",,"","","Y","","","",,,"Y",,"","","",,"","","","",,"","N","",,,,,,"OSFA,Blacktop",,,"1","12","144",,,,,,,,"11.98","10.98","9.98",,,,,,,,"R","R","R",,,,,,,,,"Blank product only",,"USD",,"List",,,,,,,,,,,,,,,,,,,,,,,,,,,,,,,,,,,,,,,,,,,,,,,,,,,"N",,,,,,"Promotional","N",,,"Y","None",,,,
