550393899,"Fitted hat Cotton and Spandex","",,,,,"The Fitted hat Cotton and Spandex is a fantastic promotional item. Available in Custom Colors. This product is sure to create a Wow Factor any campaign or promotion. We custom make hats as per your choice of fabric and mesh as well as color combinations. Decoration options available are embroidery, heat transfer, patch, screen print, puff, and 3D Embroidery. Please contact us for a custom quote. This product is a premium quality hat.Material: 97% Cotton 3% Spandex",,"http://media.asicdn.com/images/jpgb/21500000/21502666.jpg",,"Caps & Hats-Construction,Caps & Hats-Novelty,Caps & Hats-Overseas Type,Caps & Hats-Painter's,Caps & Hats-General",,"Assorted","","","","",,,"CHINA",,,,,,,"Embroidered, Heat Transfer, Silkscreen, Unimprinted",,"","","Y","","","",,,"Y",,"60","","",,"Bulk, Case, Poly Bag","144:per Case","52:in;44:in;44:in","13:lbs",,"","N","",,,,,,"Classic Cowboy Hat",,,"5000","10000","15000",,,,,,,,"4.58","4.29","4.23",,,,,,,,"R","R","R",,,,,,,,,"Please contact us via email for a custom quote Info@IconlinePromos.com.",,"USD",,"List",,,,,,,,,,,,,,,,,,,,,,,,,,,,,,,,,,,,,,,,,,,,,,,,,,,"N",,,,,,"Promotional","N",,,"Y","None",,,,
550393908,"Premium Earflap Hat","",,,,,"The Earflap Hat is a fantastic promotional item. Available in Custom Colors. This product is sure to create a Wow Factor any campaign or promotion. We custom make hats as per your choice of fabric and lining as well as color combinations. Decoration options available are embroidery, heat transfer, patch, screen print, puff, and 3D Embroidery. Please contact us for a custom quote.Material: 100% Cotton",,"http://media.asicdn.com/images/jpgb/21500000/21502681.jpg",,"Caps & Hats-Construction,Caps & Hats-Novelty,Caps & Hats-Overseas Type,Caps & Hats-Painter's,Caps & Hats-General",,"Assorted","","","","",,,"CHINA",,,,,,,"Embroidered, Heat Transfer, Silkscreen, Unimprinted",,"","","Y","","","",,,"Y",,"60","","",,"Bulk, Case, Poly Bag","144:per Case","57:in;54:in;40:in","13:lbs",,"","N","",,,,,,"Classic Cowboy Hat",,,"5000","10000","15000",,,,,,,,"7.91","7.72","7.55",,,,,,,,"R","R","R",,,,,,,,,"Please contact us via email for a custom quote Info@IconlinePromos.com.",,"USD",,"List",,,,,,,,,,,,,,,,,,,,,,,,,,,,,,,,,,,,,,,,,,,,,,,,,,,"N",,,,,,"Promotional","N",,,"Y","None",,,,
550393895,"Classic Brushed Cotton Low Profie Custom Hat","",,,,,"The Classic Low Profile custom hat is a fantastic promotional item. Available in Custom Colors. This product is sure to create a Wow Factor any campaign or promotion. We custom make hats as per your choice of fabric and mesh as well as color combinations. Decoration options available are embroidery, heat transfer, patch, screen print, puff, and 3D Embroidery. Please contact us for a custom quote.Material: 100% Cotton",,"http://media.asicdn.com/images/jpgb/21500000/21502631.jpg",,"Caps & Hats-Construction,Caps & Hats-Novelty,Caps & Hats-Overseas Type,Caps & Hats-Painter's,Caps & Hats-General",,"Assorted","","","","",,,"CHINA",,,,,,,"Embroidered, Heat Transfer, Silkscreen, Unimprinted",,"","","Y","","","",,,"Y",,"60","","",,"Bulk, Case, Poly Bag","144:per Case","57:in;54:in;40:in","13:lbs",,"","N","",,,,,,"Classic Cowboy Hat",,,"5000","10000","15000",,,,,,,,"4.75","4.52","4.43",,,,,,,,"R","R","R",,,,,,,,,"Please contact us via email for a custom quote Info@IconlinePromos.com.",,"USD",,"List",,,,,,,,,,,,,,,,,,,,,,,,,,,,,,,,,,,,,,,,,,,,,,,,,,,"N",,,,,,"Promotional","N",,,"Y","None",,,,
550393888,"Classic Trucker Hat","",,,,,"The Classic Trucker Hat with Mesh Back is a fantastic promotional item. Available in Custom Colors. This product is sure to create a Wow Factor any campaign or promotion. We custom make hats as per your choice of fabric and mesh as well as color combinations. Decoration options available are embroidery, heat transfer, patch, screen print, puff, and 3D Embroidery. Please contact us for a custom quote.Material: 100% Cotton",,"http://media.asicdn.com/images/jpgb/22080000/22089512.jpg",,"Caps & Hats-Construction,Caps & Hats-Novelty,Caps & Hats-Overseas Type,Caps & Hats-Painter's,Caps & Hats-General",,"Assorted","","","","",,,"CHINA",,,,,,,"Heat Transfer, Silkscreen, Unimprinted",,"","","Y","","","",,,"Y",,"60","","",,"Bulk, Case, Poly Bag","144:per Case","57:in;54:in;40:in","13:lbs",,"","N","",,,,,,"Classic Cowboy Hat",,,"3000","10000","15000",,,,,,,,"4.21","3.53","3.47",,,,,,,,"R","R","R",,,,,,,,,"Please contact us via email for a custom quote Info@IconlinePromos.com.",,"USD",,"List",,,,,,,,,,,,,,,,,,,,,,,,,,,,,,,,,,,,,,,,,,,,,,,,,,,"N",,,,,,"Promotional","N",,,"Y","None",,,,
550393906,"Premium Brushed Cotton Hat","",,,,,"The Premium Brushed Cotton Hat is a fantastic promotional item. Available in Custom Colors. This product is sure to create a Wow Factor any campaign or promotion. We custom make hats as per your choice of fabric and mesh as well as color combinations. Decoration options available are embroidery, heat transfer, patch, screen print, puff, and 3D Embroidery. Please contact us for a custom quote.Material: 100% Cotton",,"http://media.asicdn.com/images/jpgb/21500000/21502635.jpg",,"Caps & Hats-Construction,Caps & Hats-Novelty,Caps & Hats-Overseas Type,Caps & Hats-Painter's,Caps & Hats-General",,"Assorted","","","","",,,"CHINA",,,,,,,"Embroidered, Heat Transfer, Silkscreen, Unimprinted",,"","","Y","","","",,,"Y",,"60","","",,"Bulk, Case, Poly Bag","144:per Case","57:in;54:in;40:in","13:lbs",,"","N","",,,,,,"Classic Cowboy Hat",,,"5000","10000","15000",,,,,,,,"4.75","4.52","4.43",,,,,,,,"R","R","R",,,,,,,,,"Please contact us via email for a custom quote Info@IconlinePromos.com.",,"USD",,"List",,,,,,,,,,,,,,,,,,,,,,,,,,,,,,,,,,,,,,,,,,,,,,,,,,,"N",,,,,,"Promotional","N",,,"Y","None",,,,
6981335,"Light Up Sequined Hat - Black with White LEDs","",,,,,"Fun yet formal these sequined light-up fedoras will light up the party and draw attention for sure! Wear it with or without the flashing lights controlled by a button located inside the hat. Imprint your logo with four color digital process printing on the band and make an impression that will always be remembered. One size fits most. Batteries are included and replaceable. LED lights.",,"http://media.asicdn.com/images/jpgb/7540000/7547711.jpg",,"Caps & Hats-Fedora,COSTUMES & ACCESSORIES,ENVIRONMENTALLY FRIENDLY PRODUCTS,GLOW PRODUCTS,LED PRODUCTS",,"Black","","","","",,,"CHINA",,,,,,,"Pad Print",,"","","","Y","10 1/2"" x 1 1/4"", 14 3/8"" x 1 1/4""","",,,"Y",,"10","Y","",,"","","","",,"Weight: 0.39 lb.","N","",,,,,,"Light Up Sequined Hat - Black with White LEDs",,,"100","250","500","1000","2500",,,,,,"11.90","11.33","11.01","10.96","10.91",,,,,,"R","R","R","R","R",,,,,,,"N/A",,"USD",,"List","Pad Print","IMMD:Pad Print",,"Set-up Charge","Per Order","Required","1",,,,,,,,,,"62.50",,,,,,,,,,"Z",,,,,,,,,,"",,,,,,,,,,,,,,"N",,,,,,"Promotional","N",,,"Y","None",,,,
6981342,"Light Up Sequined Hat - Black with White LEDs","",,,,,"Fun yet formal these sequined light-up fedoras will light up the party and draw attention for sure! Wear it with or without the flashing lights controlled by a button located inside the hat. Imprint your logo with four color digital process printing on the band and make an impression that will always be remembered. One size fits most. Batteries are included and replaceable. LED lights.",,"http://media.asicdn.com/images/jpgb/7540000/7547712.jpg",,"Caps & Hats-Fedora,COSTUMES & ACCESSORIES,ENVIRONMENTALLY FRIENDLY PRODUCTS,GLOW PRODUCTS,LED PRODUCTS",,"Green","","","","",,,"CHINA",,,,,,,"Pad Print",,"","","","Y","10 1/2"" x 1 1/4"", 14 3/8"" x 1 1/4""","",,,"Y",,"10","Y","",,"","","","",,"Weight: 0.39 lb.","N","",,,,,,"Light Up Sequined Hat - Black with White LEDs",,,"100","250","500","1000","2500",,,,,,"11.90","11.33","11.01","10.96","10.91",,,,,,"R","R","R","R","R",,,,,,,"N/A",,"USD",,"List","Pad Print","IMMD:Pad Print",,"Set-up Charge","Per Order","Required","1",,,,,,,,,,"62.50",,,,,,,,,,"Z",,,,,,,,,,"",,,,,,,,,,,,,,"N",,,,,,"Promotional","N",,,"Y","None",,,,
6981339,"Light Up Sequined Hat - Black with White LEDs","",,,,,"Fun yet formal these sequined light-up fedoras will light up the party and draw attention for sure! Wear it with or without the flashing lights controlled by a button located inside the hat. Imprint your logo with four color digital process printing on the band and make an impression that will always be remembered. One size fits most. Batteries are included and replaceable. LED lights.",,"http://media.asicdn.com/images/jpgb/7540000/7547713.jpg",,"Caps & Hats-Fedora,COSTUMES & ACCESSORIES,ENVIRONMENTALLY FRIENDLY PRODUCTS,GLOW PRODUCTS,LED PRODUCTS",,"Pink","","","","",,,"CHINA",,,,,,,"Pad Print",,"","","","Y","10 1/2"" x 1 1/4"", 14 3/8"" x 1 1/4""","",,,"Y",,"10","Y","",,"","","","",,"Weight: 0.39 lb.","N","",,,,,,"Light Up Sequined Hat - Black with White LEDs",,,"100","250","500","1000","2500",,,,,,"11.90","11.33","11.01","10.96","10.91",,,,,,"R","R","R","R","R",,,,,,,"N/A",,"USD",,"List","Pad Print","IMMD:Pad Print",,"Set-up Charge","Per Order","Required","1",,,,,,,,,,"62.50",,,,,,,,,,"Z",,,,,,,,,,"",,,,,,,,,,,,,,"N",,,,,,"Promotional","N",,,"Y","None",,,,
7157282,"Light Up Sequined Hat - Black with White LEDs","",,,,,"Fun yet formal these sequined light-up fedoras will light up the party and draw attention for sure! Wear it with or without the flashing lights controlled by a button located inside the hat. Imprint your logo with four color digital process printing on the band and make an impression that will always be remembered. One size fits most. Batteries are included and replaceable. LED lights. blank product.",,"http://media.asicdn.com/images/jpgb/7540000/7547711.jpg",,"Caps & Hats-Fedora,ENVIRONMENTALLY FRIENDLY PRODUCTS,LED PRODUCTS,Light Up Novelties-General",,"Black","","","","",,,"CHINA",,,,,,,"Unimprinted",,"","","Y","Y","","",,,"Y",,"1","Y","",,"","","","",,"Weight: 0.39 lb.","N","",,,,,,"Light Up Sequined Hat - Black with White LEDs",,,"100","250","500","1000","2500",,,,,,"12.17","11.75","11.18","10.86","10.81",,,,,,"R","R","R","R","R",,,,,,,"blank product.",,"USD",,"List",,,,,,,,,,,,,,,,,,,,,,,,,,,,,,,,,,,,,,,,,,,,,,,,,,,"N",,,,,,"Promotional","N",,,"Y","None",,,,
550393802,"Saint Patrick's Day Hat","",,,,,"The Classic Saint Patrick's Day Hat is a fantastic promotional item. Available in Custom Colors. This product is sure to create a Wow Factor for any campaign or promotion.Material: Felt",,"http://media.asicdn.com/images/jpgb/21500000/21502417.jpg",,"Caps & Hats-Fedora,Caps & Hats-Novelty,Caps & Hats-Overseas Type,Caps & Hats-Western,Caps & Hats-General",,"Assorted","","","","",,,"CHINA",,,,,,,"Embroidered, Heat Transfer, Silkscreen, Unimprinted",,"","","Y","","","",,,"Y",,"60","","",,"Bulk, Case, Poly Bag","120:per Case","60:in;48:in;56:in","",,"","N","",,,,,,"Classic Cowboy Hat",,,"5000","10000","20000",,,,,,,,"4.42","3.73","3.56",,,,,,,,"R","R","R",,,,,,,,,"Please contact us via email for a custom quote Info@IconlinePromos.com.",,"USD",,"List",,,,,,,,,,,,,,,,,,,,,,,,,,,,,,,,,,,,,,,,,,,,,,,,,,,"N",,,,,,"Promotional","N",,,"Y","None",,,,
7157320,"Light Up Sequined Hat - Black with White LEDs","",,,,,"Fun yet formal these sequined light-up fedoras will light up the party and draw attention for sure! Wear it with or without the flashing lights controlled by a button located inside the hat. One size fits most. Batteries are included and replaceable. LED lights. Blank product.",,"http://media.asicdn.com/images/jpgb/7540000/7547713.jpg",,"Caps & Hats-Fedora,ENVIRONMENTALLY FRIENDLY PRODUCTS,LED PRODUCTS,Light Up Novelties-General",,"Pink","","","","",,,"CHINA",,,,,,,"Unimprinted",,"","","Y","Y","","",,,"Y",,"1","Y","",,"","","","",,"Weight: 0.39 lb.","N","",,,,,,"Light Up Sequined Hat - Black with White LEDs",,,"100","250","500","1000","2500",,,,,,"12.17","11.75","11.18","10.86","10.81",,,,,,"R","R","R","R","R",,,,,,,"blank product.",,"USD",,"List",,,,,,,,,,,,,,,,,,,,,,,,,,,,,,,,,,,,,,,,,,,,,,,,,,,"N",,,,,,"Promotional","N",,,"Y","None",,,,
550393884,"Classic Trucker Hat with Mesh Back","",,,,,"The Classic Trucker Hat with Mesh Back is a fantastic promotional item. Available in Custom Colors. This product is sure to create a Wow Factor any campaign or promotion.Material: 100% Cotton",,"http://media.asicdn.com/images/jpgb/21500000/21502613.jpg",,"Caps & Hats-Construction,Caps & Hats-Novelty,Caps & Hats-Overseas Type,Caps & Hats-Painter's,Caps & Hats-General",,"Assorted","","","","",,,"CHINA",,,,,,,"Heat Transfer, Silkscreen, Unimprinted",,"","","Y","","","",,,"Y",,"60","","",,"Bulk, Case, Poly Bag","144:per Case","57:in;54:in;40:in","",,"","N","",,,,,,"Classic Cowboy Hat",,,"2500","5000","10000",,,,,,,,"4.31","3.86","3.63",,,,,,,,"R","R","R",,,,,,,,,"Please contact us via email for a custom quote Info@IconlinePromos.com.",,"USD",,"List",,,,,,,,,,,,,,,,,,,,,,,,,,,,,,,,,,,,,,,,,,,,,,,,,,,"N",,,,,,"Promotional","N",,,"Y","None",,,,
6957919,"Santa Hat, Toddler to 4 Years, 20 Colors","",,,,,"Baby Santa hat is the perfect finishing touch to any holiday look. Made out of micro fleece, this Santa hat is extra soft and perfect for Santa's little helpers. It also has an anti-static treatment so lint and dust will not stick. Elf tested, Santa approved colored body with white trim. Machine wash. Made in north America with quality craftsmanship by workers who care.",,"http://media.asicdn.com/images/jpgb/23600000/23605360.jpg",,"BABY ITEMS,Caps & Hats-Santa",,"Burgundy,Pink,Orange,Light Yellow,Yellow,White,Gray,Charcoal Gray,Moss,Forest Green,Blue,Denim Blue,Navy Blue,Royal Blue,Purple,Black,Brown,Tan-Cappuccino,Deerskin","Fleece","Dimension","Length:14:in;Width:7.5:in","",,,"CHINA",,,,,,,"Silkscreen, Unimprinted",,"","","Y","","5"" x 2"" L","",,,"Y",,"3,10","Y","2:	",,"Bulk","175:per Other (box)","25:in;15:in;15  (none):in","17:lbs",,"17 lbs. per box of 175, box size 15"" H x 25"" L x 15"" W.","N","",,,,,,"Decorated",,,"25","50","75","150","200","300","500","1000",,,"17.17","15.21","13.75","12.29","11.67","10.79","10.00","9.21",,,"R","R","R","R","R","R","R","R",,,,"Embroidery up to 8000 stitches, 1 location",,"USD",,"List","Silkscreen, Unimprinted (Sold Unimprinted)","IMMD:Silkscreen, Unimprinted (Sold Unimprinted)",,"Set-up Charge","Per Order","Required","1",,,,,,,,,,"50.00",,,,,,,,,,"Z",,,,,,,,,,"",,,,,,,,,,,,,,"N",,,,,,"Promotional","N",,,"Y","None",,,,
551222770,"Bluetooth Music Hat","",,,,,"Bluetooth music hat is not only a hat. It has bluetooth headphone, wireless. This bluetooth beanie hat can free your hands from the cold weather or busy time, let your easy to answer the phone, and enjoy music. Just connect with your mobile via Bluetooth. Then your hat will become a bluetooth headphone.",,"http://media.asicdn.com/images/jpgb/24910000/24917243.jpg",,"CAP & HAT ACCESSORIES,Caps & Hats-Top Hat",,"Blue,Red,Black,Gray,Green,Assorted","Acrylic Plastic","Dimension","Length:8 3/5:in;Width:8 1/2:in","",,,"CHINA",,,,,,,"Embroidered",,"Art Services, Paper Proof, Pre-production Proof, Virtual Proof","all colors","","","","",,,"Y",,"15","","",,"Case","115:per Carton","","15:kg",,"","N","",,,,,,"",,,"500","1000","5000","10000","20000",,,,,,"9.97","9.61","9.13","8.67","7.97",,,,,,"R","R","R","R","R",,,,,,,"N/A",,"USD",,"List","Product Sample","SMPL:Product Sample",,"Sample Charge","Other","Optional","1",,,,,,,,,,"55.00",,,,,,,,,,"Z",,,,,,,,,,"",,,,,,,,,,,,,,"N",,,,,,"Promotional","N",,,"Y","None",,,,
550393788,"Classic Fedora Hat","",,,,,"The Classic Fedora Hat is a fantastic promotional item. Available in Custom Colors. This product is sure to create a Wow Factor any campaign or promotion.Material: Felt",,"http://media.asicdn.com/images/jpgb/21500000/21502396.jpg",,"Caps & Hats-Fedora,Caps & Hats-Novelty,Caps & Hats-Overseas Type,Caps & Hats-Western,Caps & Hats-General",,"Assorted","","","","",,,"CHINA",,,,,,,"Heat Transfer, Silkscreen, Unimprinted",,"","","Y","","","",,,"Y",,"60","","",,"Bulk, Case, Poly Bag","72:per Case","57:in;50:in;57:in","",,"","N","",,,,,,"Classic Cowboy Hat",,,"5000","10000","20000",,,,,,,,"5.44","4.99","4.59",,,,,,,,"R","R","R",,,,,,,,,"Please contact us via email for a custom quote Info@IconlinePromos.com.",,"USD",,"List",,,,,,,,,,,,,,,,,,,,,,,,,,,,,,,,,,,,,,,,,,,,,,,,,,,"N",,,,,,"Promotional","N",,,"Y","None",,,,
6979042,"Santa Hat, Adult,19 Colors","",,,,,"Get in the Christmas spirit with the colorful Santa hat! This festive hat features colourful  background to match your corporate or sports team colors. You can mix & match colors to create a truly unique Santa hat!  St. Nick may have some competition while you are wearing this hat! Fleece Santa hat is 100% polyester and is made with quality craftsmanship by workers who care. Machine wash.",,"http://media.asicdn.com/images/jpgb/23660000/23666724.jpg",,"Caps & Hats-Santa",,"Brown,Burgundy,Charcoal Gray,Black,Denim Blue,Deerskin,Forest Green,Gray,Blue,Pink,Light Yellow,Moss,Navy Blue,Orange,Purple,Royal Blue,Tan-Cappuccino,White,Yellow","Polyester-Fleece","Dimension","Length:19:in;Width:11:in","",,,"CHINA",,,,,,,"Silkscreen, Unimprinted",,"","","Y","","8"" x 2""L","trim",,,"Y",,"3,10","Y","2:	",,"Bulk","100:per Other (box)","25:in;15:in;15  (none):in","10:lbs",,"10 lbs. per box of 100, box size 15"" H x 25"" L x 15"" W.","N","",,,,,,"Decorated",,,"25","50","75","100","150","250","500","750",,,"22.38","20.16","18.45","17.56","15.84","14.95","13.65","12.60",,,"R","R","R","R","R","R","R","R",,,,"Embroidery up to 8000 stitches, 1 location",,"USD",,"List","Silkscreen, Unimprinted (Sold Unimprinted)","IMMD:Silkscreen, Unimprinted (Sold Unimprinted)",,"Set-up Charge","Other","Required","1",,,,,,,,,,"50.00",,,,,,,,,,"Z",,,,,,,,,,"",,,,,,,,,,,,,,"N",,,,,,"Promotional","N",,,"Y","None",,,,
550644611,"Santa Hat, Adult,19 Colors","",,,,,"CLEARANCE ITEM. LIMITED SUPPLY. Once they're gone, they're gone! Get in the Christmas spirit with the colorful Santa hat! This festive hat features colourful background to match your corporate or sports team colors. You can mix & match colors to create a truly unique Santa hat! This cheerful product comes blank so you can add a personal message or logo. St. Nick may have some competition while you are wearing this hat! Fleece santa hat is 100% polyester and is made with quality craftsmanship by workers who care. Machine wash. For stock availability: https://docs.google.com/spreadsheets/d/1ZdO6tUO3gQEDBxidCPgkDuTAWdALAR7cAYBYodc6p4U/edit#gid=0",,"http://media.asicdn.com/images/jpgb/23670000/23679553.jpg",,"Caps & Hats-Santa",,"Brown,Burgundy,Charcoal Gray,Black,Denim Blue,Deerskin,Forest Green,Gray,Blue,Pink,Yellow,Moss,Navy Blue,Orange,Purple,Royal Blue,Tan-Cappuccino,White","Polyester-Fleece","Dimension","Length:19:in;Width:11:in","",,,"CHINA",,,,,,,"Silkscreen, Unimprinted",,"","","Y","","8"" x 2""L","trim",,,"Y",,"3,10","","",,"Bulk","100:per Box","25:in;15:in;15  (none):in","10:lbs",,"","N","",,,,,,"Decorated",,,"25","50","75","150","200","500","750","1250",,,"15.08","13.23","11.88","10.52","10.00","9.06","8.38","7.69",,,"R","R","R","R","R","R","R","R",,,,"Embroidery up to 8000 stitches, 1 location",,"USD",,"List","Silkscreen, Unimprinted (Sold Unimprinted)","IMMD:Silkscreen, Unimprinted (Sold Unimprinted)",,"Set-up Charge","Other","Required","1",,,,,,,,,,"50.00",,,,,,,,,,"Z",,,,,,,,,,"",,,,,,,,,,,,,,"N",,,,,,"Promotional","N",,,"Y","None",,,,
551114032,"Warm hat","",,,,,"This hat is made from soft plush, let you feel warm when winter. An innovative and practical design. Products are widely used as promotional gifts, garment accessories, etc. Trap nothing but style in this faux fur-lined favorite. Warm and comfortable, best for outdoors activities in the cold winter. Different with other caps as it has a removable mask. Many colors available. Custom knitted with logo and lettering. Size: One Size Fits Most.",,"http://media.asicdn.com/images/jpgb/24140000/24141653.jpg",,"CAP & HAT ACCESSORIES,Caps-General,Caps & Hats-Construction,Caps & Hats-Knit,SHOWER CAPS",,"Blue,Brown,Black,White,Red,Purple,Green,Assorted","Other","Dimension","Length:7 1/2:in;Width:13:in","",,,"CHINA",,,,,,,"",,"","Any PMS color","","","2"" W x 2"" L","",,,"Y",,"40","Y","30:	",,"Individual Poly Bag","100:per Carton","","41.3:lbs",,"","N","",,,,,,"",,,"500","2000","5000","7000","10000",,,,,,"8.38","8.05","7.20","6.55","6.45",,,,,,"R","R","R","R","R",,,,,,,"freight and duty",,"USD",,"List",,,,,,,,,,,,,,,,,,,,,,,,,,,,,,,,,,,,,,,,,,,,,,,,,,,"N",,,,,,"Promotional","N",,,"Y","None",,,,
551195826,"Warm hat","",,,,,"This hat is made from soft plush, let you feel warm when winter. An innovative and practical design. Products are widely used as promotional gifts, garment accessories, etc. Trap nothing but style in this faux fur-lined favorite. Warm and comfortable, best for outdoors activities in the cold winter. Different with other caps as it has a removable mask. Many colors available. Custom knitted with logo and lettering. Size: One Size Fits Most.",,"http://media.asicdn.com/images/jpgb/24780000/24786300.jpg",,"CAP & HAT ACCESSORIES,Caps & Hats-General",,"Blue,Brown,Black,White,Purple,Orange,Gray,Red,Yellow,Pink,Green,Assorted","Cotton","Dimension","Length:13:in;Width:22 4/5:in","",,,"CHINA",,,,,,,"Embroidered",,"","Any PMS color","","","2"" W x 2"" L","",,,"Y",,"25","Y","20:	",,"Poly Bag","100:per Case","","27.5:lbs",,"","N","",,,,,,"",,,"500","2000","5000","7000","10000",,,,,,"8.38","8.03","7.20","6.50","6.40",,,,,,"R","R","R","R","R",,,,,,,"N/A",,"USD",,"List","Embroidered","IMMD:Embroidered",,"Imprint Method Charge","Other","Required","1",,,,,,,,,,"100.00",,,,,,,,,,"Z",,,,,,,,,,"",,,,,,,,,,,,,,"N",,,,,,"Promotional","N",,,"Y","None",,,,
200325804,"Red Santa Hat, Adult","",,,,,"Show your Christmas spirit during the most wonderful time of the year with the traditional red Santa hat! This polar fleece festive hat features red background with white trim and hang loop. The product is made out of 100% polyester. That's not all! St. Nick may have some competition while you are wearing this hat!",,"http://media.asicdn.com/images/jpgb/23660000/23668418.jpg",,"Caps & Hats-Santa",,"Red","16 oz Anti-pill Polar Fleece,100% Polyester","Dimension","Length:19:in;Width:11:in","",,,"CHINA",,,,,,,"Silkscreen, Unimprinted",,"","","Y","","8"" x 2""L","trim",,,"Y",,"3,10","Y","2:	",,"Bulk","100:per Other (box)","25:in;15:in;15  (none):in","10:lbs",,"10 lbs. per box of 100, box size 15"" H x 25"" L x 15"" W.","N","",,,,,,"Decorated",,,"25","50","75","100","150","250","500","750",,,"20.30","18.19","16.57","15.79","14.17","13.39","12.19","11.25",,,"R","R","R","R","R","R","R","R",,,,"Pricing includes embroidery up to 8000 stitches, 1 location.",,"USD",,"List","Silkscreen, Unimprinted (Sold Unimprinted)","IMMD:Silkscreen, Unimprinted (Sold Unimprinted)",,"Set-up Charge","Other","Required","1",,,,,,,,,,"50.00",,,,,,,,,,"Z",,,,,,,,,,"",,,,,,,,,,,,,,"N",,,,,,"Promotional","N",,,"Y","None",,,,
550824759,"Folding Cowboy Hat / Foldable Hat with Pouch","",,,,,"Foldable Hat/Folding Hat with Pouch, made from polyester.  Suitable as either a sun or rain hat, it really is the ideal all-weather promotion for outdoor events, festivals & sports sponsorship. Colors are available and customer's logo is welcome.  Logo can be printed both on the hat and on the pouch.",,"http://media.asicdn.com/images/jpgb/23240000/23249722.jpg",,"Caps-General,Caps & Hats-General",,"Blue,Yellow,Red,Green,Gray","Polyester","Dimension","Length:15:in;Width:4:in","",,,"CHINA",,,,,,,"Heat Transfer, Silkscreen, Unimprinted",,"","Any Color","Y","","","",,,"Y",,"15","Y","11:	",,"Bulk, Poly Bag","500:per Case","20:in;22:in;22:in","27:lbs",,"","N","",,,,,,"Folding Cowboy Hat / Foldable Hat with Pouch",,,"1000","2000","3000","4000","5000",,,,,,"1.58","1.46","1.34","1.31","1.24",,,,,,"R","R","R","R","R",,,,,,,"1 Color 1 Location Imprint",,"USD",,"List","Silkscreen, Heat Transfer, Unimprinted","IMMD:Silkscreen, Heat Transfer, Unimprinted",,"Set-up Charge","Per Order","Required","1",,,,,,,,,,"50.00",,,,,,,,,,"Z",,,,,,,,,,"",,,,,,,,,,,,,,"N",,,,,,"Promotional","N",,,"Y","None",,,,
550393771,"Classic Fedora Hat","",,,,,"The Classic Fedora Hat is a fantastic promotional item. Available in Custom Colors. This product is sure to create a Wow Factor any campaign or promotion.Material: Paper Cloth",,"http://media.asicdn.com/images/jpgb/21500000/21502390.jpg",,"Caps & Hats-Fedora,Caps & Hats-Novelty,Caps & Hats-Overseas Type,Caps & Hats-Western,Caps & Hats-General",,"Assorted","","","","",,,"CHINA",,,,,,,"Heat Transfer, Silkscreen, Unimprinted",,"","","Y","","","",,,"Y",,"60","","",,"Bulk, Case, Poly Bag","100:per Case","57:in;39:in;65:in","",,"","N","",,,,,,"Classic Cowboy Hat",,,"5000","10000","20000",,,,,,,,"5.27","5.06","4.68",,,,,,,,"R","R","R",,,,,,,,,"Please contact us via email for a custom quote Info@IconlinePromos.com.",,"USD",,"List",,,,,,,,,,,,,,,,,,,,,,,,,,,,,,,,,,,,,,,,,,,,,,,,,,,"N",,,,,,"Promotional","N",,,"Y","None",,,,
