XID,Product_Name,Product_Number,Product_SKU,Product_Inventory_Link,Product_Inventory_Status,Product_Inventory_Quantity,Description,Summary,Prod_Image,Catalog_Information,Category,Keywords,Product_Color,Material,Size_Group,Size_Values,Shape,Theme,Tradename,Origin,Option_Type,Option_Name,Option_Values,Can_order_only_one,Req_for_order,Option_Additional_Info,Imprint_Method,Linename,Artwork,Imprint_Color,Sold_Unimprinted,Personalization,Imprint_Size,Imprint_Location,Additional_Color,Additional_Location,Product_Sample,Spec_Sample,Production_Time,Rush_Service,Rush_Time,Same_Day_Service,Packaging,Shipping_Items,Shipping_Dimensions,Shipping_Weight,Shipper_Bills_By,Shipping_Info,Ship_Plain_Box,Comp_Cert,Product_Data_Sheet,Safety_Warnings,Additional_Info,Distibutor_Only,Disclaimer,Base_Price_Name,Base_Price_Criteria_1,Base_Price_Criteria_2,Q1,Q2,Q3,Q4,Q5,Q6,Q7,Q8,Q9,Q10,P1,P2,P3,P4,P5,P6,P7,P8,P9,P10,D1,D2,D3,D4,D5,D6,D7,D8,D9,D10,Product_Number_Price,Price_Includes,QUR_Flag,Currency,Less_Than_Min,Price_Type,Upcharge_Name,Upcharge_Criteria_1,Upcharge_Criteria_2,Upcharge_Type,Upcharge_Level,Service_Charge,UQ1,UQ2,UQ3,UQ4,UQ5,UQ6,UQ7,UQ8,UQ9,UQ10,UP1,UP2,UP3,UP4,UP5,UP6,UP7,UP8,UP9,UP10,UD1,UD2,UD3,UD4,UD5,UD6,UD7,UD8,UD9,UD10,Upcharge_Details,U_QUR_Flag,Confirmed_Thru_Date,Product_Number_Criteria_1,Product_Number_Criteria_2,Product_Number_Other,SKU_Criteria_1,SKU_Criteria_2,SKU_Criteria_3,SKU_Criteria_4,SKU,Inventory_Link,Inventory_Status,Inventory_Quantity,Distributor_View_Only,Operation,Carrier_Information,Item_Weight,Warranty,Battery,Industry_Segment,SEO_FLG,UPC_Code,Additional_Imprint_Information,Item_Assembled,Delivery_Option,Do_Not_Use,Product_Status,Workflow_Status,Last_Updated_Date
5645186,"11 oz aluminum sports bottle","",,,,,"Sprint to a triumphant promotional finish line with this sleek Sport Bottle! This 11 oz. bottle is just the item to attract some positive attention for your business. Make this a smart business investment by adding on a personal message or your company name or logo for some brand awareness. Please be advised the item is not dishwasher safe and not made to be microwaved. Your brand will look sharp on this bottle!",,"http://media.asicdn.com/images/jpgb/6220000/6223013.jpg",,"Bottles-Sport Type",,"Blue,Pink","Aluminum","Volume/Weight","11:oz","",,,"CHINA",,,,,,,"Printed",,"","","","","","",,,"Y",,"7","","",,"","","","36 pieces / 14:lbs",,".","N","",,,,,,"11 oz aluminum sports bottle",,,"72","144","288","576","1008",,,,,,"2.79","2.79","2.79","2.79","2.79",,,,,,"R","R","R","R","R",,,,,,,"1 color, 1 location imprint.",,"USD",,"List","Printed","IMMD:Printed",,"Set-up Charge","Other","Required","1",,,,,,,,,,"45.00",,,,,,,,,,"Z",,,,,,,,,,"Imprint charge",,,,,,,,,,,,,,"N",,,,,,"Promotional","N",,,"Y","None",,,,
7045150,"Executive Pen Collection Twist Action Pen","",,,,,"Draw some positive attention to your marketing campaign with the Executive Pen Collection Twist Action Pen! This sleek and stylish pen includes long-lasting ink and a free blue ink refill for added convenience. An ideal promotional gift or giveaway for banks, insurance companies, fundraisers and much more, don't forget to have your company name or logo imprinted on the surface of this promotional pen for some added brand awareness.",,"http://media.asicdn.com/images/jpgb/6220000/6222168.jpg",,"Pens-Ballpoint-Twist Action",,"","","Dimension","Length:5.25:in;Width:0.5:in","",,,"CHINA",,,,,,,"Printed, Unimprinted",,"","","Y","","1.25"" X 0.25""","",,,"Y",,"10","Y","",,"","","","7:lbs",,"per 100","N","",,,,,,"Executive Pen Collection Twist Action Pen",,,"100","250","500","1000",,,,,,,"7.25","6.90","6.70","6.50",,,,,,,"R","R","R","R",,,,,,,,"pen with printed logo in one location comes with long-lasting ink",,"USD",,"List","Printed, Unimprinted (Sold Unimprinted)","IMMD:Printed, Unimprinted (Sold Unimprinted)",,"Set-up Charge","Other","Required","1",,,,,,,,,,"30.00",,,,,,,,,,"Z",,,,,,,,,,"Imprint chargeYou may order less than the minimum quantity",,,,,,,,,,,,,,"N",,,,,,"Promotional","N",,,"Y","None",,,,
5136089,"Men's Gold Ring, 14K","",,,,,"Nothing says style and class quite like this Men's Gold Ring that will have your customers clamoring! This eye-catching stock shape gold ring comes in a variety of karat options to choose from. Make this a smart business investment by adding on a personal message or your company name or logo for some brand awareness. You are sure to turn some heads with this ring around your finger! A special gift for anniversaries or fraternal members!",,"http://media.asicdn.com/images/jpgb/21370000/21373827.jpg",,"Jewelry-Mens,RINGS",,"","Gold","","","",,,"CHINA",,,,,,,"Printed",,"Art Services","","","","","",,,"Y",,"15","Y","",,"Gift Boxes","","","",,"","N","",,,,,,"Men's Gold Ring, 14K",,,"",,,,,,,,,,"QUR",,,,,,,,,,"R",,,,,,,,,,,"N/A",,"USD",,"List","Art Services","ARTW:Art Services",,"Artwork Charge","Other","Optional","1",,,,,,,,,,"30.00",,,,,,,,,,"Z",,,,,,,,,,"",,,,,,,,,,,,,,"N",,,,,,"Promotional","N",,,"Y","None",,,,
5645157,"16 oz stainless steel travel mug","",,,,,"Looking for a gift that's bound to attract some attention? Then you should consider this Travel Mug! This mug measures 16 oz. and is equipped with a stainless steel liner that will keep your liquids at the perfect temperature. Make this a smart business investment by adding on a personal message or your company name or logo for some brand awareness. Please be advised the item is not dishwasher safe and not made to be microwaved.",,"http://media.asicdn.com/images/jpgb/6220000/6223009.jpg",,"TRAVEL MUGS/CUPS",,"","Stainless Steel","Volume/Weight","16:oz","",,,"CHINA",,,,,,,"Printed",,"","","","","","",,,"Y",,"7","","",,"","","","36 pieces / 27:lbs",,".","N","",,,,,,"16 oz stainless steel travel mug",,,"72","144","288","576","1008",,,,,,"5.99","5.79","5.69","5.59","5.49",,,,,,"R","R","R","R","R",,,,,,,"1 color, 1 location imprint.",,"USD",,"List","Printed","IMMD:Printed",,"Set-up Charge","Other","Required","1",,,,,,,,,,"45.00",,,,,,,,,,"Z",,,,,,,,,,"Imprint charge",,,,,,,,,,,,,,"N",,,,,,"Promotional","N",,,"Y","None",,,,
6062122,"Clapping Hands Noise Maker","",,,,,"Give your company a hand with these clapping hands noise makers.They make a great party favors and are some of the funniest novelty items at sporting events; or anywhere you want to make some noise! Shake back and forth for a clapping noise.Products are not intended for use by children or pets",,"http://media.asicdn.com/images/jpgb/7140000/7149464.jpg",,"Cheering Accessories-General,NOISEMAKERS",,"White","","Dimension","Length:7.5:in;Width:3.25:in","Hand",,,"CHINA",,,,,,,"Pad Print, Unimprinted",,"","Black, Brown, Gray, Green, Magenta, Metallic Gold, Metallic Silver, Orange, Purple, Red, Reflex Blue, Ultramarine Blue, White, Yellow","Y","Y","1"" x 1""","",,,"Y",,"4,5","Y","1:,2:	",,"","","","",,"","N","",,,,,,"Clapping Hands Noise Maker",,,"150","250","500","1000","2500",,,,,,"0.70","0.62","0.58","0.53","0.51",,,,,,"R","R","R","R","R",,,,,,,"Running charge for the first color/location imprint",,"USD",,"List","Pad Print, Unimprinted","IMMD:Pad Print, Unimprinted",,"Set-up Charge","Per Order","Required","1",,,,,,,,,,"40.00",,,,,,,,,,"Z",,,,,,,,,,"",,,,,,,,,,,,,,"N",,,,,,"Promotional","N",,,"Y","None",,,,
6062122,,,,,,,,,,,,,,,,,,,,,,,,,,,,,,,,,,,,,,,,,,,,,,,,,,,,,,,,,,,,,,,,,,,,,,,,,,,,,,,,,,,,,,,,,,,,,,,"1 business days,2 business days","RUSH:1,2",,"Rush Service Charge","Other","Required","150",,,,,,,,,,"QUR",,,,,,,,,,"Z",,,,,,,,,,"Plus 30% of original cost of product. 2500 pieces maximum.You may order less than the minimum quantity",,,,,,,,,,,,,,,,,,,,,,,,,,,,,
5136078,"Ladies Gold Ring","",,,,,"Is there anything a woman loves more than a ring? Please all of your female customers with the Ladies Gold Ring! This gold ring comes in a variety of karat options to choose from. Make this a smart business investment by adding on a personal message or your company name or logo for some brand awareness. You are sure to turn some heads with this ring around your finger! One finger size per order please.",,"http://media.asicdn.com/images/jpgb/23910000/23914227.jpg",,"Jewelry-General,RINGS",,"","Gold","","","",,,"CHINA",,,,,,,"Printed",,"Art Services (Artwork change will be charged at a flat fee. For each modification, add fee.)","","","","","",,,"Y",,"15","Y","",,"Gift Boxes","25:per Case","","2:lbs",,"","N","",,,,,,"Ladies Gold Ring",,,"",,,,,,,,,,"QUR",,,,,,,,,,"R",,,,,,,,,,,"Prices subject to fluctuations in the precious metals market. Please contact our factory for quote.",,"USD",,"List","Printed","IMMD:Printed",,"Imprint Method Charge","Per Order","Required","1",,,,,,,,,,"350.00",,,,,,,,,,"Z",,,,,,,,,,"",,,,,,,,,,,,,,"N",,,,,,"Promotional","N",,,"Y","None",,,,
5136078,,,,,,,,,,,,,,,,,,,,,,,,,,,,,,,,,,,,,,,,,,,,,,,,,,,,,,,,,,,,,,,,,,,,,,,,,,,,,,,,,,,,,,,,,,,,,,,"Art Services (Artwork change will be charged at a flat fee. For each modification, add fee.)","ARTW:Art Services (Artwork change will be charged at a flat fee. For each modification, add fee.)",,"Artwork Charge","Other","Optional","1",,,,,,,,,,"30.00",,,,,,,,,,"Z",,,,,,,,,,"",,,,,,,,,,,,,,,,,,,,,,,,,,,,,
550845892,"Black Headband with Assorted Feathers","",,,,,"Black headband with some plain and some polka dotted feathers hanging from a straight chain in assorted colors. Chain hangs about 12 inches from bottom of the headband.36 Pieces per packageIndividually packagedFeather themed accessories",,"http://media.asicdn.com/images/jpgb/24350000/24354752.jpg",,"HEADBANDS",,"","","","","",,,"CHINA",,,,,,,"Unimprinted",,"","","Y","","","",,,"Y",,"","","",,"","","","",,"We provide free shipping to all ASI members with in the 48 contiguous states with no minimum purchase required.","N","",,,,,,"",,,"36",,,,,,,,,,"3.182",,,,,,,,,,"R",,,,,,,,,,,"N/A",,"USD",,"List",,,,,,,,,,,,,,,,,,,,,,,,,,,,,,,,,,,,,,,,,,,,,,,,,,,"N",,,,,,"Promotional","N",,,"Y","None",,,,
550735834,"Delta Sobo Glue 4 oz. Bottle","",,,,,"Delta Sobo Glue- Size 4 oz. bottleSobo Glue is a superior all-purpose white glue that has good tack and is ideal for crafting with paper some fabrics and most other porous craft materials.The special non-yellowing formula dries clear and flexible Will not bleed through or stain paper or craft fabrics Use on porous and semi-porous surfaces like paper wood chenille leather yarn and some non-washable fabrics like felt Can also be used to make papier mache",,"http://media.asicdn.com/images/jpgb/24390000/24398297.jpg",,"GLUE",,"","","","","",,,"CHINA",,,,,,,"Unimprinted",,"","","Y","","","",,,"Y",,"","","",,"","","","",,"We provide free shipping to all ASI members with in the 48 contiguous states with no minimum purchase required.","N","",,,,,,"",,,"3",,,,,,,,,,"5.40",,,,,,,,,,"R",,,,,,,,,,,"N/A",,"USD",,"List",,,,,,,,,,,,,,,,,,,,,,,,,,,,,,,,,,,,,,,,,,,,,,,,,,,"N",,,,,,"Promotional","N",,,"Y","None",,,,
550724140,"Children's Coloring And Activity Books","",,,,,"Children's Coloring And Activity BooksYou may receive in your order anything from Children's reading books activity books coloring books. We have many hardcover and soft cover as well. You may receive some generic titles as well but many licensed ones as shown a representation in the picture. You will have a nice variety. Some books may be pre-priced as well.    Licence assortedSize assorted booksTitle assortedQuantity 120 per case",,"http://media.asicdn.com/images/jpgb/24380000/24380348.jpg",,"CHILDREN'S BOOKS",,"","","","","",,,"CHINA",,,,,,,"Unimprinted",,"","","Y","","","",,,"Y",,"","","",,"","","","",,"We provide free shipping to all ASI members with in the 48 contiguous states with no minimum purchase required.","N","",,,,,,"",,,"96",,,,,,,,,,"2.364",,,,,,,,,,"R",,,,,,,,,,,"N/A",,"USD",,"List",,,,,,,,,,,,,,,,,,,,,,,,,,,,,,,,,,,,,,,,,,,,,,,,,,,"N",,,,,,"Promotional","N",,,"Y","None",,,,
550727697,"Insect Slime","",,,,,"Insect SlimeInsect trapped in slime and desperately seeking escape. Won't you take some slime home today and free this little bug Assorted colors of sticky gooey slime trap these small insects. Trying to find the right party favor or carnival redemption prize Then look no further than slime or putty. Kids of all ages love to play with these sticky stretchy slimy and gooey toys. The gross factor of slime is always a crowd pleasing favorite at any Halloween party. So stock up on some slime or putty today. We have a wide selection for any party theme.1 12  containerassorted slime colors1 in. Plastic InsectAges 3",,"http://media.asicdn.com/images/jpgb/24660000/24666948.jpg",,"Toys-General",,"","","","","",,,"CHINA",,,,,,,"Unimprinted",,"","","Y","","","",,,"Y",,"","","",,"","","","",,"We provide free shipping to all ASI members with in the 48 contiguous states with no minimum purchase required.","N","",,,,,,"",,,"60",,,,,,,,,,"1.236",,,,,,,,,,"R",,,,,,,,,,,"N/A",,"USD",,"List",,,,,,,,,,,,,,,,,,,,,,,,,,,,,,,,,,,,,,,,,,,,,,,,,,,"N",,,,,,"Promotional","N",,,"Y","None",,,,
4923583,"Luna Tote","",,,,,"What Mother Nature Would Carry Super strong and extra long jute strap slings over the shoulder for added security and comfort. 10 oz. natural cotton body provides an extra large canvas for decorating.  Load up with books or fresh produce - it holds it all. We've mixed some of nature's best with some of fashion's best. This over-the-shoulder beauty combines the durability of Jute with the printability of natural cotton to make the perfect earthy tote.",,"http://media.asicdn.com/images/jpgb/6500000/6503690.jpg",,"ENVIRONMENTALLY FRIENDLY PRODUCTS,SHOPPING BAGS,Tote Bags-Jute,Tote Bags-General",,"Natural","Cotton/Jute","Dimension","Length:14:in;Width:17:in;Height:2.25:in","",,,"CHINA",,,,,,,"Embroidery (call), Heat Transfer (Call), Silkscreen (Included), Unimprinted",,"","","Y","Y","9"" X 9""","Front or back",,,"Y",,"5,7","Y","3:	",,"Bulk packaging","50:per Carton","17.5:in;15:in;15  (none):in","28:lbs",,"","N","",,,,,,"Luna Tote",,,"36","50","100","250","500",,,,,,"8.32","8.08","7.75","7.42","7.08",,,,,,"R","R","R","R","R",,,,,,,"One color imprint, one location",,"USD",,"List","Silkscreen (Included), Heat Transfer (Call), Embroidery (call), Unimprinted (Sold Unimprinted)","IMMD:Silkscreen (Included), Heat Transfer (Call), Embroidery (call), Unimprinted (Sold Unimprinted)",,"Imprint Method Charge","Other","Required","1",,,,,,,,,,"45.00",,,,,,,,,,"Z",,,,,,,,,,"Per color.",,,,,,,,,,,,,,"N",,,,,,"Promotional","N",,,"Y","None",,,,
4923583,,,,,,,,,,,,,,,,,,,,,,,,,,,,,,,,,,,,,,,,,,,,,,,,,,,,,,,,,,,,,,,,,,,,,,,,,,,,,,,,,,,,,,,,,,,,,,,"3 business days","RUSH:3",,"Rush Service Charge","Other","Required","1",,,,,,,,,,"62.50",,,,,,,,,,"Z",,,,,,,,,,"",,,,,,,,,,,,,,,,,,,,,,,,,,,,,
551087074,"Scarves - Assorted","",,,,,"Scarves - Assorted colors and designs in 1 case. Some scarves come with glitter and some do not. Scarf is 15 length is 60 long.",,"http://media.asicdn.com/images/jpgb/24440000/24443167.jpg",,"Clothing-General",,"","","","","",,,"CHINA",,,,,,,"Unimprinted",,"","","Y","","","",,,"Y",,"","","",,"","","","",,"We provide free shipping to all ASI members with in the 48 contiguous states with no minimum purchase required.","N","",,,,,,"",,,"144",,,,,,,,,,"2.636",,,,,,,,,,"R",,,,,,,,,,,"N/A",,"USD",,"List",,,,,,,,,,,,,,,,,,,,,,,,,,,,,,,,,,,,,,,,,,,,,,,,,,,"N",,,,,,"Promotional","N",,,"Y","None",,,,
550846009,"Assorted Color and Style Polarized Sunglasses","",,,,,"Glare blocking polarized sunglasses in nine different styles and colors. Some have metal on the bows and some have a fire design on the bows of the glasses.Polarized24 Pair Sunglasses Per PackageIndividually packaged",,"http://media.asicdn.com/images/jpgb/24350000/24354852.jpg",,"SUNGLASSES",,"","","","","",,,"CHINA",,,,,,,"Unimprinted",,"","","Y","","","",,,"Y",,"","","",,"","","","",,"We provide free shipping to all ASI members with in the 48 contiguous states with no minimum purchase required.","N","",,,,,,"",,,"24",,,,,,,,,,"6.273",,,,,,,,,,"R",,,,,,,,,,,"N/A",,"USD",,"List",,,,,,,,,,,,,,,,,,,,,,,,,,,,,,,,,,,,,,,,,,,,,,,,,,,"N",,,,,,"Promotional","N",,,"Y","None",,,,
550606200,"Noise Clapper","",,,,,"Make some noise at your next event with these noise clappers! Offered in a variety of colors, this clapper will make a loud impression with your custom imprint featured on the side of this fun accessory. Promote your favorite sports team, show school spirit, or celebrate a colleague's success by making this a handout recipients won't be able to put down. Clap it around and make some noise for your next successful promotion!",,"http://media.asicdn.com/images/jpgb/22420000/22420995.jpg",,"Cheering Accessories-General,NOISEMAKERS",,"Red,Burgundy,Orange,Yellow,Green,Purple,Blue,White,Black","","Dimension","Length:7:in;Width:3 1/4:in","",,,"CHINA",,,,,,,"Printed, Unimprinted",,"Art Services, Paper Proof, Pre-production Proof, Virtual Proof","","Y","Y","2"" x 2""","",,,"Y",,"5","","",,"","432:per Carton","","24:lbs",,"","N","",,,,,,"Noise Clapper",,,"300","600","1200","3000",,,,,,,"1.10","1.05","1.00","0.95",,,,,,,"R","R","R","R",,,,,,,,"Prices include 1 color/location imprint.",,"USD",,"List","Printed, Unimprinted","IMMD:Printed, Unimprinted",,"Set-up Charge","Per Order","Required","1",,,,,,,,,,"60.00",,,,,,,,,,"Z",,,,,,,,,,"",,,,,,,,,,,,,,"N",,,,,,"Promotional","N",,,"Y","None",,,,
550606200,,,,,,,,,,,,,,,,,,,,,,,,,,,,,,,,,,,,,,,,,,,,,,,,,,,,,,,,,,,,,,,,,,,,,,,,,,,,,,,,,,,,,,,,,,,,,,,"Art Services, Paper Proof, Pre-production Proof, Virtual Proof","ARTW:Art Services, Paper Proof, Pre-production Proof, Virtual Proof",,"Artwork Charge","Other","Optional","1",,,,,,,,,,"37.50",,,,,,,,,,"Z",,,,,,,,,,"",,,,,,,,,,,,,,,,,,,,,,,,,,,,,
550904109,"Book Beware The Grey Widow Maker by Bernard Edwards","",,,,,"This book follows the changing pattern of man's fortunes at sea from the golden age of sail through the proud years when steam reigned supreme to the present day when the flag of convenience rules the waves. It tells of triumphs and disasters some recent some long forgotten and illustrates how contrary to all expectations the fine art of seamanship has withered and died with the advent of advanced technology. Hardcover 412 pages. Publisher Bricktower March 31 2001 Language English",,"http://media.asicdn.com/images/jpgb/24400000/24402305.jpg",,"Books-General",,"","","","","",,,"CHINA",,,,,,,"Unimprinted",,"","","Y","","","",,,"Y",,"","","",,"","","","",,"We provide free shipping to all ASI members with in the 48 contiguous states with no minimum purchase required.","N","",,,,,,"",,,"24",,,,,,,,,,"4.855",,,,,,,,,,"R",,,,,,,,,,,"N/A",,"USD",,"List",,,,,,,,,,,,,,,,,,,,,,,,,,,,,,,,,,,,,,,,,,,,,,,,,,,"N",,,,,,"Promotional","N",,,"Y","None",,,,
3756331,"Flashing memo alert magnet","",,,,,"You're bound to ""attract"" some new clients with this flashing memo alert magnet! Available in black, blue, red and white, this promotional product makes a great gift or giveaway item for the office or home. Don't forget to have your company name or logo imprinted on the surface of this light up memo alert magnet for some added brand awareness. Invest today and hand out at your next tradeshow or convention!",,"http://media.asicdn.com/images/jpgb/6420000/6424246.jpg",,"Lights-General,Magnets-Memo Holder",,"","Plastic","Dimension","Length:3 1/2:in;Width:1:in","",,,"CHINA",,,,,,,"Silkscreen, Unimprinted",,"","","Y","Y","1 3/4"" x 3/8""","",,,"Y",,"7","Y","",,"","","","",,"","N","",,,,,,"Flashing memo alert magnet",,,"50","100","200","500",,,,,,,"4.50","4.32","4.13","3.95",,,,,,,"R","R","R","R",,,,,,,,"1 color / 1 location imprint",,"USD",,"List","Silkscreen, Unimprinted","IMMD:Silkscreen, Unimprinted",,"Set-up Charge","Other","Required","1",,,,,,,,,,"50.00",,,,,,,,,,"Z",,,,,,,,,,"Imprint charge",,,,,,,,,,,,,,"N",,,,,,"Promotional","N",,,"Y","None",,,,
550727698,"Lizard Slime","",,,,,"Lizard SlimeLizard trapped in slime and desperately seeking escape. Won't you take some slime home to day and free this little reptile Assorted colors of sticky gooey slime trap these small insects. Trying to find the right party favor or carnival redemption prize Then look no further than slime or putty. Kids of all ages love to play with these sticky stretchy slimy and gooey toys. The gross factor of slime is always a crowd pleasing favorite at any Halloween party. So stock up on some slime or putty today. We have a wide selection for any party theme.1 12  containerassorted slime colors1 in. Plastic LizardAges 3",,"http://media.asicdn.com/images/jpgb/24480000/24480391.jpg",,"Toys-General",,"","","","","",,,"CHINA",,,,,,,"Unimprinted",,"","","Y","","","",,,"Y",,"","","",,"","","","",,"We provide free shipping to all ASI members with in the 48 contiguous states with no minimum purchase required.","N","",,,,,,"",,,"72",,,,,,,,,,"1.271",,,,,,,,,,"R",,,,,,,,,,,"N/A",,"USD",,"List",,,,,,,,,,,,,,,,,,,,,,,,,,,,,,,,,,,,,,,,,,,,,,,,,,,"N",,,,,,"Promotional","N",,,"Y","None",,,,
550605832,"Tic Tac Toe Game","",,,,,"Have some fun at your next event with the classic tic-tac-toe game! This game is made from a high quality wood that features O's in red, and X's in blue. This is a great giveaway for schools, fairs, fundraisers, or even party favors. Customized it by adding an imprint of your name, logo, or advertising message. This custom branded promo will make all of your customers have some fun!",,"http://media.asicdn.com/images/jpgb/22410000/22419108.jpg",,"Games-Tic-Tac-Toe",,"","Wood","Dimension","Length:4 1/2:in;Width:4 1/2:in;Height:1 1/8:in","",,,"CHINA",,,,,,,"Printed, Unimprinted",,"Art Services, Paper Proof, Pre-production Proof, Virtual Proof","","Y","Y","3"" X 7/8""","",,,"Y",,"5","","",,"","96:per Carton","","31:lbs",,"","N","",,,,,,"Tic Tac Toe Game",,,"150","300","600","1200",,,,,,,"3.99","3.95","3.90","3.85",,,,,,,"R","R","R","R",,,,,,,,"Prices include 1 color/location imprint.",,"USD",,"List","Printed, Unimprinted","IMMD:Printed, Unimprinted",,"Set-up Charge","Per Order","Required","1",,,,,,,,,,"25.00",,,,,,,,,,"Z",,,,,,,,,,"",,,,,,,,,,,,,,"N",,,,,,"Promotional","N",,,"Y","None",,,,
550605832,,,,,,,,,,,,,,,,,,,,,,,,,,,,,,,,,,,,,,,,,,,,,,,,,,,,,,,,,,,,,,,,,,,,,,,,,,,,,,,,,,,,,,,,,,,,,,,"Art Services, Paper Proof, Pre-production Proof, Virtual Proof","ARTW:Art Services, Paper Proof, Pre-production Proof, Virtual Proof",,"Artwork Charge","Other","Optional","1",,,,,,,,,,"37.50",,,,,,,,,,"Z",,,,,,,,,,"",,,,,,,,,,,,,,,,,,,,,,,,,,,,,
550385672,"CANADIANA Change Purse","",,,,,"The Canuck Canadiana Change Purse, is a perfect for fit in your purse or side pocket. Great way to store just the basics, your cards, change and even some currency (folded). Featuring 100% Tuscany Full Grain Cowhide (TM) leather. Our products are crafted from 100% genuine leather. This premium leather shows off a natural range of shades and textures. Our company uses full grain leather, which is the ultimate quality in leather. Perfect size to store your card cards, along with some change.  Slim design, to fit just perfectly in a pant pocket or a larger bag.  Finished Dimensions: 10.43 cm x 8 cm x 0.5 cm / 4.11"" x 3.15"" x 0.2"".",,"http://media.asicdn.com/images/jpgb/21480000/21480049.jpg",,"COIN PURSES,Key Holders-With Coin Purse",,"British Tan","Cowhide Leather","Dimension","Length:4.11:in;Width:3.15:in;Height:0.2:in","",,,"CHINA",,,,,,,"Blind Debossing, Hot Foil Stamping",,"","","","Y","4 cm x 4 cm / 1.57"" x 1.57""","",,,"Y",,"20,25","Y","10:	",,"","","","Shippable Weight:  35:grams",,"/ 0.08 lb","N","",,,,,,"Blank Pricing, 20-25 business days",,,"",,,,,,,,,,"QUR",,,,,,,,,,"R",,,,,,,,,,,"a Single Location Imprint",,"USD",,"List","Hot Foil Stamping, Blind Debossing","IMMD:Hot Foil Stamping, Blind Debossing",,"Imprint Method Charge","Per Order","Required","1",,,,,,,,,,"5.00",,,,,,,,,,"Z",,,,,,,,,,"Per Square Inch",,,,,,,,,,,,,,"N",,,,,,"Promotional","N",,,"Y","None",,,,
4979548,"Tumbler - Highball","",,,,,"Pass out some cool refreshments during your next party or promotion with this plastic tumbler / highball cold drink style cup! Available in a different sizes to choose from, have your company name or logo imprinted on the surface for some added exposure. A great choice for bars, restaurants, formal affairs and business events, custom printed drinkware is an excellent way to get your brand noticed. Choose this plastic glass for your upcoming campaign!",,"http://media.asicdn.com/images/jpgb/20220000/20228407.jpg",,"Glasses-Drinking-Highball,Glasses-Drinking-Tumbler",,"Clear","Plastic","","","",,,"CHINA",,,,,,,"Printed",,"Art Services (For any changes, including typesetting. ), Paper Proof (Fax), Pre-production Proof (Available on certain products )","Black, Green, Orange, Pantone Purple, Pantone Violet, Pantone Yellow, Process Blue, Red, Reflex Blue, White","","","3"" x 3""","",,,"Y",,"10","Y","",,"","","","",,"Over/Under: We attempt exact amounts on most items. High volume items are accepted and subject to over/under 10% and are billed accordingly.","N","",,,,,,"15 oz",,,"100","500","1000","3000","5000",,,,,,"4.15","3.85","3.70","3.56","3.51",,,,,,"R","R","R","R","R",,,,,,,"one color - one or two side printing.",,"USD",,"List","Printed","IMMD:Printed",,"Set-up Charge","Per Order","Required","1",,,,,,,,,,"60.00",,,,,,,,,,"Z",,,,,,,,,,"Imprint charge",,,,,,,,,,,,,,"N",,,,,,"Promotional","N",,,"Y","None",,,,
4979548,,,,,,,,,,,,,,,,,,,,,,,,,,,,,,,,,,,,,,,,,,,,,,,,,,,,,,,,,,,,,,,,,,,,,,,,,,,,,,,,,,,,,,,,,,,,,,,"Art Services (For any changes, including typesetting. ), Paper Proof (Fax), Pre-production Proof (Available on certain products )","ARTW:Art Services (For any changes, including typesetting. ), Paper Proof (Fax), Pre-production Proof (Available on certain products )",,"Artwork Charge","Other","Optional","1",,,,,,,,,,"50.00",,,,,,,,,,"Z",,,,,,,,,,"No cost for fax. Per proof revision.",,,,,,,,,,,,,,,,,,,,,,,,,,,,,
