4866881,"Java Road Warrior Set","",,,,,"Set includes the Java Mug (1620-53) filled with a flashlight, tire gauge, and silver Colonnade Twist (1015-05) in an EVA foam insert. 14oz.",,,,"Flashlights-General,Mugs & Steins-Insulated,Pens-Ballpoint-Twist Action,TIRE GAUGES,TRAVEL MUGS/CUPS",,"Silver (SL)","Stainless Steel","Dimension","Length:6.75:in","",,,"CHINA",,,,,,,"IMPRINTED, UNIMPRINTED",,"","","Y","Y","","",,,"Y",,"5","Y","",,"Gift Boxes, 1-piece black gift box","",":in;:in;:in","",,"","N","",,,,,,"IMPRINTED",,,"36","100","150","250","400",,,,,,"12.58","12.08","11.58","11.08","9.98",,,,,,"R","R","R","R","R",,,,,,,"Blank Product Only",,"USD",,"List",,,,,,,,,,,,,,,,,,,,,,,,,,,,,,,,,,,,,,,,,,,,,,,,,,,"N",,,,,,"Promotional","N",,,"Y","None",,,,
551039971,"Boca Java Gift Set","",,,,,"Nothing's better than the gift of delicious Boca Java coffee. You can give that and more to your clients with this great set! Also included are sugar sticks and hot chocolate. Everything is packaged together in a Venezia (TM) folding bin. This collapsible container is made of glazed faux leather and features an 80 GSM non-woven fabric lining that also covers the removable cardboard bottom that holds the box shape. Deboss your logo onto this and make this available to cafes and coffeehouses everywhere!",,,,"COFFEE,Food Gifts-Bakery Items,Food Gifts-Hot Chocolate,GIFT BASKETS & SETS",,"Black","Polyurethane","Dimension","Length:8.5:in;Width:10:in;Height:6.5:in","",,,"CHINA",,,,,,,"Deboss",,"","","","","3.25"" Sq.","",,,"Y",,"","","",,"Shrink Wrap","","","",,"","N","",,,,,,"Boca Java Gift Set",,,"6","50","150","300",,,,,,,"53.99","51.99","49.99","47.99",,,,,,,"R","R","R","R",,,,,,,,"N/A",,"USD",,"List","Deboss","IMMD:Deboss",,"Set-up Charge","Per Order","Required","1",,,,,,,,,,"80.00",,,,,,,,,,"Z",,,,,,,,,,"",,,,,,,,,,,,,,"N",,,,,,"Promotional","N",,,"Y","None",,,,
6640373,"Java Stripe Mug","",,,,,"Take a great coffee break with the Java Stripe mug! Measuring 12 oz, this mug features white ceramic with a color stripe on ""C"" handle. This is the perfect promotional item for coffee shops, colleges and businesses alike! Please note this item is handwash only. With an imprint area of 1 1/2"" x 2"" on each side or 1 1/2"" x 7 1/2"" wrap, the possibilities are endless when you are ready to create a one of a kind promotional item!",,,,"Mugs & Steins-Ceramic",,"White-Red,White-Black,White-Lime,White-Blue,White-Purple","Ceramic","Volume/Weight","12:oz","",,,"CHINA",,,,,,,"Printed, Unimprinted",,"Art Services, Paper Proof (When we prepare a possible alternative art suggestion, paper proofs are provided for free. Also, should we choose to send a paper proof for our records, the proof is provided for free. Customer requested paper proofs and revisions of such are upcharged per proof), Virtual Proof","Black, Brown, Green, Metallic Gold, Metallic Silver, Navy, Orange, Red, Reflex Blue, White, Yellow","Y","Y","1 1/2"" H x 2"" W, 1 1/2"" H x 7 1/2"" W","each side, wrap",,,"Y",,"7,10","Y","1:	",,"","","","",,"","N","",,,,,,"",,,"144","288","576","1152","2304",,,,,,"3.27","3.13","2.96","2.82","2.76",,,,,,"R","R","R","R","R",,,,,,,"one color imprint.",,"USD",,"List","Printed, Unimprinted","IMMD:Printed, Unimprinted",,"Set-up Charge","Per Order","Required","1",,,,,,,,,,"55.00",,,,,,,,,,"Z",,,,,,,,,,"",,,,,,,,,,,,,,"N",,,,,,"Promotional","N",,,"Y","None",,,,
6640373,,,,,,,,,,,,,,,,,,,,,,,,,,,,,,,,,,,,,,,,,,,,,,,,,,,,,,,,,,,,,,,,,,,,,,,,,,,,,,,,,,,,,,,,,,,,,,,"Art Services, Paper Proof (When we prepare a possible alternative art suggestion, paper proofs are provided for free. Also, should we choose to send a paper proof for our records, the proof is provided for free. Customer requested paper proofs and revisions of such are upcharged per proof), Virtual Proof","ARTW:Art Services, Paper Proof (When we prepare a possible alternative art suggestion, paper proofs are provided for free. Also, should we choose to send a paper proof for our records, the proof is provided for free. Customer requested paper proofs and revisions of such are upcharged per proof), Virtual Proof",,"Artwork Charge","Other","Optional","1",,,,,,,,,,"12.00",,,,,,,,,,"Z",,,,,,,,,,"",,,,,,,,,,,,,,,,,,,,,,,,,,,,,
5551255,"Java Collection Travel Cup","",,,,,"Make their morning commute a little easier with the Java Collection travel cup! Composed of BPA free plastic and featuring double wall construction, your beverages will keep its temperature longer! Holding up to 16 ounces, keep it all inside the cup with the twist on, color coordinated plastic lid, which creates a streamlined look. A great addition to gift shops, tradeshows, college bookstores and more. Have you band go further with an imprint of your logo or company name.",,,,"TRAVEL MUGS/CUPS",,"Black,Blue,Red,White,Lime,Teal","Plastic","Volume/Weight","16:oz","",,,"CHINA",,,,,,,"Direct Screen",,"Art Services, Paper Proof (When requested, paper proofs are available at no charge. One complimentary change to the art is provided at no charge however; any changes or revisions thereafter will incur charges.)","","","Y","4 1/2""H x 2 3/4""W, 9"" Wrap","",,,"Y",,"","","",,"","24:per Case","","10:lbs",,"","N","",,,,,,"Java Collection Travel Cup",,,"72","144","288","576","1008","1980",,,,,"4.25","3.85","3.70","3.55","3.40","3.25",,,,,"R","R","R","R","R","R",,,,,,"one color imprint.",,"USD",,"List","Direct Screen","IMMD:Direct Screen",,"Imprint Method Charge","Other","Required","1",,,,,,,,,,"12.50",,,,,,,,,,"Z",,,,,,,,,,"",,,,,,,,,,,,,,"N",,,,,,"Promotional","N",,,"Y","None",,,,
5551255,,,,,,,,,,,,,,,,,,,,,,,,,,,,,,,,,,,,,,,,,,,,,,,,,,,,,,,,,,,,,,,,,,,,,,,,,,,,,,,,,,,,,,,,,,,,,,,"Product Sample","SMPL:Product Sample",,"Sample Charge","Other","Optional","1",,,,,,,,,,"50.00",,,,,,,,,,"Z",,,,,,,,,,"",,,,,,,,,,,,,,,,,,,,,,,,,,,,,
5551255,,,,,,,,,,,,,,,,,,,,,,,,,,,,,,,,,,,,,,,,,,,,,,,,,,,,,,,,,,,,,,,,,,,,,,,,,,,,,,,,,,,,,,,,,,,,,,,"Art Services, Paper Proof (When requested, paper proofs are available at no charge. One complimentary change to the art is provided at no charge however; any changes or revisions thereafter will incur charges.)","ARTW:Art Services, Paper Proof (When requested, paper proofs are available at no charge. One complimentary change to the art is provided at no charge however; any changes or revisions thereafter will incur charges.)",,"Artwork Charge","Other","Optional","1",,,,,,,,,,"50.00",,,,,,,,,,"Z",,,,,,,,,,"",,,,,,,,,,,,,,,,,,,,,,,,,,,,,
550535134,"Small Kraft Java Jacket High Lines","",,,,,"Promote your business to clients every time they reach for their favorite beverage! Made from recycled materials, these Java Jackets are designed to fit 8 oz paper cups and offer 2 imprint colors. Add your company name or logo to these insulated beverage wraps and keep them in stock at your cafe', concession stand or college bookstore. What better way to build brand awareness than with a promotional product brimming with possibilities!",,,,"BEVERAGES,COFFEE,ENVIRONMENTALLY FRIENDLY PRODUCTS,Holders-Beverage Container-Sleeve Type,Holders-Beverage Container-Wrap Around",,"Kraft","Other","","","",,,"CHINA",,,,,,,"",,"Paper Proof (1st paper proof $0 - $10 for each additional proof)","Black, Brown, Gold Metallic, Green, Hunter Green, Light Blue, Maroon, Medium Blue, Navy blue, Orange, Pink, Process Blue, Pruple, Red, Reflex Blue, Rhodamine Red, Rubine Red, Silver Metallic, Violet, Warm Red, White, Yellow","","Y","3.5"" x 2""","",,,"Y",,"5","","",,"","","","",,"","N","",,,,,,"Large White Java Jacket",,,"10000","25000","50000","75000","100000","250000",,,,,"0.243","0.231","0.219","0.191","0.177","0.164",,,,,"R","R","R","R","R","R",,,,,,"one color imprint",,"USD",,"List","Paper Proof (1st paper proof $0 - $10 for each additional proof)","ARTW:Paper Proof (1st paper proof $0 - $10 for each additional proof)",,"Artwork Charge","Other","Optional","1",,,,,,,,,,"50.00",,,,,,,,,,"Z",,,,,,,,,,"",,,,,,,,,,,,,,"N",,,,,,"Promotional","N",,,"Y","None",,,,
550653009,"Java Beach Towel","",,,,,"Have guests wrapped up in your brand and drying off with your logo in hand! A great promotional tool for resorts, boardwalk shops and other summer-themed businesses, our standard weight Java Beach Towel measures 29"" x 58"". It's made from 100% sheared terry velour and weighs in at 8 lbs/doz., making it pound for pound the most affordable beach towel anywhere! Whether lounging out on a beach chair, or laying out on the beach, guests are sure to use this towel over and over again!",,,,"Towels-Beach",,"White","100% cotton terry velour","Dimension","Length:29:in;Width:58:in","",,,"CHINA",,,,,,,"Blank (white), Screenprinted (white)",,"Virtual Proof, Art Services, Paper Proof","Black, Brown, Cardinal, Fuchsia, Gold, Gray, Green, Hunter, Lime, Maroon, Navy, Orange, Purple, Red, Reflex Blue, Royal, Teal, Turquoise, White/Translucent, Yellow","","","26"" x 48""","",,,"Y",,"5","","",,"Bulk","","","8:lbs",,"UPS or FedEx","N","",,,,,,"Blank (white)",,,"1","50","100","250","500",,,,,,"9.25","8.50","7.75","6.75","6.25",,,,,,"R","R","R","R","R",,,,,,,"N/A",,"USD",,"List","Screenprinted (white), Blank (white)","IMMD:Screenprinted (white), Blank (white)",,"Imprint Method Charge","Other","Required","1",,,,,,,,,,"55.00",,,,,,,,,,"Z",,,,,,,,,,"",,,,,,,,,,,,,,"N",,,,,,"Promotional","N",,,"Y","None",,,,
550653009,,,,,,,,,,,,,,,,,,,,,,,,,,,,,,,,,,,,,,,,,,,,,,,,,,,,,,,,,,,,,,,,,,,,,,,,,,,,,,,,,,,,,,,,,,,,,,,"Virtual Proof, Art Services, Paper Proof","ARTW:Virtual Proof, Art Services, Paper Proof",,"Artwork Charge","Other","Optional","1",,,,,,,,,,"45.00",,,,,,,,,,"Z",,,,,,,,,,"per hour with a half hour minimum",,,,,,,,,,,,,,,,,,,,,,,,,,,,,
550535135,"Small White Java Jacket High Lines","",,,,,"Promote your business to clients every time they reach for their favorite beverage! Made from recycled materials, these Java Jackets are designed to fit 8 oz cups and offer 2 imprint colors. Add your company name or logo to these insulated beverage wraps and keep them in stock at your cafe', concession stand or college bookstore. What better way to build brand awareness than with a promotional product brimming with possibilities!",,,,"Holders-Beverage Container-Wrap Around",,"White","Other","","","",,,"CHINA",,,,,,,"",,"Paper Proof (1st paper proof $0 - $10 for each additional proof)","Black, Brown, Gold Metallic, Green, Hunter Green, Light Blue, Maroon, Medium Blue, Navy blue, Orange, Pink, Process Blue, Pruple, Red, Reflex Blue, Rhodamine Red, Rubine Red, Silver Metallic, Violet, Warm Red, White, Yellow","","Y","3.5"" x 2""","",,,"Y",,"5","","",,"","","","",,"","N","",,,,,,"Large White Java Jacket",,,"10000","25000","50000","75000","100000","250000",,,,,"0.243","0.231","0.219","0.191","0.177","0.164",,,,,"R","R","R","R","R","R",,,,,,"one color imprint",,"USD",,"List","Paper Proof (1st paper proof $0 - $10 for each additional proof)","ARTW:Paper Proof (1st paper proof $0 - $10 for each additional proof)",,"Artwork Charge","Other","Optional","1",,,,,,,,,,"50.00",,,,,,,,,,"Z",,,,,,,,,,"",,,,,,,,,,,,,,"N",,,,,,"Promotional","N",,,"Y","None",,,,
550535029,"Small Kraft Java Jacket","",,,,,"Promote your business to clients every time they reach for their favorite beverage! Made from recycled materials, these Java Jackets are designed to fit 8 oz paper cups and offer 2 imprint colors. Add your company name or logo to these insulated beverage wraps and keep them in stock at your cafe', concession stand or college bookstore. What better way to build brand awareness than with a promotional product brimming with possibilities! Digital Printing available! Please Allow 7 production days for digital printing.",,,,"Holders-Beverage Container-Sleeve Type,Holders-Beverage Container-Wrap Around",,"Kraft","Other","","","",,,"CHINA",,,,,,,"",,"Paper Proof (1st paper proof $0 - $10 for each additional proof)","Black, Brown, Gold Metallic, Green, Hunter Green, Light Blue, Maroon, Medium Blue, Navy blue, Orange, Pink, Process Blue, Pruple, Red, Reflex Blue, Rhodamine Red, Rubine Red, Silver Metallic, Violet, Warm Red, White, Yellow","","Y","3.5"" x 2""","",,,"Y",,"5,7","","",,"","","","",,"","N","",,,,,,"Small Kraft Java Jacket",,,"100","250","500","1000","2500","5000",,,,,"0.59","0.42","0.37","0.30","0.27","0.25",,,,,"R","R","R","R","R","R",,,,,,"One color imprint",,"USD",,"List","Paper Proof (1st paper proof $0 - $10 for each additional proof)","ARTW:Paper Proof (1st paper proof $0 - $10 for each additional proof)",,"Artwork Charge","Other","Optional","1",,,,,,,,,,"25.00",,,,,,,,,,"Z",,,,,,,,,,"",,,,,,,,,,,,,,"N",,,,,,"Promotional","N",,,"Y","None",,,,
550535028,"Small White Java Jacket","",,,,,"Promote your business to clients every time they reach for their favorite beverage! Made from recycled materials, these Java Jackets are designed to fit 8 oz cups and offer 2 imprint colors. Add your company name or logo to these insulated beverage wraps and keep them in stock at your cafe', concession stand or college bookstore. What better way to build brand awareness than with a promotional product brimming with possibilities!Digital Printing available! Please Allow 7 production days for digital printing.",,,,"Holders-Beverage Container-Wrap Around",,"White","Other","","","",,,"CHINA",,,,,,,"",,"Paper Proof (1st paper proof $0 - $10 for each additional proof)","Black, Brown, Gold Metallic, Green, Hunter Green, Light Blue, Maroon, Medium Blue, Navy blue, Orange, Pink, Process Blue, Pruple, Red, Reflex Blue, Rhodamine Red, Rubine Red, Silver Metallic, Violet, Warm Red, White, Yellow","","Y","3.5"" x 2""","",,,"Y",,"5,7","","",,"","","","",,"","N","",,,,,,"Large White Java Jacket",,,"100","250","500","1000","2500","5000",,,,,"0.59","0.42","0.37","0.30","0.27","0.25",,,,,"R","R","R","R","R","R",,,,,,"One color imprint",,"USD",,"List","Paper Proof (1st paper proof $0 - $10 for each additional proof)","ARTW:Paper Proof (1st paper proof $0 - $10 for each additional proof)",,"Artwork Charge","Other","Optional","1",,,,,,,,,,"25.00",,,,,,,,,,"Z",,,,,,,,,,"",,,,,,,,,,,,,,"N",,,,,,"Promotional","N",,,"Y","None",,,,
550850135,"Art Glass Scented Candle Java Patchouli","",,,,,"Art Glass Scented Candle Java Patchouli  Bring warm light and enticing fragrances into any home or office space with an Art Glass candle. The large candles burn for more than 100 hours on average casting intoxicating scents such as fruits and island flowers into the air. Color BlackGraySize 3 x 4 InchesType Pillar candle",,,,"CANDLES",,"","","","","",,,"CHINA",,,,,,,"Unimprinted",,"","","Y","","","",,,"Y",,"","","",,"","","","",,"We provide free shipping to all ASI members with in the 48 contiguous states with no minimum purchase required.","N","",,,,,,"",,,"6",,,,,,,,,,"3.80",,,,,,,,,,"R",,,,,,,,,,,"N/A",,"USD",,"List",,,,,,,,,,,,,,,,,,,,,,,,,,,,,,,,,,,,,,,,,,,,,,,,,,,"N",,,,,,"Promotional","N",,,"Y","None",,,,
551134923,"12 oz Java Coffee Mug","",,,,,"12 oz Java Coffee Mug, Product Dimensions: 4.125"" H x 3.25"" R x 4.75"" W. Absolute minimum is 36 pieces.",,,,"Mugs & Steins-Stoneware",,"Brown,Cobalt Blue,Orange,Pink,Yellow","Stoneware","Volume/Weight","12:oz","",,,"CHINA",,,,,,,"Decal Print, DIRECT PRINT, Laser Engraved",,"Paper Proof (First proof is free), Pre-production Proof (For single color ), Pre-Production Sample for Multi Color Decal Process (Pre-production sample for multi color decal process )","Black, BLUE, Brown, Cool Gray, Green, Maroon, Matte Gold, Matte Silver, Orange, Peach, Pink, Process Blue, Purple, Red, Reflex Blue, Tan, Teal, Warm Gray, White, Yellow","","","1 Color Imprint Area: 2.50"" W x 1.75"" H, 2 Color Imprint Area: 2.00"" W x 2.00"" H, 3+ Colors Imprint Area: 3.00""W x 2.25""H, Laser Imprint Area: 1.40"" W x 1.50"" H","",,,"Y",,"10","Y","2:,3:	",,"","36:per Box","20:in;18:in;16:in","30.86:lbs",,"","N","",,,,,,"Colored Mug",,,"36","72","144","288","576","1008","2016",,,,"2.86","2.19","2.04","2.02","1.99","1.98","1.94",,,,"R","R","R","R","R","R","R",,,,,"One Color, One or Two Location Imprint",,"USD",,"List","Decal Print, DIRECT PRINT, Laser Engraved","IMMD:Decal Print, DIRECT PRINT, Laser Engraved",,"Set-up Charge","Other","Required","1",,,,,,,,,,"27.78",,,,,,,,,,"Z",,,,,,,,,,"Per laser location",,,,,,,,,,,,,,"N",,,,,,"Promotional","N",,,"Y","None",,,,
551134923,,,,,,,,,,,,,,,,,,,,,,,,,,,,,,,,,,,,,,,,,,,,,,,,,,,,,,,,,,,,,,,,,,,,,,,,,,,,,,,,,,,,,,,,,,,,,,,"Paper Proof (First proof is free), Pre-production Proof (For single color ), Pre-Production Sample for Multi Color Decal Process (Pre-production sample for multi color decal process )","ARTW:Paper Proof (First proof is free), Pre-production Proof (For single color ), Pre-Production Sample for Multi Color Decal Process (Pre-production sample for multi color decal process )",,"Artwork Charge","Other","Optional","1",,,,,,,,,,"10.00",,,,,,,,,,"Z",,,,,,,,,,"",,,,,,,,,,,,,,,,,,,,,,,,,,,,,
551134923,,,,,,,,,,,,,,,,,,,,,,,,,,,,,,,,,,,,,,,,,,,,,,,,,,,,,,,,,,,,,,,,,,,,,,,,,,,,,,,,,,,,,,,,,,,,,,,"2 business days,3 business days","RUSH:2,3",,"Rush Service Charge","Other","Required","36",,,,,,,,,,"3.42",,,,,,,,,,"Z",,,,,,,,,,"",,,,,,,,,,,,,,,,,,,,,,,,,,,,,
551097279,"12 oz. Java Two Tone Mug","",,,,,"12 oz. Java Two Tone Mug, Absolute minimum is 36 pieces. Product Dimensions: 4.75"" W x 4.25"" H.",,,,"Mugs & Steins-Stoneware",,"Black,Cobalt Blue,Green,Lavender,Light Blue,Maroon,Orange,Pink,Yellow","Stoneware","Volume/Weight","12:oz","",,,"CHINA",,,,,,,"Laser Engraved",,"Pre-production Proof (For Multi Color Decal Process ), Pre-production Sample for Single Color Process (Pre-production Sample for Single Color Process ), Paper Proof (First proof is free)","Black, BLUE, Brown, Cool Gray, Green, Maroon, Matte Gold, Matte Silver, Orange, Peach, Pink, Process Blue, Purple, Red, Reflex Blue, Tan, Teal, Warm Gray, White, Yellow","","","1 Color Imprint Area: 2.50""W x 1.75""H, 2 Color Imprint Area: 2.25"" W x 2.25"" H, 3+ Colors Imprint Area: 2.50""W x 2.50"", Laser Area: 1.40"" W x 2.00"" H","",,,"Y",,"10","Y","2:,3:	",,"","36:per Box","20:in;18:in;16:in","23.08:lbs",,"","N","",,,,,,"",,,"36","72","144","288","576","1008","2016",,,,"3.47","2.80","2.43","2.32","2.31","2.29","2.27",,,,"R","R","R","R","R","R","R",,,,,"One Color, One or Two Location Imprint",,"USD",,"List","Laser Engraved","IMMD:Laser Engraved",,"Set-up Charge","Other","Required","1",,,,,,,,,,"54.44",,,,,,,,,,"Z",,,,,,,,,,"per color or Laser Location.",,,,,,,,,,,,,,"N",,,,,,"Promotional","N",,,"Y","None",,,,
551097279,,,,,,,,,,,,,,,,,,,,,,,,,,,,,,,,,,,,,,,,,,,,,,,,,,,,,,,,,,,,,,,,,,,,,,,,,,,,,,,,,,,,,,,,,,,,,,,"Pre-production Proof (For Multi Color Decal Process ), Pre-production Sample for Single Color Process (Pre-production Sample for Single Color Process ), Paper Proof (First proof is free)","ARTW:Pre-production Proof (For Multi Color Decal Process ), Pre-production Sample for Single Color Process (Pre-production Sample for Single Color Process ), Paper Proof (First proof is free)",,"Artwork Charge","Other","Optional","1",,,,,,,,,,"277.78",,,,,,,,,,"Z",,,,,,,,,,"",,,,,,,,,,,,,,,,,,,,,,,,,,,,,
551097279,,,,,,,,,,,,,,,,,,,,,,,,,,,,,,,,,,,,,,,,,,,,,,,,,,,,,,,,,,,,,,,,,,,,,,,,,,,,,,,,,,,,,,,,,,,,,,,"2 business days,3 business days","RUSH:2,3",,"Rush Service Charge","Other","Required","36",,,,,,,,,,"4.51",,,,,,,,,,"Z",,,,,,,,,,"",,,,,,,,,,,,,,,,,,,,,,,,,,,,,
551097296,"12 oz. Java Two Tone Mug","",,,,,"12 oz. Java Two Tone Mug, Absolute minimum is 36 pieces. Product Dimensions: 4.75"" W x 4.25"" H.",,,,"Mugs & Steins-Stoneware",,"Black-Blue,Black-Lime,Black-Orange,Black-Purple,Black-Red,Black-Teal,Black-White","Stoneware","Volume/Weight","12:oz","",,,"CHINA",,,,,,,"Laser Engraved",,"Pre-production Proof (For Multi Color Decal Process ), Pre-production Sample for Single Color Process (Pre-production Sample for Single Color Process ), Paper Proof (First proof is free)","Black, BLUE, Brown, Cool Gray, Green, Maroon, Matte Gold, Matte Silver, Orange, Peach, Pink, Process Blue, Purple, Red, Reflex Blue, Tan, Teal, Warm Gray, White, Yellow","","","1 Color Imprint Area: 2.50""W x 1.75""H, 2 Color Imprint Area: 2.25""W x 2.25""H, 3+ Colors Imprint Area: 2.50"" W x 2.50"" H, Laser Area: 1.40"" W x 2.00"" H","",,,"Y",,"10","Y","2:,3:	",,"","36:per Box","20:in;18:in;16:in","34.30:lbs",,"","N","",,,,,,"",,,"36","72","144","288","576","1008","2016",,,,"3.96","3.29","2.80","2.69","2.63","2.57","2.51",,,,"R","R","R","R","R","R","R",,,,,"One Color, One or Two Location Imprint",,"USD",,"List","Laser Engraved","IMMD:Laser Engraved",,"Set-up Charge","Other","Required","1",,,,,,,,,,"54.44",,,,,,,,,,"Z",,,,,,,,,,"per color or Laser Location.",,,,,,,,,,,,,,"N",,,,,,"Promotional","N",,,"Y","None",,,,
551097296,,,,,,,,,,,,,,,,,,,,,,,,,,,,,,,,,,,,,,,,,,,,,,,,,,,,,,,,,,,,,,,,,,,,,,,,,,,,,,,,,,,,,,,,,,,,,,,"Pre-production Proof (For Multi Color Decal Process ), Pre-production Sample for Single Color Process (Pre-production Sample for Single Color Process ), Paper Proof (First proof is free)","ARTW:Pre-production Proof (For Multi Color Decal Process ), Pre-production Sample for Single Color Process (Pre-production Sample for Single Color Process ), Paper Proof (First proof is free)",,"Artwork Charge","Other","Optional","1",,,,,,,,,,"277.78",,,,,,,,,,"Z",,,,,,,,,,"",,,,,,,,,,,,,,,,,,,,,,,,,,,,,
551097296,,,,,,,,,,,,,,,,,,,,,,,,,,,,,,,,,,,,,,,,,,,,,,,,,,,,,,,,,,,,,,,,,,,,,,,,,,,,,,,,,,,,,,,,,,,,,,,"2 business days,3 business days","RUSH:2,3",,"Rush Service Charge","Other","Required","36",,,,,,,,,,"5.14",,,,,,,,,,"Z",,,,,,,,,,"",,,,,,,,,,,,,,,,,,,,,,,,,,,,,
550394390,"Basket with Java Cups, Starbucks Coffee, & Cookies","",,,,,"Coffee Gift Basket with 2-Java Cups, Starbucks coffee pack for 10 cups of coffee and cookies. Includes 2-Double walled to prolong beverage temperature, BPA Free plastic and twist on plastic lid. All gift baskets are made to order so they can be customized to fit your budget, taste, event theme and company colors. Other colors and filler options available. Each basket is wrapped in clear cello and tied with a bow for a gift presentation and easy distribution.  Shipped bulk or to individual addresses.",,,,"BEVERAGES,COFFEE,ENVIRONMENTALLY FRIENDLY PRODUCTS,Food Gifts-Bakery Items,GIFT BASKETS & SETS",,"Red,Assorted","BPA Free Plastic","Dimension","Length:3.5:in;Width:6.87:in","",,,"CHINA",,,,,,,"Full Color, Screenprint, Unimprinted",,"","","Y","","","",,,"Y",,"8,12","Y","5:,7:	",,"Gift Wrapped","","","",,"Shipping and Handling Not included. Handling fees will apply even with a a third party shipper number.","N","",,,,,,"Gift Basket with tumblers, coffee and cookies",,,"36","144","288",,,,,,,,"39.99","34.157","33.986",,,,,,,,"R","R","R",,,,,,,,,"Gift Basket with 2-tumblers, Starbucks coffee and cookies wrapped",,"USD",,"List","Screenprint, Full Color, Unimprinted","IMMD:Screenprint, Full Color, Unimprinted",,"Set-up Charge","Other","Required","72",,,,,,,,,,"60.00",,,,,,,,,,"Z",,,,,,,,,,"Set up fee per color.You may order less than the minimum quantity",,,,,,,,,,,,,,"N",,,,,,"Promotional","N",,,"Y","None",,,,
550644609,"Java","",,,,,"Plastic pen, white barrel, colored clip and matching rubber grip, chrome tip and plunger. Retractable mechanism. Medium point; black ink.",,,,"Pens-Ballpoint-Plunger Action,Pens-Ballpoint-With Grip Section",,"Red,Green,Purple,Black,Blue,Orange","Plastic","","","",,,"CHINA",,,,,,,"Pad Print, Unimprinted",,"Pre-production Proof (Additional cost may apply), Paper Proof","","Y","","Pad Imprint 1 1/2 w x 9/16 h","",,,"Y",,"5,7","","",,"Bulk","1000:per Carton","","20:lbs",,"","N","",,,,,,"Java",,,"500","1000","2500","5000",,,,,,,"0.75","0.70","0.65","0.60",,,,,,,"R","R","R","R",,,,,,,,"one color/one location imprint.",,"USD",,"List","Pad Print, Unimprinted","IMMD:Pad Print, Unimprinted",,"Set-up Charge","Other","Required","1",,,,,,,,,,"30.00",,,,,,,,,,"Z",,,,,,,,,,"per color.",,,,,,,,,,,,,,"N",,,,,,"Promotional","N",,,"Y","None",,,,
551164853,"Java Stainless Mug","",,,,,"Stainless steel construction. Plastic twist-on lid with plastic thumb-slide closure. Durable handle. Stainless steel exterior with a plastic liner. Fits most standard cup holders. 14oz.",,,,"Mugs & Steins-General",,"Silver (SL)","Stainless Steel with Plastic Liner","Dimension","Length:6.75:in","",,,"CHINA",,,,,,,"Drinkware, UNIMPRINTED",,"","","Y","","1.25""H x 1.75""L, 1.25""H x 6.75""L","",,,"Y",,"","Y","",,"","25:per Case","24.01:in;18.3:in;8.07:in","21.36:lbs",,"","N","",,,,,,"IMPRINTED",,,"96","150","300","450","600",,,,,,"5.65","5.42","5.20","4.98","4.48",,,,,,"R","R","R","R","R",,,,,,,"Blank Product Only",,"USD",,"List","Drinkware, UNIMPRINTED","IMMD:Drinkware, UNIMPRINTED",,"Set-up Charge","Per Order","Required","1",,,,,,,,,,"95.00",,,,,,,,,,"Z",,,,,,,,,,"",,,,,,,,,,,,,,"N",,,,,,"Promotional","N",,,"Y","None",,,,
551074942,"Java Colombian 12-Cup Coffee Pkg Of 40","",,,,,"Colombian Supreme Coffee Pkg Of 40 - 100 Colombian - Made From Top Grade Arabica Beans From The Peaks Of The Andes - Rich Nutty F lavor And Lingering Sweetness - 1.3 Oz 10 To 12-Cup Loose Packages - Filters Included In Case - For Commercial Or In-Room 10 To 12-C up Brewing Systems",,,,"COFFEE",,"","","","","",,,"CHINA",,,,,,,"Unimprinted",,"","","Y","","","",,,"Y",,"","","",,"","","","",,"We provide free shipping to all ASI members with in the 48 contiguous states with no minimum purchase required.","N","",,,,,,"",,,"80",,,,,,,,,,"2.918",,,,,,,,,,"R",,,,,,,,,,,"N/A",,"USD",,"List",,,,,,,,,,,,,,,,,,,,,,,,,,,,,,,,,,,,,,,,,,,,,,,,,,,"N",,,,,,"Promotional","N",,,"Y","None",,,,
