550535065,"Large White Java Jacket High Lines","",,,,,"Promote your business to clients every time they reach for their favorite beverage! Made from recycled materials, these coffee clutches are designed to fit 12 to 20 oz. paper cups and offer 2 imprint colors. Add your company name or logo to these insulated beverage wraps and keep them in stock at your cafe', concession stand or college bookstore. What better way to build brand awareness than with a promotional product brimming with possibilities! Large Java Jacket also fits: 12 oz. Eco solid cup, 20-24 oz. Insulated paper cups, and 16-20 oz. foam cups",,,,"Holders-Beverage Container-Wrap Around",,"White","Other","","","",,,"CHINA",,,,,,,"",,"Paper Proof (1st paper proof $0 - $10 for each additional proof)","Black, Brown, Gold Metallic, Green, Hunter Green, Light Blue, Maroon, Medium Blue, Navy blue, Orange, Pink, Process Blue, Pruple, Red, Reflex Blue, Rhodamine Red, Rubine Red, Silver Metallic, Violet, Warm Red, White, Yellow","","Y","3.5"" x 2""","",,,"Y",,"5","","",,"","","","",,"","N","",,,,,,"Large White Java Jacket",,,"10000","25000","50000","75000","100000","250000",,,,,"0.243","0.231","0.219","0.191","0.177","0.164",,,,,"R","R","R","R","R","R",,,,,,"one color imprint",,"USD",,"List","Paper Proof (1st paper proof $0 - $10 for each additional proof)","ARTW:Paper Proof (1st paper proof $0 - $10 for each additional proof)",,"Artwork Charge","Other","Optional","1",,,,,,,,,,"50.00",,,,,,,,,,"Z",,,,,,,,,,"Die/Screen Charge",,,,,,,,,,,,,,"N",,,,,,"Promotional","N",,,"Y","None",,,,
551164079,"Java Coffee Mug Pin","",,,,,"A hot cup of Java is the best pick-me-up! Allow this pin to be added to your special someones gift! It is a fun piece that can be worn for a special occasion or by someone who loves to ""do"" coffee with you for good added conversation. This pin is crafted from quality jeweler's metal, and features a trendy design created in the soft enamel process and black dye plated for a great presentation. Each includes a standard clutch back that keeps this pin securely in place on your garment, lapel, lanyard, and ID badge. It comes individually poly bagged ideal for give-outs at special fundraisers and early morning meetings and events.",,,,"Jewelry-General,LAPEL PINS",,"Black,Light Blue,Brown","Nickel","Dimension","Length:3/4:in;Width:11/16:in","",,,"CHINA",,,,,,,"Unimprinted",,"","","Y","","","",,,"Y",,"","","",,"Individual Poly Bag","100:per Other (Pieces)","","1:lbs",,"","N","",,,,,,"",,,"100","250","500",,,,,,,,"3.02","2.38","2.22",,,,,,,,"R","R","R",,,,,,,,,"Clutch Back",,"USD",,"List",,,,,,,,,,,,,,,,,,,,,,,,,,,,,,,,,,,,,,,,,,,,,,,,,,,"N",,,,,,"Promotional","N",,,"Y","None",,,,
4721961,"Monda Java bowl","",,,,,"Monda Java bowl color stoneware coffee mug, 16 oz.",,,,"Mugs & Steins-Soup Type,Mugs & Steins-Stoneware",,"","Ceramic","Volume/Weight","16:oz","",,,"CHINA",,,,,,,"Ceramic Ink, Deep Etch",,"","","","Y","1.5"" x 3.0""","",,,"Y",,"10","","",,"","24:per Other (carton)","","28:lbs",,"","N","",,,,,,"Monda Java bowl",,,"72","144","288","432","720","1440",,,,,"C5.35","C5.15","C4.95","C4.79","C4.65","C4.48",,,,,"R","R","R","R","R","R",,,,,,"1 color",,"USD",,"List","Deep Etch, Ceramic Ink","IMMD:Deep Etch, Ceramic Ink",,"Set-up Charge","Other","Required","1",,,,,,,,,,"C6.00",,,,,,,,,,"Z",,,,,,,,,,"Imprint charge",,,,,,,,,,,,,,"N",,,,,,"Promotional","N",,,"Y","None",,,,
551195951,"Ceramic Java Coffee Mug","",,,,,"Create something eye-catching, promotional and practical with the stylish look and cool colors of this ceramic java coffee mug. This 12 oz. mug features a tapered design with a smooth rim, a glossy finish and a comfortable grip.",,,,"Mugs & Steins-Ceramic,TRAVEL MUGS/CUPS",,"MULTI COLOR","Colour Ceramic Glaze","Volume/Weight","12:oz","",,,"CHINA",,,,,,,"Decal, Silkscreen, Unimprinted",,"Art Services, Paper Proof, Pre-production Proof, Virtual Proof","All Colors","Y","","","",,,"Y",,"60","","",,"Case","36:per Carton","","13:kg",,"","N","",,,,,,"",,,"1000","5000","10000","15000","25000",,,,,,"2.617","1.954","1.91","1.854","1.751",,,,,,"R","R","R","R","R",,,,,,,"N/A",,"USD",,"List","Silkscreen, Decal, Unimprinted","IMMD:Silkscreen, Decal, Unimprinted",,"Imprint Method Charge","Other","Required","1",,,,,,,,,,"28.571",,,,,,,,,,"Z",,,,,,,,,,"",,,,,,,,,,,,,,"N",,,,,,"Promotional","N",,,"Y","None",,,,
550647918,"Vapor(R) Ringer Tee - Sandy with Java","",,,,,"Vapor(R) Ringer Tee - Sandy with Java colored collar and sleeves. The classic, short sleeve Basic Ringer features an accented collar and sleeve sets, ribbed taped neck collar and sleeves, and reinforced hems. 100% 5.9 oz Spun Polyester. Patented moisture transport technology that makes fabric cooler, and oil, odor, and bacteria resistant.",,,,"ANTIMICROBIAL ENHANCED PRODUCTS,PERFORMANCE APPAREL,T-Shirts-Unisex",,"Sandy-Java","Polyester","Standard & Numbered","XS,S,3XL","",,,"CHINA",,,,,,,"Pad Print, Silkscreen, Sublimation",,"Proof charge, Art Services","standard primary colors","","","","",,,"Y",,"10,15","Y","3:	",,"","","","",,"","N","",,,,,,"Vapor(R) Ringer Tee, Sandy with Java",,,"5","10","15","25","50","75","100",,,,"20.65","17.55","17.25","16.95","16.65","16.30","15.85",,,,"R","R","R","R","R","R","R",,,,,"full color imprint, 1 location.",,"USD",,"List","Silkscreen, Pad Print, Sublimation","IMMD:Silkscreen, Pad Print, Sublimation",,"Set-up Charge","Per Order","Required","1",,,,,,,,,,"30.00",,,,,,,,,,"Z",,,,,,,,,,"",,,,,,,,,,,,,,"N",,,,,,"Promotional","N",,,"Y","None",,,,
550647918,,,,,,,,,,,,,,,,,,,,,,,,,,,,,,,,,,,,,,,,,,,,,,,,,,,,,,,,,,,,,,,,,,,,,,,,,,,,,,,,,,,,,,,,,,,,,,,"Proof charge, Art Services","ARTW:Proof charge, Art Services",,"Artwork Charge","Other","Optional","",,,,,,,,,,"QUR",,,,,,,,,,"Z",,,,,,,,,,"",,,,,,,,,,,,,,,,,,,,,,,,,,,,,
550647918,,,,,,,,,,,,,,,,,,,,,,,,,,,,,,,,,,,,,,,,,,,,,,,,,,,,,,,,,,,,,,,,,,,,,,,,,,,,,,,,,,,,,,,,,,,,,,,"3 business days","RUSH:3",,"Rush Service Charge","Other","Required","",,,,,,,,,,"QUR",,,,,,,,,,"Z",,,,,,,,,,"",,,,,,,,,,,,,,,,,,,,,,,,,,,,,
551201629,"Java Bookends","",,,,,"Like bubbles in latte foam, the Java Bookends offer a look that rings true of their name. Streams like coffee and cream weave themselves throughout these bookends, creating a look that is timeless. The beautiful fossil stone marble is an eye catcher to all who walk past. The Java Bookends will be the perfect addition to any book collection, adding artistic flair wherever they stand. Qualities in the marble, lend to slight differences between each bookend, giving it a unique beauty. These bookends while functional, also cater to personalization through etch and, for an additional cost, color fill. Bring functional, sophistication to your brand through the java bookends!",,,,"Awards-Crystal,BOOK ENDS,Custom Awards,Desk Accessories-Decorative",,"Brown,Tan","Marble","Dimension","Length:6:in;Width:4  (none):in","Custom Shapes",,,"CHINA",,,,,,,"Sand Etched",,"","Black, Gold, Silver, White","","Y","3"" W x 5.25"" H","Frontside",,,"Y",,"7,10","Y","5:	",,"Gift Boxes","","","",,"","N","",,,,,,"QUR",,,"",,,,,,,,,,"QUR",,,,,,,,,,"R",,,,,,,,,,,"one area of decoration",,"USD",,"List","Sand Etched","IMMD:Sand Etched",,"Imprint Method Charge","Other","Required","1",,,,,,,,,,"25.00",,,,,,,,,,"Z",,,,,,,,,,"",,,,,,,,,,,,,,"N",,,,,,"Promotional","N",,,"Y","None",,,,
551201629,,,,,,,,,,,,,,,,,,,,,,,,,,,,,,,,,,,,,,,,,,,,,,,,,,,,,,,,,,,,,,,,,,,,,,,,,,,,,,,,,,,,,,,,,,,,,,,"5 business days","RUSH:5",,"Rush Service Charge","Other","Required","1",,,,,,,,,,"125.00",,,,,,,,,,"Z",,,,,,,,,,"",,,,,,,,,,,,,,,,,,,,,,,,,,,,,
550534993,"Large Kraft Java Jacket","",,,,,"Promote your business to clients every time they reach for their favorite beverage! Made from recycled materials, these Java Jackets are designed to fit 16 - 20 oz paper cups and offer 2 imprint colors. Add your company name or logo to these insulated beverage wraps and keep them in stock at your cafe', concession stand or college bookstore. What better way to build brand awareness than with a promotional product brimming with possibilities!Large Java Jacket also fits: 12 oz. Eco solid cup, 20-24 oz. Insulated paper cups, and 16-20 oz. foam cupsDigital Printing Available, Please allow 7 days production time.",,,,"BEVERAGES,COFFEE,Cups-Paper,ENVIRONMENTALLY FRIENDLY PRODUCTS,Holders-Beverage Container-Wrap Around",,"Kraft","Other","","","",,,"CHINA",,,,,,,"",,"Paper Proof (1st paper proof $0 - $10 for each additional proof)","Black, Brown, Gold Metallic, Green, Hunter Green, Light Blue, Maroon, Medium Blue, Navy blue, Orange, Pink, Process Blue, Pruple, Red, Reflex Blue, Rhodamine Red, Rubine Red, Silver Metallic, Violet, Warm Red, White, Yellow","","","3.5"" x 2""","",,,"Y",,"5,7","","",,"","","","",,"","N","",,,,,,"Large White Java Jacket",,,"100","250","500","1000","2500","5000",,,,,"0.59","0.42","0.37","0.30","0.27","0.25",,,,,"R","R","R","R","R","R",,,,,,"one color imprint",,"USD",,"List","Paper Proof (1st paper proof $0 - $10 for each additional proof)","ARTW:Paper Proof (1st paper proof $0 - $10 for each additional proof)",,"Artwork Charge","Other","Optional","1",,,,,,,,,,"25.00",,,,,,,,,,"Z",,,,,,,,,,"",,,,,,,,,,,,,,"N",,,,,,"Promotional","N",,,"Y","None",,,,
550535066,"Large Kraft Java Jacket High Lines","",,,,,"Promote your business to clients every time they reach for their favorite beverage! Made from recycled materials, these Java Jackets are designed to fit 12 - 20 oz paper cups and offer 2 imprint colors. Add your company name or logo to these insulated beverage wraps and keep them in stock at your cafe', concession stand or college bookstore. What better way to build brand awareness than with a promotional product brimming with possibilities!Large Java Jacket also fits: 12 oz. Eco solid cup, 20-24 oz. Insulated paper cups, and 16-20 oz. foam cups",,,,"Holders-Beverage Container-Wrap Around",,"Kraft","Other","","","",,,"CHINA",,,,,,,"",,"Paper Proof (1st paper proof $0 - $10 for each additional proof)","Black, Brown, Gold Metallic, Green, Hunter Green, Light Blue, Maroon, Medium Blue, Navy blue, Orange, Pink, Process Blue, Pruple, Red, Reflex Blue, Rhodamine Red, Rubine Red, Silver Metallic, Violet, Warm Red, White, Yellow","","Y","3.5"" x 2""","",,,"Y",,"5","","",,"","","","",,"","N","",,,,,,"Large White Java Jacket",,,"10000","25000","50000","75000","100000","250000",,,,,"0.243","0.231","0.219","0.191","0.177","0.164",,,,,"R","R","R","R","R","R",,,,,,"one color imprint",,"USD",,"List","Paper Proof (1st paper proof $0 - $10 for each additional proof)","ARTW:Paper Proof (1st paper proof $0 - $10 for each additional proof)",,"Artwork Charge","Other","Optional","1",,,,,,,,,,"50.00",,,,,,,,,,"Z",,,,,,,,,,"Die/Screen Charge",,,,,,,,,,,,,,"N",,,,,,"Promotional","N",,,"Y","None",,,,
551074967,"Java One Condiment Pack Pkg Of 250","",,,,,"Java One Condiment Pack Pkg Of 250 - Java One Imprinted Bag Containing 2 Sugars 1 Creamer 1 Sugar Substitute And 1 Stir Stick",,,,"COFFEE",,"","","","","",,,"CHINA",,,,,,,"Unimprinted",,"","","Y","","","",,,"Y",,"","","",,"","","","",,"We provide free shipping to all ASI members with in the 48 contiguous states with no minimum purchase required.","N","",,,,,,"",,,"500",,,,,,,,,,"0.41",,,,,,,,,,"R",,,,,,,,,,,"N/A",,"USD",,"List",,,,,,,,,,,,,,,,,,,,,,,,,,,,,,,,,,,,,,,,,,,,,,,,,,,"N",,,,,,"Promotional","N",,,"Y","None",,,,
4867546,"Java Desk Mug","",,,,,"Twist-off plastic lid with thumb slide closure. Double-wall construction using stainless steel with plastic liner. Large plastic handle with comfortable thumb rest. 14oz.",,,,"Mugs & Steins-Insulated,TRAVEL MUGS/CUPS",,"Silver (SL)","Stainless Steel","Dimension","Length:4.5:in","",,,"CHINA",,,,,,,"Drinkware, UNIMPRINTED",,"","","Y","Y","1""H x 2""L","",,,"Y",,"5","Y","",,"POLY BAG, Gift Boxes, Individual Polybag","24:per Case","18.11:in;16.93:in;12.2:in","22.54:lbs",,"Standard Master Carton Depth: 11.81","N","",,,,,,"IMPRINTED",,,"96","150","300","450","600",,,,,,"7.53","7.23","6.93","6.63","5.98",,,,,,"R","R","R","R","R",,,,,,,"Blank Product Only",,"USD",,"List","Drinkware, UNIMPRINTED","IMMD:Drinkware, UNIMPRINTED",,"Set-up Charge","Per Order","Required","1",,,,,,,,,,"95.00",,,,,,,,,,"Z",,,,,,,,,,"",,,,,,,,,,,,,,"N",,,,,,"Promotional","N",,,"Y","None",,,,
3475714,"20 oz acrylic/stainless steel java mug","",,,,,"This 20 oz. double-walled stainless steel mug features beautifully crafted high gloss acrylic with a brushed stainless steel inner liner.  Features snap-on lid with drink-through opening, large grip handle, and rubber coaster bottom.  Item size: 5"" x 4"".",,,,"TRAVEL MUGS/CUPS",,"Translucent Green,Translucent Blue,Translucent Smoke,Translucent Orange","Stainless Steel","Volume/Weight","20:oz","",,,"CHINA",,,,,,,"Pad Print, Unimprinted",,"","","Y","","2""","",,,"Y",,"7","Y","",,"Individually gift boxed.","","","24/ctn., 22:lbs",,".","N","",,,,,,"20 oz acrylic/stainless steel java mug",,,"48","144","288","576","1008",,,,,,"11.15","10.55","10.39","10.25","9.80",,,,,,"R","R","R","R","R",,,,,,,"one color one location imprint",,"USD",,"List","Pad Print, Unimprinted (Sold Unimprinted)","IMMD:Pad Print, Unimprinted (Sold Unimprinted)",,"Set-up Charge","Other","Required","1",,,,,,,,,,"40.00",,,,,,,,,,"Z",,,,,,,,,,"Imprint charge",,,,,,,,,,,,,,"N",,,,,,"Promotional","N",,,"Y","None",,,,
6776203,"20 Oz Java Vacuum Tumbler","",,,,,"Made with FDA compliant materials and 18-8 Stainless Steel and copper lined. The tumbler has dual wall vacuum insulation for optimum heat retention. Featuring our patented designed lid that has lip and finger grooves that allow you to position the drinking spout without even looking. The tumbler also includes a leak proof screw on lid with a visual open/close push button locking closure that can come apart for easy cleaning. Also features a Silicone non-slip band. 9 3/8"" h x 3 1/4"" w x 3 1/4"" d",,,,"TRAVEL MUGS/CUPS",,"Blue,Green,Red,Stainless","Stainless Steel","Volume/Weight","20:oz,(none):oz","",,,"CHINA",,,,,,,"Laser Engraving, Pad Print, TruColor (TM) Digital, Unimprinted",,"","Black, Blaze Orange, Dark Green, Gold, Gray, Light Green, Maroon, Navy blue, Orange, Process Blue, Red, Reflex Blue, Silver, Teal, Violet, White, Yellow","Y","Y","1 1/4"" h x 2 1/4"" w, 1 1/4"" h x 2"" w, 3 sq. in.","Laser Engraving (H x W), Pad Print (H x W), TruColor (TM)",,,"Y",,"5","Y","3:	",,"Drawstring Pouch","","","",,"","N","",,,,,,"20 Oz Java Vacuum Tumbler",,,"24","48","96","244",,,,,,,"14.39","14.39","14.39","14.39",,,,,,,"R","R","R","R",,,,,,,,"one standard color or laser engraving on one location.",,"USD",,"List","Pad Print, Laser Engraving, TruColor (TM) Digital, Unimprinted","IMMD:Pad Print, Laser Engraving, TruColor (TM) Digital, Unimprinted",,"Set-up Charge","Per Order","Required","1",,,,,,,,,,"55.00",,,,,,,,,,"Z",,,,,,,,,,"per mugYou may order less than the minimum quantity",,,,,,,,,,,,,,"N",,,,,,"Promotional","N",,,"Y","None",,,,
200324565,"MUG Java","",,,,,"15.5 oz, BPA free, double wall SAN plastic ring design mug. Clear outer and handle and colored inner. Black snap on thumb-slide splash resistant lid. Hand wash only. Do not microwave. Available in red, clear, blue, smoke, lime green and purple. One color, two location imprint included.",,,,"ENVIRONMENTALLY FRIENDLY PRODUCTS,Mugs & Steins-Insulated,Mugs & Steins-Plastic,Mugs & Steins-General,TRAVEL MUGS/CUPS",,"Clear,Red,Blue,Lime Green,Purple","SAN","Volume/Weight","15.5:oz","",,,"CHINA",,,,,,,"Silkscreen, Unimprinted",,"","123, 124, 165, 166, 208, 230, 2592, 268, 286 Blue, 289, 327, 343, 354 & 347, 357, 431, 476, 478, BLK, Brn 469, Bur 202, C.Gry 10, Copper 876, Crm 1345, Dk Bl 282, Dk Grn, Dk Teal 316, Gold 871, Grn 348, Gry 430, Or 021, Pink 205, Proc, Purple 259, RED 186, Reflex, Sand 7527, Silver 877, TEAL 320, WHT, Yell 116","Y","Y","2.6"" x 2.125"", 8.53"" x 2.125""","",,,"Y",,"5","Y","",,"plastic bagged, 48 pcs per ctn","48:per Case","26:in;18:in;13:in","21:lbs",,"144 pcs = 63 lbs","N","",,,,,,"MUG Java 15.5 oz.",,,"144","288","576","1008","2496",,,,,,"6.25","6.00","5.90","5.65","5.50",,,,,,"R","R","R","R","R",,,,,,,"one standard color imprint on each side or wrap imprint",,"USD",,"List","Silkscreen, Unimprinted (Sold Unimprinted)","IMMD:Silkscreen, Unimprinted (Sold Unimprinted)",,"Set-up Charge","Other","Required","1",,,,,,,,,,"50.00",,,,,,,,,,"Z",,,,,,,,,,"Set Up Charge",,,,,,,,,,,,,,"N",,,,,,"Promotional","N",,,"Y","None",,,,
5637964,"Java Recycled Burlap Hippie Bag","",,,,,"Recycled burlap hippie bag with full gusset construction, natural canvas lining and wide jute webbing shoulder strap 32"" long. Recycled burlap coffee bag. Reversible design. Made in the USA.",,,,"Bags-General,ENVIRONMENTALLY FRIENDLY PRODUCTS",,"Light Brown","Burlap","Dimension","Length:11:in;Width:3:in;Height:13.5:in","",,,"CHINA",,,,,,,"Screen printed, Unimprinted",,"PreProduction Proof, Virtual Proof","","Y","","8"" x 8""","",,,"Y",,"15","","",,"","30:per Carton","20:in;14:in;14  (none):in","25:lbs",,"","N","",,,,,,"Java Recycled Burlap Hippie Bag",,,"50","100","250","500","1000",,,,,,"33.04","27.40","24.945","21.867","21.233",,,,,,"R","R","R","R","R",,,,,,,"one color screen print.",,"USD",,"List","Screen printed, Unimprinted","IMMD:Screen printed, Unimprinted",,"Set-up Charge","Per Order","Required","",,,,,,,,,,"QUR",,,,,,,,,,"Z",,,,,,,,,,"",,,,,,,,,,,,,,"N",,,,,,"Promotional","N",,,"Y","None",,,,
5637964,,,,,,,,,,,,,,,,,,,,,,,,,,,,,,,,,,,,,,,,,,,,,,,,,,,,,,,,,,,,,,,,,,,,,,,,,,,,,,,,,,,,,,,,,,,,,,,"PreProduction Proof, Virtual Proof","ARTW:PreProduction Proof, Virtual Proof",,"Artwork Charge","Other","Optional","",,,,,,,,,,"QUR",,,,,,,,,,"Z",,,,,,,,,,"",,,,,,,,,,,,,,,,,,,,,,,,,,,,,
550028182,"Java","",,,,,"15 oz. Java ceramic coffee mug. 5 3/4""W x 4 3/8""H x 3 7/8""D.",,,,"Mugs & Steins-Ceramic",,"","Ceramic","Volume/Weight","15:oz","",,,"CHINA",,,,,,,"Silkscreen, Unimprinted",,"Art Services, Paper Proof, Pre-production Proof, Virtual Proof","Black, BLUE, Gold, Green, Red, Reflex Blue, Silver, White, Yellow","Y","Y","2 3/4""W x 1 3/4""H x 8""","Wrap",,,"Y",,"5,7","Y","3:,4:	",,"","36:per Case","","47:lbs",,"All ceramic drinkware and glassware requires additional packaging to protect against breakage from parcel carriers, therefore an additional packaging charge per shipping carton applies.","N","",,,,,,"White",,,"72","144","288","576",,,,,,,"5.83","5.32","4.97","4.74",,,,,,,"R","R","R","R",,,,,,,,"N/A",,"USD",,"List","Silkscreen, Unimprinted (Sold Unimprinted)","IMMD:Silkscreen, Unimprinted (Sold Unimprinted)",,"Set-up Charge","Per Order","Required","1",,,,,,,,,,"50.00",,,,,,,,,,"Z",,,,,,,,,,"",,,,,,,,,,,,,,"N",,,,,,"Promotional","N",,,"Y","None",,,,
550028182,,,,,,,,,,,,,,,,,,,,,,,,,,,,,,,,,,,,,,,,,,,,,,,,,,,,,,,,,,,,,,,,,,,,,,,,,,,,,,,,,,,,,,,,,,,,,,,"Product Sample","SMPL:Product Sample",,"Sample Charge","Other","Optional","1",,,,,,,,,,"50.00",,,,,,,,,,"Z",,,,,,,,,,"Setup, plus the cost of item.You may order less than the minimum quantity",,,,,,,,,,,,,,,,,,,,,,,,,,,,,
550028182,,,,,,,,,,,,,,,,,,,,,,,,,,,,,,,,,,,,,,,,,,,,,,,,,,,,,,,,,,,,,,,,,,,,,,,,,,,,,,,,,,,,,,,,,,,,,,,"Art Services, Paper Proof, Pre-production Proof, Virtual Proof","ARTW:Art Services, Paper Proof, Pre-production Proof, Virtual Proof",,"Artwork Charge","Other","Optional","1",,,,,,,,,,"43.75",,,,,,,,,,"Z",,,,,,,,,,"",,,,,,,,,,,,,,,,,,,,,,,,,,,,,
550028182,,,,,,,,,,,,,,,,,,,,,,,,,,,,,,,,,,,,,,,,,,,,,,,,,,,,,,,,,,,,,,,,,,,,,,,,,,,,,,,,,,,,,,,,,,,,,,,"3 business days,4 business days","RUSH:3,4",,"Rush Service Charge","Other","Required","1",,,,,,,,,,"50.00",,,,,,,,,,"Z",,,,,,,,,,"",,,,,,,,,,,,,,,,,,,,,,,,,,,,,
550304289,"CHESHIRE (B,H,W,T) KIT-JAVA","",,,,,"CHESHIRE (B,H,W,T) KIT. Machine Wash Warm, Tumble Dry. Weight: Bath 1 lb., Hand .40 lbs., Wash Cloth .12 lbs., Fingertip, .18 lbs. Length: Bath 27"" , Hand 16"" , Wash Cloth 13"", Fingertip 12"" Width: Bath  50"", Hand 30"", Wash 13"", Fingertip 18"" Height .25"".",,,,"Towels-Bath,Towels-Hand,Towels-Kitchen,Towels-General,WASHCLOTHS",,"","Cotton","Dimension","Length:27:in;Width:50:in;Height:.25:in,Length:16:in;Width:30:in;Height:.25:in,Length:13:in;Width:13:in;Height:.25:in,Length:12:in;Width:18:in;Height:.25:in","",,,"CHINA",,,,,,,"Embroidered, Unimprinted",,"Art Services, Paper Proof, Pre-production Proof, Virtual Proof","","","","","",,,"Y",,"10","","",,"Poly Bag","","15:in;15:in;4:in","2:lbs",,"","N","",,,,,,"CHESHIRE (B,H,W,T) KIT",,,"1",,,,,,,,,,"59.00",,,,,,,,,,"R",,,,,,,,,,,"N/A",,"USD",,"List",,,,,,,,,,,,,,,,,,,,,,,,,,,,,,,,,,,,,,,,,,,,,,,,,,,"N",,,,,,"Promotional","N",,,"Y","None",,,,
550304274,"BLOCKS (B,H,W,T) KIT-JAVA","",,,,,"BLOCKS (B,H,W,T) KIT. Machine Wash Warm, Tumble Dry. Weight: Bath 1 lb., Hand .40 lbs., Wash Cloth .12 lbs., Fingertip, .18 lbs. Length: Bath 27"" , Hand 16"" , Wash Cloth 13"", Fingertip 12"" Width: Bath  50"", Hand 30"", Wash 13"", Fingertip 18"" Height .25"".",,,,"Towels-Bath,Towels-Hand,WASHCLOTHS",,"Java","Cotton","Dimension","Length:27:in;Width:50:in;Height:.25:in,Length:16:in;Width:30:in;Height:.25:in,Length:13:in;Width:13:in;Height:.25:in,Length:12:in;Width:18:in;Height:.25:in","",,,"CHINA",,,,,,,"Embroidered, Unimprinted",,"Art Services, Paper Proof, Pre-production Proof, Virtual Proof","","","","","",,,"Y",,"10","","",,"Poly Bag","","15:in;15:in;4:in","2:lbs",,"","N","",,,,,,"BLOCKS (B,H,W,T) KIT",,,"1",,,,,,,,,,"59.00",,,,,,,,,,"R",,,,,,,,,,,"N/A",,"USD",,"List",,,,,,,,,,,,,,,,,,,,,,,,,,,,,,,,,,,,,,,,,,,,,,,,,,,"N",,,,,,"Promotional","N",,,"Y","None",,,,
550304277,"BRADFORD (B,H,W,T) KIT-JAVA","",,,,,"BRADFORD (B,H,W,T) KIT. Machine Wash Warm, Tumble Dry. Weight: Bath 1 lb., Hand .40 lbs., Wash Cloth .12 lbs., Fingertip, .18 lbs. Length: Bath 27"" , Hand 16"" , Wash Cloth 13"", Fingertip 12"" Width: Bath  50"", Hand 30"", Wash 13"", Fingertip 18"" Height .25"".",,,,"Towels-Bath,Towels-Hand,Towels-Kitchen,Towels-General,WASHCLOTHS",,"","Cotton","Dimension","Length:27:in;Width:50:in;Height:.25:in,Length:16:in;Width:30:in;Height:.25:in,Length:13:in;Width:13:in;Height:.25:in,Length:12:in;Width:18:in;Height:.25:in","",,,"CHINA",,,,,,,"Embroidered, Unimprinted",,"Art Services, Paper Proof, Pre-production Proof, Virtual Proof","","","","","",,,"Y",,"10","","",,"Poly Bag","","15:in;15:in;4:in","2:lbs",,"","N","",,,,,,"BRADFORD (B,H,W,T) KIT",,,"1",,,,,,,,,,"59.00",,,,,,,,,,"R",,,,,,,,,,,"N/A",,"USD",,"List",,,,,,,,,,,,,,,,,,,,,,,,,,,,,,,,,,,,,,,,,,,,,,,,,,,"N",,,,,,"Promotional","N",,,"Y","None",,,,
550304333,"GREENWOOD (B,H,W,T) KIT-JAVA","",,,,,"GREENWOOD (B,H,W,T) KIT. Machine Wash Warm, Tumble Dry. Weight: Bath 1 lb., Hand .40 lbs., Wash Cloth .12 lbs., Fingertip, .18 lbs. Length: Bath 27"" , Hand 16"" , Wash Cloth 13"", Fingertip 12"" Width: Bath  50"", Hand 30"", Wash 13"", Fingertip 18"" Height .25"".",,,,"Towels-Bath,Towels-Hand,WASHCLOTHS",,"","Cotton","Dimension","Length:27:in;Width:50:in;Height:.25:in,Length:16:in;Width:30:in;Height:.25:in,Length:13:in;Width:13:in;Height:.25:in,Length:12:in;Width:18:in;Height:.25:in","",,,"CHINA",,,,,,,"Embroidered, Unimprinted",,"Art Services, Paper Proof, Pre-production Proof, Virtual Proof","","","","","",,,"Y",,"10","","",,"Poly Bag","","15:in;15:in;4:in","2:lbs",,"","N","",,,,,,"GREENWOOD (B,H,W,T) KIT",,,"1",,,,,,,,,,"59.00",,,,,,,,,,"R",,,,,,,,,,,"N/A",,"USD",,"List",,,,,,,,,,,,,,,,,,,,,,,,,,,,,,,,,,,,,,,,,,,,,,,,,,,"N",,,,,,"Promotional","N",,,"Y","None",,,,
5532926,"Java (TM) Sleeve","",,,,,"Introducing our cup sleeve. It's designed to easily slide onto a variety of paper or plastic coffee cups and to protect hands from hot liquids. Perfect for safely enjoying fresh cups of coffee and tea. When not in use, it folds flat for convenient portability and storage. This folding cup sleeve is ideal for promoting coffee shops, beverage companies, and restaurants. Available in 5 solid colors!  Up to 4 assorted colors available at no additional charge.",,,,"Holders-Beverage Container-Sleeve Type",,"Blue,Red,Dark Green,Coffee","","Dimension","Length:3:in;Width:4 5/8:in;Height:5/16:in","",,,"CHINA",,,,,,,"Screen Print, Unimprinted, Vibrant Full Color Heat Transfer",,"Pre-production Proof (Ground freight included), Virtual Proof","Black, Brown, Burgundy, Dark Blue, Dark Green, Gold, Gray, Green, Ivory, Neon Pink, Orange, Pink, Process Blue, Purple, Red, Reflex Blue, Royal Blue, Silver, Teal, White, Yellow","Y","Y","1 3/4""H x 3""W -  Screen Print -1-color imprint only per position, min. 15 pt type No halftones or small details","back, front (front or back, 1-color imprint only per position. Min. 15 pt type. No halftones or small details)",,,"Y",,"5,7","","",,"","650:per Carton","18:in;18:in;15:in","12.72:lbs",,"","N","",,,,,,"Java (TM) Sleeve",,,"250","500","1000","2500","5000",,,,,,"1.01","0.96","0.93","0.91","0.89",,,,,,"R","R","R","R","R",,,,,,,"1-color/1-position imprint",,"USD",,"List","Screen Print, Vibrant Full Color Heat Transfer, Unimprinted","IMMD:Screen Print, Vibrant Full Color Heat Transfer, Unimprinted",,"Set-up Charge","Per Order","Required","1",,,,,,,,,,"55.00",,,,,,,,,,"Z",,,,,,,,,,"",,,,,,,,,,,,,,"N",,,,,,"Promotional","N",,,"Y","None",,,,
5532926,,,,,,,,,,,,,,,,,,,,,,,,,,,,,,,,,,,,,,,,,,,,,,,,,,,,,,,,,,,,,,,,,,,,,,,,,,,,,,,,,,,,,,,,,,,,,,,"Product Sample","SMPL:Product Sample",,"Sample Charge","Other","Optional","1",,,,,,,,,,"65.00",,,,,,,,,,"Z",,,,,,,,,,"",,,,,,,,,,,,,,,,,,,,,,,,,,,,,
