551075188,"Java Tr Decaf 4-Cup Coffee Case Of 120","",,,,,"100 Colombian Pure Roast Decaffeinated Coffee Case Of 120 - Made From Top Grade Arabica Beans From The Peaks Of The Andes - Rich Nutty Flavor And Lingering Sweetness - Individually Wrapped 4-Cup Filter Pouch",,,,"Tools-Kitchen-Coffee Makers",,"","","","","",,,"CHINA",,,,,,,"Unimprinted",,"","","Y","","","",,,"Y",,"","","",,"","","","",,"We provide free shipping to all ASI members with in the 48 contiguous states with no minimum purchase required.","N","",,,,,,"",,,"120",,,,,,,,,,"1.443",,,,,,,,,,"R",,,,,,,,,,,"N/A",,"USD",,"List",,,,,,,,,,,,,,,,,,,,,,,,,,,,,,,,,,,,,,,,,,,,,,,,,,,"N",,,,,,"Promotional","N",,,"Y","None",,,,
551197921,"Ceramic Java Coffee Mug","",,,,,"Create something eye-catching, promotional and practical with the stylish look and cool colors of this product.This 12 oz. mug features a tapered design with a smooth rim, a glossy finish and a comfortable grip. Whether you're preparing for your next tradeshow appearance or want to put your brand in the hands of clients and colleagues, this mug is here for your total branding needs.",,,,"Mugs & Steins-Ceramic,TEA OR COFFEE SETS",,"Assorted","Colour Ceramic Glaze","Volume/Weight","12:oz","",,,"CHINA",,,,,,,"Decal, Silkscreen, Unimprinted",,"Art Services, Paper Proof, Pre-production Proof, Virtual Proof","one color","Y","","1 9/10""*1 1/5""","",,,"Y",,"60","","",,"Case","36:per Carton","","14:kg",,"","N","",,,,,,"",,,"5000","10000","15000","20000","25000",,,,,,"1.954","1.91","1.854","1.794","1.751",,,,,,"R","R","R","R","R",,,,,,,"N/A",,"USD",,"List","Silkscreen, Unimprinted, Decal","IMMD:Silkscreen, Unimprinted, Decal",,"Imprint Method Charge","Other","Required","1",,,,,,,,,,"28.571",,,,,,,,,,"Z",,,,,,,,,,"",,,,,,,,,,,,,,"N",,,,,,"Promotional","N",,,"Y","None",,,,
550603298,"Javalina Chrome Stylus Pens - NEW!","",,,,,"Brush Silver barrel with metallic jewel-tone trim. Features a handy stylus tip.Ultra Smooth Writing Cartridge.  Having a grand opening, or any other special occasion?  This Pen is the perfect gift for anyone.    Ships with Blue Ink Cartridge.  Black ink cartridges available upon request.",,,,"Pens-Ballpoint-Stylus",,"Emerald Green,Garnet Red,Indigo Blue,Burnt Orange,Black","PVC","","","",,,"CHINA",,,,,,,"Hot Stamped, Silkscreen, Unimprinted",,"Virtual Proof (The first proof is Free.), Pre-production Proof (Please call for pricing)","Any Standard Contrasting Color","Y","","1 1/4"" x 3/4""","",,,"Y",,"5","Y","1:	",,"Bulk","","","",,"","N","",,,,,,"Javalina Chrome Stylus Pens",,,"250","500","1000","5000",,,,,,,"0.67","0.65","0.64","0.63",,,,,,,"R","R","R","R",,,,,,,,"N/A",,"USD",,"List","Product Sample","SMPL:Product Sample",,"Sample Charge","Other","Optional","1",,,,,,,,,,"15.00",,,,,,,,,,"Z",,,,,,,,,,"",,,,,,,,,,,,,,"N",,,,,,"Promotional","N",,,"Y","None",,,,
4973314,"Mug","",,,,,"Serve up a hot mug of promotional success and put your brand directly in the hands of those who matter most with this Java two tone ceramic mug. This 11.5 oz. mug features a stylish tapered design with a glossy finish and a comfortable matching grip. Choose from many vibrant trim colors and add your brand to create the perfect companion for your favorite coffee or tea. This is perfect for home, work, events, holiday gifts and beyond!",,,,"Mugs & Steins-Ceramic",,"Lavender,Pink,Yellow,Blue,Green,Orange","Ceramic","Dimension","Length:4.75:in;Width:4.25:in","",,,"CHINA",,,,,,,"Decal, Pad Print, Silkscreen",,"","","","","2.5""W x 2.5""H","",,,"Y",,"10","Y","",,"","","","",,"","N","",,,,,,"Mug",,,"36","72","144","288","576","1008","2016",,,,"3.12","2.52","2.19","2.09","2.08","2.06","2.04",,,,"R","R","R","R","R","R","R",,,,,"N/A",,"USD",,"List","Silkscreen, Pad Print, Decal","IMMD:Silkscreen, Pad Print, Decal",,"Imprint Method Charge","Other","Required","1",,,,,,,,,,"49.00",,,,,,,,,,"Z",,,,,,,,,,"per location for most 2 color or more imprints",,,,,,,,,,,,,,"N",,,,,,"Promotional","N",,,"Y","None",,,,
5109072,"Latte mug","",,,,,"Put your brand in their hands at coffee break and beyond with the stylish look of a latte mug. This 16 oz. Prop 65 compliant ceramic mug features the sleek, polished look of a cobalt blue finish, a tall design and a spot color imprint in your choice of colors. And, since this advertising solution is great for everyday use at the office and at home, your advertising message has more opportunities to be seen by those who matter most, your valuable customers, clients and workforce. Make sure that your brand gets invited to coffee break, order now!",,,,"Mugs & Steins-Ceramic",,"Cobalt Blue","Ceramic","Volume/Weight","16:oz","",,,"CHINA",,,,,,,"Spot Color",,"","Black, Brown, Chocolate Brown, Dark Red, Deep Ruby, Forest Green, Grass Green, Green Blue, Light Yellow, Navy, Orange, Purple, Red, Red Pagoda, Royal Blue, Satin Etch, Spruce Blue, Sunlight, Turquoise, White","","Y","2.625"" x 3""","",,,"Y",,"10","","",,"","","","Master Pack/ Dimensions/ Weight: 24 ct./19"" x 13"" x 17""/36:lbs",,".","N","",,,,,,"Latte mug",,,"72","144","288","576","1008",,,,,,"5.41","4.89","4.38","4.10","3.85",,,,,,"R","R","R","R","R",,,,,,,"one color imprint on one or two sides",,"USD",,"List","Spot Color","IMMD:Spot Color",,"Imprint Method Charge","Other","Required","1",,,,,,,,,,"45.00",,,,,,,,,,"Z",,,,,,,,,,"Imprint charge",,,,,,,,,,,,,,"N",,,,,,"Promotional","N",,,"Y","None",,,,
5109071,"Latte mug","",,,,,"Make an impression every time they make a latte with this 16 oz. ceramic tall latte mug. Each 16 oz. Prop 65 compliant ceramic mug features the sleek, polished look of a black finish, a tall design and a spot color imprint in your choice of colors. And, since this advertising solution is great for everyday use at the office and at home, your brand has more opportunities to be seen by those who matter most, your valuable customers, clients and workforce. Make sure that your brand gets invited to coffee break, order now!",,,,"Mugs & Steins-Ceramic",,"Black","Ceramic","Volume/Weight","16:oz","",,,"CHINA",,,,,,,"Spot Color",,"","Black, Brown, Chocolate Brown, Dark Red, Deep Ruby, Forest Green, Grass Green, Green Blue, Light Yellow, Navy, Orange, Purple, Red, Red Pagoda, Royal Blue, Satin Etch, Spruce Blue, Sunlight, Turquoise, White","","Y","2.625"" x 3""","",,,"Y",,"10","","",,"","","","Master Pack/ Dimensions/ Weight: 24 ct./19"" x 13"" x 17""/36:lbs",,".","N","",,,,,,"Latte mug",,,"72","144","288","576","1008",,,,,,"4.53","3.98","3.61","3.35","3.14",,,,,,"R","R","R","R","R",,,,,,,"one color imprint on one or two sides",,"USD",,"List","Spot Color","IMMD:Spot Color",,"Imprint Method Charge","Other","Required","1",,,,,,,,,,"45.00",,,,,,,,,,"Z",,,,,,,,,,"Imprint charge",,,,,,,,,,,,,,"N",,,,,,"Promotional","N",,,"Y","None",,,,
550613349,"33 oz Stainless Steel Vacuum Coffee Carafe","",,,,,"Your next campaign will be pouring with success thanks to this 33 oz. stainless steel vacuum coffee carafe. Measuring 8.5""H with a 2.4"" base, this eye-catching product will make an essential addition to any coffeehouse, bistro, cafe or restaurant and will have you serving up piping-hot java in style. It features a black plastic lid and a black handle, and it can be customized with a silkscreen imprint of your company name, logo and more to increase brand exposure.",,,,"COFFEE POTS",,"Silver","Stainless Steel-Plastic","Volume/Weight","33:oz","",,,"CHINA",,,,,,,"Silkscreen, Unimprinted",,"","Black, BLUE, Brown, Cool Gray, Green, Maroon, Matte Gold, Matte Silver, Orange, Peach, Pink, Process Blue, Purple, Red, Reflex Blue, Tan, Teal, Warm Gray, White, Yellow","Y","","2.50"" W x 2.50"" H","1 to 2 colors",,,"Y",,"10","Y","2:,3:	",,"","6:per Box","","13.23:lbs",,"","N","",,,,,,"10 Days",,,"12","25","50","100","250","500","1000","2500",,,"22.50","20.00","19.00","18.00","17.00","16.00","15.00","14.50",,,"R","R","R","R","R","R","R","R",,,,"one color imprint only",,"USD",,"List","Unimprinted, Silkscreen","IMMD:Unimprinted, Silkscreen",,"Set-up Charge","Per Order","Required","1",,,,,,,,,,"25.00",,,,,,,,,,"Z",,,,,,,,,,"",,,,,,,,,,,,,,"N",,,,,,"Promotional","N",,,"Y","None",,,,
550613349,,,,,,,,,,,,,,,,,,,,,,,,,,,,,,,,,,,,,,,,,,,,,,,,,,,,,,,,,,,,,,,,,,,,,,,,,,,,,,,,,,,,,,,,,,,,,,,"Product Sample","SMPL:Product Sample",,"Sample Charge","Other","Optional","1",,,,,,,,,,"50.00",,,,,,,,,,"Z",,,,,,,,,,"per color",,,,,,,,,,,,,,,,,,,,,,,,,,,,,
4783842,"To Go Coffee Cup Stress reliever","",,,,,"Brew up a successful promotion using this to go coffee cup stress reliever! Measuring 3 3/4"" x 2 1/2"" in size, this stress reliever makes a fun gift or giveaway for coffee shops, cafes or restaurant grand openings. It features a tan java jacket that displays your company logo in the center. This item is safety tested and intended for adults or for general use by consumers. Our products are not intended for children under three years old or for pets. Put your sales in motion today!",,,,"Stress Relievers-General",,"","","Dimension","Length:3 3/4:in;Width:2 1/2:in","Coffee Cup",,,"CHINA",,,,,,,"Pad Print, Unimprinted",,"Art Services (Recreating Artwork), Pre-production Proof, Virtual Proof (Virtual/Mock-up Proof), Digital proof (Digital Proof), Artwork Proof, Artwork Edits","Black, BLUE, Brown, Burgundy, Cool Gray, Dark Green, Light Brown, Light Green, Metallic Gold, Metallic Silver, Navy, Orange, Pink, Process Blue, Purple, Red, Reflex Blue, Royal Blue, Teal, Violet, White, Yellow, Yellow Gold","Y","Y","1 1/4"" x 3/4"", 1"" dia","",,,"Y",,"5","Y","1:,3:	",,"","250:per Other (s)","24:in;15:in;14:in","31:lbs",,"Shipping is UPS, FedEx, or truck line by request. USPS is available for APO addresses only.","N","",,,,,,"To Go Coffee Cup Stress reliever",,,"150","250","500","1000","2500",,,,,,"2.54","2.44","2.34","2.25","2.17",,,,,,"R","R","R","R","R",,,,,,,"One color imprint.",,"USD",,"List","Pad Print, Unimprinted","IMMD:Pad Print, Unimprinted",,"Set-up Charge","Per Order","Required","1",,,,,,,,,,"20.00",,,,,,,,,,"Z",,,,,,,,,,"Per color/imprint after first imprint.You may order less than the minimum quantity",,,,,,,,,,,,,,"N",,,,,,"Promotional","N",,,"Y","None",,,,
4783842,,,,,,,,,,,,,,,,,,,,,,,,,,,,,,,,,,,,,,,,,,,,,,,,,,,,,,,,,,,,,,,,,,,,,,,,,,,,,,,,,,,,,,,,,,,,,,,"Art Services (Recreating Artwork), Pre-production Proof, Virtual Proof (Virtual/Mock-up Proof), Digital proof (Digital Proof), Artwork Proof, Artwork Edits","ARTW:Art Services (Recreating Artwork), Pre-production Proof, Virtual Proof (Virtual/Mock-up Proof), Digital proof (Digital Proof), Artwork Proof, Artwork Edits",,"Artwork Charge","Other","Optional","1",,,,,,,,,,"50.00",,,,,,,,,,"Z",,,,,,,,,,"Artwork edits, one edit to artwork provided at no charge, per additional edit.You may order less than the minimum quantity",,,,,,,,,,,,,,,,,,,,,,,,,,,,,
4783842,,,,,,,,,,,,,,,,,,,,,,,,,,,,,,,,,,,,,,,,,,,,,,,,,,,,,,,,,,,,,,,,,,,,,,,,,,,,,,,,,,,,,,,,,,,,,,,"1 business days,3 business days","RUSH:1,3",,"Rush Service Charge","Other","Required","1",,,,,,,,,,"0.40",,,,,,,,,,"Z",,,,,,,,,,"Per imprint.Note different rushes on Non-stock items. Please Contact Customer Service for details.You may order less than the minimum quantity",,,,,,,,,,,,,,,,,,,,,,,,,,,,,
4869586,"Latte mug","",,,,,"Go with the style and simplicity of this trendy all-white 16 oz. latte mug. Prop. 65 compliant ceramic materials and a stylish, tall mug design come together in this effective promotional solution. Enjoy everyday exposure with a look and feel that they'll be glad to make a part of their everyday caffeination routine. Apply your brand in spot color imprinting to complete the promotional look. Add to your coffee shop or restaurant's branded drinkware or make it a corporate promotional gift, no matter how you put this mug to use, it's sure to please! These are also available in black or cobalt.",,,,"Mugs & Steins-Ceramic",,"White","Ceramic","Volume/Weight","16:oz","",,,"CHINA",,,,,,,"Spot Color",,"","Black, Brown, Chocolate Brown, Dark Red, Deep Ruby, Forest Green, Grass Green, Green Blue, Light Yellow, Navy, Orange, Purple, Red, Red Pagoda, Royal Blue, Satin Etch, Spruce Blue, Sunlight, Turquoise, White","","Y","2.625"" x 3""","",,,"Y",,"10","","",,"","","","Master Pack/ Dimensions/ Weight: 24 ct./19"" x 13"" x 17""/36:lbs",,".","N","",,,,,,"Latte mug",,,"72","144","288","576","1008",,,,,,"3.61","3.25","3.01","2.77","2.54",,,,,,"R","R","R","R","R",,,,,,,"one color imprint on one or two sides",,"USD",,"List","Spot Color","IMMD:Spot Color",,"Imprint Method Charge","Other","Required","1",,,,,,,,,,"45.00",,,,,,,,,,"Z",,,,,,,,,,"Imprint charge",,,,,,,,,,,,,,"N",,,,,,"Promotional","N",,,"Y","None",,,,
550852020,"8 oz. Double-Wall Paper Hot Cup","",,,,,"This 8 oz. double-wall paper hot cup acts just like a paper cup & cup sleeve combined. /// PRODUCTION NOTE: /// These cups come pre-printed with the following text printed vertically along the seam: ""Caution: Contents may be hot. Microwave not recommended""  This product will save space by eliminating the need to store separate Java Jackets or coffee clutches. The bright sturdy surface partnered with your design printed in 1 - 4 PMS ink colors is sure to capture the drinker's attention. Whether an indoor (coffee shop and restaurant) or outdoor (corporate event and picnic) promotion our Double Wall Paper Cup is an inexpensive and useful way to display your logo.",,,,"Cups-Paper",,"White","Paper","Volume/Weight","8:oz","",,,"CHINA",,,,,,,"Pad Print, Silkscreen",,"","","","","1 color - 2-1/2 x 2 -  Wrap = 6-11/16, Multi-color - 2 x 2-1/4 x 1-1/2","",,,"Y",,"6","Y","",,"Poly Bag","660:per Case","19:in;12:in;25:in","24:lbs",,"","N","",,,,,,"1 Color / 1 or 2 Sides",,,"100","250","500","1000","2500","5000",,,,,"1.18","0.74","0.59","0.50","0.48","0.41",,,,,"R","R","R","R","R","R",,,,,,"4-PMS Colors 1 side only",,"USD",,"List","Pad Print, Silkscreen","IMMD:Pad Print, Silkscreen",,"Set-up Charge","Other","Required","1",,,,,,,,,,"55.00",,,,,,,,,,"Z",,,,,,,,,,"1-Time Set-up Charge (does not apply to exact repeats)",,,,,,,,,,,,,,"N",,,,,,"Promotional","N",,,"Y","None",,,,
550852124,"16 oz. Double-Wall Paper Hot Cup","",,,,,"This 16 oz. double-wall paper hot cup acts just like a paper cup & cup sleeve combined. This product will save space by eliminating the need to store separate Java Jackets or coffee clutches. The bright sturdy surface partnered with your design printed in 1 - 4 PMS ink colors is sure to capture the drinker's attention. Whether an indoor (coffee shop and restaurant) or outdoor (corporate event and picnic) promotion our Double Wall Paper Cup is an inexpensive and useful way to display your logo.",,,,"Cups-Paper",,"White","Paper","Volume/Weight","16:oz","",,,"CHINA",,,,,,,"Pad Print, Silkscreen",,"","","","","1 color - 3 x 2 3/4, Wrap = 8 3/16, Multi-color - 2 1/4 x 2 3/4 x 1 5/8","",,,"Y",,"6","Y","",,"Poly Bag","540:per Case","23:in;19:in;20:in","33:lbs",,"","N","",,,,,,"1 Color / 1 or 2 Sides",,,"100","250","500","1000","2500","5000",,,,,"1.29","0.87","0.70","0.61","0.55","0.48",,,,,"R","R","R","R","R","R",,,,,,"4-PMS Colors 1 side only",,"USD",,"List","Pad Print, Silkscreen","IMMD:Pad Print, Silkscreen",,"Set-up Charge","Other","Required","1",,,,,,,,,,"55.00",,,,,,,,,,"Z",,,,,,,,,,"1-time , 1-Color Screen Charge (does not apply to exact repeats)",,,,,,,,,,,,,,"N",,,,,,"Promotional","N",,,"Y","None",,,,
550852066,"12 oz. Double-Wall Paper Hot Cup","",,,,,"This 12 oz. double-wall paper hot cup acts just like a paper cup & cup sleeve combined. This product will save space by eliminating the need to store separate Java Jackets or coffee clutches. The bright sturdy surface partnered with your design printed in 1 - 4 PMS ink colors is sure to capture the drinker's attention. Whether an indoor (coffee shop and restaurant) or outdoor (corporate event and picnic) promotion our Double Wall Paper Cup is an inexpensive and useful way to display your logo.",,,,"Cups-Paper",,"White","Paper","Volume/Weight","12:oz","",,,"CHINA",,,,,,,"Pad Print, Silkscreen",,"","","","","1 color - 3 x 2 1/2, Wrap = 8 1/4, Multi-color - 2 1/4 x 2 3/4 x 1 3/4","",,,"Y",,"6","Y","",,"Poly Bag","580:per Case","20:in;14:in;25:in","25:lbs",,"","N","",,,,,,"1 Color / 1 or 2 Sides",,,"100","250","500","1000","2500","5000",,,,,"1.24","0.82","0.65","0.57","0.51","0.45",,,,,"R","R","R","R","R","R",,,,,,"4-PMS Colors 1 side only",,"USD",,"List","Pad Print, Silkscreen","IMMD:Pad Print, Silkscreen",,"Set-up Charge","Other","Required","1",,,,,,,,,,"55.00",,,,,,,,,,"Z",,,,,,,,,,"1-time , 1-Color Screen Charge (does not apply to exact repeats)",,,,,,,,,,,,,,"N",,,,,,"Promotional","N",,,"Y","None",,,,
550665555,"Paper Coffee Sleeves","",,,,,"Made of recycled material-Kraft paper, these coffee sleeves are designed to fit 12 - 20 oz paper cups. Make your own insulated beverage wraps that add a touch of style to your business or event!",,,,"Holders-Beverage Container-Sleeve Type",,"Assorted","kraft paper","Dimension","Length:4 7/10:in;Width:2 2/5:in","",,,"CHINA",,,,,,,"Full Color, Silkscreen, Unimprinted",,"Virtual Proof","","Y","","","",,,"Y",,"15,20","","",,"Case","2500:per Carton","25:in;20:in;18:in","40:lbs",,"","N","",,,,,,"",,,"5000","10000","20000","30000","50000",,,,,,"0.23","0.20","0.16","0.13","0.12",,,,,,"R","R","R","R","R",,,,,,,"1-Color, 1-Location screen printing",,"USD",,"List","Silkscreen, Full Color, Unimprinted","IMMD:Silkscreen, Full Color, Unimprinted",,"Set-up Charge","Per Order","Required","1",,,,,,,,,,"50.00",,,,,,,,,,"Z",,,,,,,,,,"",,,,,,,,,,,,,,"N",,,,,,"Promotional","N",,,"Y","None",,,,
6119600,"Double Wall Stainless Steel Mug - 9 oz","",,,,,"9 oz. double-wall stainless steel mug. Great for camping, this stainless steel mug reaches its 9 oz. capacity when filled to the rim. Measures 2 3/4"" dia x 3 7/8"" h x 3 15/16"" w.",,,,"Mugs & Steins-Insulated,Mugs & Steins-Metal",,"Silver","Stainless Steel","Volume/Weight","9:oz","",,,"CHINA",,,,,,,"Laser Engrave, Screen Print, Unimprinted",,"","Athletic Gold, Black, Brown, Burgundy, Charcoal Gray, Cream, Dark Teal, Forest Green, Green, Lemon, Magenta, Maroon, Metallic Blue, Metallic Copper, Metallic Gold, Metallic Green, Metallic magenta, Metallic Silver, Navy blue, Orange, Pink, Process Blue, Purple, Red, Reflex Blue, Royal Blue, Teal, White","Y","","1""W x 2""H, 3""W x 2""H","Back (optional, add'l charge) Laser engraved, Front (optional) Laser engraved (W x H - Front (optional); Back (optional, additional charge)), Opposite handle (standard) 1 color max.",,,"Y",,"5","Y","1:	",,"Bulk","20:per Carton","","9:lbs",,"","N","",,,,,,"Double Wall Stainless Steel Mug - 9 oz",,,"48","72","144","288","576",,,,,,"7.24","6.58","6.06","5.90","5.61",,,,,,"R","R","R","R","R",,,,,,,"1-color imprint, 1 location",,"USD",,"List","Screen Print, Laser Engrave, Unimprinted","IMMD:Screen Print, Laser Engrave, Unimprinted",,"Set-up Charge","Per Order","Required","1",,,,,,,,,,"50.00",,,,,,,,,,"Z",,,,,,,,,,"per changeYou may order less than the minimum quantity",,,,,,,,,,,,,,"N",,,,,,"Promotional","N",,,"Y","None",,,,
6119600,,,,,,,,,,,,,,,,,,,,,,,,,,,,,,,,,,,,,,,,,,,,,,,,,,,,,,,,,,,,,,,,,,,,,,,,,,,,,,,,,,,,,,,,,,,,,,,"Product Sample","SMPL:Product Sample",,"Sample Charge","Other","Optional","1",,,,,,,,,,"50.00",,,,,,,,,,"Z",,,,,,,,,,"plus cost of productYou may order less than the minimum quantity",,,,,,,,,,,,,,,,,,,,,,,,,,,,,
6109491,"Stylish Cafe Mug - 16 oz","",,,,,"16 oz. stylish cafe mug! Features a glossy exterior with a white glossy interior, a large handle and a stylish base. It measures 3 3/4"" dia x 4 3/8"" h x 5 1/4"" w and it reaches its 16 oz. capacity when filled to the rim.",,,,"Mugs & Steins-Ceramic",,"Black,Blue,Burgundy,Orange,White","Ceramic","Volume/Weight","16:oz","",,,"CHINA",,,,,,,"Screen Print, Unimprinted",,"","Athletic Gold, Black, Brown, Burgundy, Charcoal Gray, Cream, Dark Teal, Forest Green, Green, Lemon, Magenta, Maroon, Metallic Blue, Metallic Copper, Metallic Gold, Metallic Green, Metallic magenta, Metallic Silver, Navy blue, Orange, Pink, Process Blue, Purple, Red, Reflex Blue, Royal Blue, Teal, White","Y","","2 1/2""W x 1 1/2""H, 8""w x 1 1/2""h","Back only (optional) 3 colors max, Front & Back (optional) 1 color max, Front only (standard) max 3 colors. (W x H - Front (Standard), 3 color(s) max; Back (Optional), 3 color(s) max; Front & Back (Optional), 1 color max), Wraparound (optional) max 1 color. (W x H - Wraparound (Optional), 1 color(s) max)",,,"Y",,"5","Y","1:	",,"","24:per Carton","","28:lbs",,"","N","",,,,,,"Stylish Cafe Mug - 16 oz",,,"72","144","288","576","1008",,,,,,"5.00","4.33","4.10","3.99","3.83",,,,,,"R","R","R","R","R",,,,,,,"1-color imprint, 1 location",,"USD",,"List","Screen Print, Unimprinted","IMMD:Screen Print, Unimprinted",,"Set-up Charge","Per Order","Required","1",,,,,,,,,,"50.00",,,,,,,,,,"Z",,,,,,,,,,"per colorYou may order less than the minimum quantity",,,,,,,,,,,,,,"N",,,,,,"Promotional","N",,,"Y","None",,,,
6109491,,,,,,,,,,,,,,,,,,,,,,,,,,,,,,,,,,,,,,,,,,,,,,,,,,,,,,,,,,,,,,,,,,,,,,,,,,,,,,,,,,,,,,,,,,,,,,,"Product Sample","SMPL:Product Sample",,"Sample Charge","Other","Optional","1",,,,,,,,,,"50.00",,,,,,,,,,"Z",,,,,,,,,,"plus cost of productYou may order less than the minimum quantity",,,,,,,,,,,,,,,,,,,,,,,,,,,,,
4783618,"Tea and Coffee Cup Stress Reliever","",,,,,"Your brand is sure to be everyone's cup of tea when you select this tea and coffee cup shape stress reliever. It can work with any business for any event! This is a fun and unique promotional item with your logo to give away at tradeshows. Safety tested and intended for adults or for general use by consumers of all ages. Our products are not intended for children under three years old or for pets. Relieve stress and have fun!",,,,"Stress Relievers-General",,"","","Dimension","Length:3 3/8:in;Width:2 1/8:in;Height:2 5/8:in","Cup",,,"CHINA",,,,,,,"Pad Print, Unimprinted",,"Art Services (Recreating Artwork), Pre-production Proof, Virtual Proof (Virtual/Mock-up Proof), Digital proof (Digital Proof), Artwork Proof, Artwork Edits","Black, BLUE, Brown, Burgundy, Cool Gray, Dark Green, Light Brown, Light Green, Metallic Gold, Metallic Silver, Navy, Orange, Pink, Process Blue, Purple, Red, Reflex Blue, Royal Blue, Teal, Violet, White, Yellow, Yellow Gold","Y","Y","1 1/4"" x 3/4""","",,,"Y",,"5","Y","1:,3:	",,"","250:per Other (s)","22:in;15:in;14:in","28:lbs",,"Shipping is UPS, FedEx, or truck line by request. USPS is available for APO addresses only.","N","",,,,,,"Tea and Coffee Cup Stress Reliever",,,"150","250","500","1000","2500",,,,,,"1.97","1.87","1.79","1.70","1.62",,,,,,"R","R","R","R","R",,,,,,,"One color imprint.",,"USD",,"List","Pad Print, Unimprinted","IMMD:Pad Print, Unimprinted",,"Set-up Charge","Per Order","Required","1",,,,,,,,,,"0.25",,,,,,,,,,"Z",,,,,,,,,,"Per color/logo/plate.You may order less than the minimum quantity",,,,,,,,,,,,,,"N",,,,,,"Promotional","N",,,"Y","None",,,,
4783618,,,,,,,,,,,,,,,,,,,,,,,,,,,,,,,,,,,,,,,,,,,,,,,,,,,,,,,,,,,,,,,,,,,,,,,,,,,,,,,,,,,,,,,,,,,,,,,"Art Services (Recreating Artwork), Pre-production Proof, Virtual Proof (Virtual/Mock-up Proof), Digital proof (Digital Proof), Artwork Proof, Artwork Edits","ARTW:Art Services (Recreating Artwork), Pre-production Proof, Virtual Proof (Virtual/Mock-up Proof), Digital proof (Digital Proof), Artwork Proof, Artwork Edits",,"Artwork Charge","Other","Optional","1",,,,,,,,,,"50.00",,,,,,,,,,"Z",,,,,,,,,,"Artwork edits, one edit to artwork provided at no charge, per additional edit.You may order less than the minimum quantity",,,,,,,,,,,,,,,,,,,,,,,,,,,,,
4783618,,,,,,,,,,,,,,,,,,,,,,,,,,,,,,,,,,,,,,,,,,,,,,,,,,,,,,,,,,,,,,,,,,,,,,,,,,,,,,,,,,,,,,,,,,,,,,,"1 business days,3 business days","RUSH:1,3",,"Rush Service Charge","Other","Required","1",,,,,,,,,,"0.40",,,,,,,,,,"Z",,,,,,,,,,"Per imprint.Note different rushes on Non-stock items. Please Contact Customer Service for details.You may order less than the minimum quantity",,,,,,,,,,,,,,,,,,,,,,,,,,,,,
5401668,"Dip Mug - 16 oz","",,,,,"16 oz. Dip Mug! This trendy, up to date colors are sure to make your next promotion a success. The unique dip feature of this mug will attract the attention your logo deserves. The mug is hand dipped and color lines could vary from piece to piece. Measuring 3 13/16"" dia x 4"" h x 5"" w, this mug has a 16 oz. capacity when filled to the rim.",,,,"Mugs & Steins-Ceramic,Mugs & Steins-Ironstone",,"Orange,Yellow,Purple,Pink,Lime Green","Ironstone Ceramic","Volume/Weight","16:oz","",,,"CHINA",,,,,,,"Screen Print, Unimprinted",,"","Athletic Gold, Black, Brown, Burgundy, Charcoal Gray, Cream, Dark Teal, Forest Green, Green, Lemon, Magenta, Maroon, Metallic Blue, Metallic Copper, Metallic Gold, Metallic Green, Metallic magenta, Metallic Silver, Navy blue, Orange, Pink, Process Blue, Purple, Red, Reflex Blue, Royal Blue, Teal, White","Y","","3""W x 1""H, 9""w x 1""h","Back only (optional) 3 colors max, Front & Back (optional) 2 colors max, Front only (standard) 3 colors max., Wraparound (optional) 2 colors max. (W x H - Wraparound optional (2 color max))",,,"Y",,"5","Y","1:	",,"","24:per Carton","","29:lbs",,"","N","",,,,,,"Dip Mug - 16 oz",,,"72","144","288","576","1008",,,,,,"5.55","5.24","5.03","4.91","4.75",,,,,,"R","R","R","R","R",,,,,,,"1 color imprint, 1 location",,"USD",,"List","Screen Print, Unimprinted","IMMD:Screen Print, Unimprinted",,"Set-up Charge","Per Order","Required","1",,,,,,,,,,"30.00",,,,,,,,,,"Z",,,,,,,,,,"per changeYou may order less than the minimum quantity",,,,,,,,,,,,,,"N",,,,,,"Promotional","N",,,"Y","None",,,,
5401668,,,,,,,,,,,,,,,,,,,,,,,,,,,,,,,,,,,,,,,,,,,,,,,,,,,,,,,,,,,,,,,,,,,,,,,,,,,,,,,,,,,,,,,,,,,,,,,"Product Sample","SMPL:Product Sample",,"Sample Charge","Other","Optional","1",,,,,,,,,,"50.00",,,,,,,,,,"Z",,,,,,,,,,"plus cost of productYou may order less than the minimum quantity",,,,,,,,,,,,,,,,,,,,,,,,,,,,,
